Kategori,Sıra,Ürün Adı,Fiyat,Link
Moda,#14,Calvin Klein Erkek Boxer Brief 3'Lü Paket,"929,90 TL",https://www.amazon.com.tr/Calvin-Klein-Boxer-Brief-Renkli/dp/B0DT4SLCFJ/ref=zg_bs_g_apparel_d_sccl_14/261-4426946-1087664?psc=1
Moda,#15,GoWith 3'lü-6'lı Bambu Renkli Spor Desenli Güçlendirilmiş Yıkamalı Kutulu Dikişsiz Koşu Yürüyüş Spor Performans Kısa Fit Patik Erkek Çorap,"469,90 TL",https://www.amazon.com.tr/GoWith-G%C3%BC%C3%A7lendirilmi%C5%9F-Y%C4%B1kamal%C4%B1-Performans-3150/dp/B08PZ986PL/ref=zg_bs_g_apparel_d_sccl_15/261-4426946-1087664?psc=1
Moda,#16,DeFacto Relax Fit Bisiklet Yaka Tunik,Fiyat Yok,https://www.amazon.com.tr/DeFacto-S7517AZ-Kad%C4%B1n-%C3%87izgili-Relax/dp/B09GBCGM7J/ref=zg_bs_g_apparel_d_sccl_16/261-4426946-1087664?psc=1
Moda,#17,Anthony Jackson 5'li Kutu Premium RİBANA Erkek Atlet SEZAR Ekstra Uzun- Taranmış İnce Fitilli Organik Pamuk,"549,90 TL",https://www.amazon.com.tr/Anthony-Jackson-Premium-Taranm%C4%B1%C5%9F-Fitilli/dp/B0CK8MDN81/ref=zg_bs_g_apparel_d_sccl_17/261-4426946-1087664?psc=1
Moda,#18,Anthony Jackson Likralı 3'lü Kutu Premium Erkek Boxer,"329,90 TL",https://www.amazon.com.tr/Anthony-Jackson-Likral%C4%B1-Premium-Erkek/dp/B0C6BK5SPX/ref=zg_bs_g_apparel_d_sccl_18/261-4426946-1087664?psc=1
Moda,#19,Zeus&Co. Ekstra Güçlü Ekstra Dayanıklı Tam Otomatik Şemsiye,"599,99 TL",https://www.amazon.com.tr/Zeus-Co-Dayan%C4%B1kl%C4%B1-Otomatik-%C5%9Eemsiye/dp/B09SZPLXJ6/ref=zg_bs_g_apparel_d_sccl_19/261-4426946-1087664?psc=1
Moda,#20,Charged Surge 4 Erkek Gri Koşu Ayakkabısı 3027000-106,Fiyat Yok,https://www.amazon.com.tr/Under-Armour-Charged-Ayakkab%C4%B1s%C4%B1-Antrasit/dp/B0BZXGKZ1G/ref=zg_bs_g_apparel_d_sccl_20/261-4426946-1087664?psc=1
Moda,#21,adidas Galaxy 7 M Spor Ayakkabı Erkek,"1.708,00 TL",https://www.amazon.com.tr/adidas-GALAXY-Erkek-Ayakkab%C4%B1-black/dp/B0CKXQX9XN/ref=zg_bs_g_apparel_d_sccl_21/261-4426946-1087664?psc=1
Moda,#22,AC&Co/Altınyıldız Classics Slim Fit Dar Kesim%100 Pamuk Bisiklet Yaka Kısa Kollu Tişört,"259,99 TL",https://www.amazon.com.tr/Alt%C4%B1ny%C4%B1ld%C4%B1z-Classics-Erkek-Beyaz-100-Bisiklet-Ti%C5%9F%C3%B6rt/dp/B0CNPY9GX2/ref=zg_bs_g_apparel_d_sccl_22/261-4426946-1087664?psc=1
Moda,#23,Adidas Erkek Terrex Eastrail 2 Shoes - Low Non Football,"2.485,00 TL",https://www.amazon.com.tr/adidas-Terrex-Eastrail-Y%C3%BCr%C3%BCy%C3%BC%C5%9F-Ayakkabisi/dp/B0BP7V471R/ref=zg_bs_g_apparel_d_sccl_23/261-4426946-1087664?psc=1
Moda,#24,PUMA Puma Smash 3.0 Buck Spor AyakkabıUnisex Yetişkin,Fiyat Yok,https://www.amazon.com.tr/PUMA-Yeti%C5%9Fkin-Ayakkab%C4%B1s%C4%B1-Pink-PUMA-White-Gold/dp/B0C6YW5HVZ/ref=zg_bs_g_apparel_d_sccl_24/261-4426946-1087664?psc=1
Moda,#25,Yılbaşı Desenli Renkli Çorap,Fiyat Yok,https://www.amazon.com.tr/Y%C4%B1lba%C5%9F%C4%B1-Noel-Desenli-Renkli-%C3%87orap/dp/B0BFRCN477/ref=zg_bs_g_apparel_d_sccl_25/261-4426946-1087664?psc=1
Moda,#26,"Casio A158WA-1DF Retro Unisex Kol Saati , Gri , Standart","1.013,61 TL",https://www.amazon.com.tr/Casio-A158WA-1DF-Retro-Unisex-Standart/dp/B000AQVRUG/ref=zg_bs_g_apparel_d_sccl_26/261-4426946-1087664?psc=1
Moda,#27,Calvin Klein SS 30S MICRO MONOLOGO GRAPHIC TE T-shirt Erkek,Fiyat Yok,https://www.amazon.com.tr/Calvin-Klein-Monologo-Graphic-Ti%C5%9F%C3%B6rt/dp/B0FBTNP687/ref=zg_bs_g_apparel_d_sccl_27/261-4426946-1087664?psc=1
Moda,#28,Anthony Jackson Premium Erkek Polo Yaka Triko Kazak Massimiliano,"849,90 TL",https://www.amazon.com.tr/Anthony-Jackson-Premium-Erkek-Massimiliano/dp/B0FTTCPFDT/ref=zg_bs_g_apparel_d_sccl_28/261-4426946-1087664?psc=1
Moda,#29,PUMA Suede Unisex Düşük Bilekli Ayakkabı 380823.0,"1.378,78 TL",https://www.amazon.com.tr/Shuffle-Ayakkab%C4%B1-Unisex-Yeti%C5%9Fkin-Black/dp/B082SDG984/ref=zg_bs_g_apparel_d_sccl_29/261-4426946-1087664?psc=1
Moda,#30,Calvin Klein SS CLASSIC FIT TEE Tişört Kadın,"1.049,00 TL",https://www.amazon.com.tr/Calvin-Klein-CLASSIC-Kad%C4%B1n-T-shirt/dp/B0DK42Y57D/ref=zg_bs_g_apparel_d_sccl_30/261-4426946-1087664?psc=1
Moda,#31,Sky Socks 10'lu Erkek Çemberli Renkli Patik Ekonomik Paket Kısa Spor Sneakers Çorap,"149,99 TL",https://www.amazon.com.tr/Sky-Socks-%C3%87emberli-Ekonomik-Sneakers/dp/B0F8W58P2Y/ref=zg_bs_g_apparel_d_sccl_31/261-4426946-1087664?psc=1
Moda,#32,Yılbaşı Desenli Kurabiyeli Renkli Çorap,Fiyat Yok,https://www.amazon.com.tr/Y%C4%B1lba%C5%9F%C4%B1-y%C4%B1ld%C4%B1zl%C4%B1-kurabiyeli-desenli-renkli/dp/B0CKRDB8R2/ref=zg_bs_g_apparel_d_sccl_32/261-4426946-1087664?psc=1
Moda,#33,GoWith 2'li-4'lü Alpaka Yünlü Termal Yıkamalı Yumuşak Doğal Kışlık Ayakkabı Bot İçin Kar Desen Kadın ve Erkek Çorap 3097,"709,90 TL",https://www.amazon.com.tr/GoWith-Y%C4%B1kamal%C4%B1-Yumu%C5%9Fak-Ayakkab%C4%B1-3097/dp/B0C2DGCVVZ/ref=zg_bs_g_apparel_d_sccl_33/261-4426946-1087664?psc=1
Moda,#34,Tommy Jeans TJM REG LINEN BLEND LS SHIRT EXT Gömlek Erkek,Fiyat Yok,https://www.amazon.com.tr/Tommy-Hilfiger-LINEN-BLEND-G%C3%B6mlek/dp/B0D7HVH94T/ref=zg_bs_g_apparel_d_sccl_34/261-4426946-1087664?psc=1
Moda,#35,Calvin Klein LS EU 350TERRY MONOLOGO CN SWTSH Sweatshirt Erkek,"3.146,00 TL",https://www.amazon.com.tr/Calvin-Klein-350Terry-Monologo-Sweatshirt/dp/B0FBTNFWWP/ref=zg_bs_g_apparel_d_sccl_35/261-4426946-1087664?psc=1
Moda,#36,Zeus&Co. Otomatik Rüzgarda Kırılmayan Şemsiye,"449,99 TL",https://www.amazon.com.tr/Zeus-Co-Otomatik-R%C3%BCzgarda-K%C4%B1r%C4%B1lmayan/dp/B07KN5RY5Q/ref=zg_bs_g_apparel_d_sccl_36/261-4426946-1087664?psc=1
Moda,#37,PUMA Puma Rickie Classic Spor AyakkabıUnisex Yetişkin,"2.581,00 TL",https://www.amazon.com.tr/PUMA-Unisex-Rickie-Classic-PUMA-White-PUMA/dp/B0D6VWR7NJ/ref=zg_bs_g_apparel_d_sccl_37/261-4426946-1087664?psc=1
Moda,#38,adidas GALAXY 7 W Spor AyakkabıKadın,"1.858,06 TL",https://www.amazon.com.tr/adidas-Kad%C4%B1n-GALAXY-Ayakkab%C4%B1-Futbol/dp/B0CYTD1P2F/ref=zg_bs_g_apparel_d_sccl_38/261-4426946-1087664?psc=1
Moda,#39,"FormStep M900 Memory Foam İç Ayakkabı Tabanlık - Ortopedik, Topuk Dikeni, Rahat, Koşu, Konfor, Darbe Emici (42-43)","189,80 TL",https://www.amazon.com.tr/FormStep-Ayakkab%C4%B1-tabanl%C4%B1k-Ortopedik-tabanl%C4%B1%C4%9F%C4%B1/dp/B0CB71HJ3S/ref=zg_bs_g_apparel_d_sccl_39/261-4426946-1087664?psc=1
Moda,#40,Anthony Jackson Likralı 3'lü Kutu Premium Erkek Boxer Özel Kolleksiyon,"329,90 TL",https://www.amazon.com.tr/Anthony-Jackson-Likral%C4%B1-Premium-Collection/dp/B0C8DB167H/ref=zg_bs_g_apparel_d_sccl_40/261-4426946-1087664?psc=1
Moda,#41,GoWith Alpaka Yünlü Termal Kalın Tam Havlulu Yıkamalı Yumuşak Doğal Kışlık Kadın Erkek Bot Çorabı 6005-6006,"299,90 TL",https://www.amazon.com.tr/GoWith-Alpaka-Y%C4%B1kamal%C4%B1-Yumu%C5%9Fak-6005-6006/dp/B0B9HSZTMJ/ref=zg_bs_g_apparel_d_sccl_41/261-4426946-1087664?psc=1
Moda,#42,"Jouis Şemsiye Otomatik Katlanır 8 Telli aç-kapa otomatik-şemsiye çantalı, teflon kaplama, rüzgar geçirmez küçük hafif kompakt seyahat golf şemsiyesi","218,20 TL",https://www.amazon.com.tr/Jouis-Otomatik-Katlan%C4%B1r-otomatik-%C5%9Femsiye-%C5%9Femsiyesi/dp/B0DLHM8J5D/ref=zg_bs_g_apparel_d_sccl_42/261-4426946-1087664?psc=1
Moda,#43,Levi's 512 Slim Taper Jeans Jean Pantolon Erkek,"1.315,00 TL",https://www.amazon.com.tr/Levis-Erkek-Pantolon-%C3%9Cretici-%C3%B6l%C3%A7%C3%BCs%C3%BC/dp/B0824FFYJN/ref=zg_bs_g_apparel_d_sccl_43/261-4426946-1087664?psc=1
Moda,#44,"NPCQUN Travel Essentials Şemsiye Rüzgar Geçirmez Kompakt Katlanabilir Işık, Otomatik, Güçlü ve Taşınabilir, Rüzgara Dayanıklı, Yağmur İçin Katlanır Küçük Şemsiye, Siyah / gün ışığı, Small","299,99 TL",https://www.amazon.com.tr/NPCQUN-Essentials-Katlanabilir-Ta%C5%9F%C4%B1nabilir-Dayan%C4%B1kl%C4%B1/dp/B09SV6FZ47/ref=zg_bs_g_apparel_d_sccl_44/261-4426946-1087664?psc=1
Moda,#45,Tom ve Jerry Soket Çorap Lisanslı İşlemeli,"35,74 TL",https://www.amazon.com.tr/Koton-3SAM80134AA-Erkek-Lisansl%C4%B1-%C4%B0%C5%9Flemeli/dp/B0C1YST2LN/ref=zg_bs_g_apparel_d_sccl_45/261-4426946-1087664?psc=1
Moda,#46,Erkek Desenli Premium Penye Pamuklu Likralı Boxer - 10'lu Set,Fiyat Yok,https://www.amazon.com.tr/VIEN-KARL-Erkek-Paket-Likral%C4%B1/dp/B09BJPXNY5/ref=zg_bs_g_apparel_d_sccl_46/261-4426946-1087664?psc=1
Mutfak,#1,"Stanley Quencher Pipetli Termos Bardak, Pembe Kuvars (Rose Quartz), 1.18 Litre","1.800,00 TL",https://www.amazon.com.tr/Stanley-Quencher-Pipetli-Termos-Bardak/dp/B0CNTWY3VM/ref=zg_bs_g_kitchen_d_sccl_1/261-4426946-1087664?psc=1
Mutfak,#2,"Stanley IceFlow Flip Straw Tumbler Pipetli Termos Bardak, Yeşil (Blue Cactus), 0.89 Litre","1.559,90 TL",https://www.amazon.com.tr/Stanley-IceFlow-Tumbler-Pipetli-Termos/dp/B0F4XXSH24/ref=zg_bs_g_kitchen_d_sccl_2/261-4426946-1087664?psc=1
Mutfak,#3,"Stanley The Aerolight Transit Mug Termos Bardak, Krem, 0.60 Litre","1.450,00 TL",https://www.amazon.com.tr/Stanley-Aerolight-Transit-Termos-Bardak/dp/B0F5X3TN41/ref=zg_bs_g_kitchen_d_sccl_3/261-4426946-1087664?psc=1
Mutfak,#4,"HONEYWELL QuietSet HYF260 Tüm Oda İçin Salınımlı Kule Vantilatör, 5 Hız Ayarı, 80 Derece Salınım, Zamanlayıcı Fonksiyonu, Aydınlatma, Otomatik Kapanma, Uzaktan Kumanda","1.282,77 TL",https://www.amazon.com.tr/HONEYWELL-Vantilat%C3%B6r-Zamanlay%C4%B1c%C4%B1-Fonksiyonu-Ayd%C4%B1nlatma/dp/B06W9LSS3V/ref=zg_bs_g_kitchen_d_sccl_4/261-4426946-1087664?psc=1
Mutfak,#5,"Philips 5500 Serisi LatteGo Tam Otomatik Espresso Makinesi, 20 Sıcak ve Soğuk İçecek, QuickStart, SilentBrew Teknolojisi, Dokunmatik Ekran, EP5547/90","22.499,00 TL",https://www.amazon.com.tr/Philips-LatteGo-Otomatik-Espresso-Makinesi/dp/B0CZ7D5DTQ/ref=zg_bs_g_kitchen_d_sccl_5/261-4426946-1087664?psc=1
Mutfak,#6,"BRITA MAXTRA PRO All-In-1 Yedek Su Arıtma Filtresi, 6’lı","949,00 TL",https://www.amazon.com.tr/BRITA-MAXTRA-Yedek-Ar%C4%B1tma-Filtresi/dp/B0CLNZ4NPV/ref=zg_bs_g_kitchen_d_sccl_6/261-4426946-1087664?psc=1
Mutfak,#7,"Stanley Classic Legendary Vakumlu Çelik Termos, Yeşil (Hammertone Green), 2.3 Litre","2.663,44 TL",https://www.amazon.com.tr/Stanley-Klasik-Vakumlu-Paslanmaz-Termos/dp/B0BKLPF6FX/ref=zg_bs_g_kitchen_d_sccl_7/261-4426946-1087664?psc=1
Mutfak,#8,PHILIPS CA6903/10 Espresso Makinesi Kireç ve Su Filtresi,"799,00 TL",https://www.amazon.com.tr/Philips-CA6903-10-AquaClean-Filtresi/dp/B0B5L4LYHZ/ref=zg_bs_g_kitchen_d_sccl_8/261-4426946-1087664?psc=1
Mutfak,#9,"Philips Tüy Toplama Makinesi, Tüm Giysiler için Uygundur, 2 Philips AA pil dahildir, Hassas Giysiler için, GC026/80","539,00 TL",https://www.amazon.com.tr/PHILIPS-GC026-80-Temizleme-Makinesi/dp/B07M8J529S/ref=zg_bs_g_kitchen_d_sccl_9/261-4426946-1087664?psc=1
Mutfak,#10,"Deconox Döküm Limon Sıkacağı Limon Presi Büyük Boy 24 cm, Siyah Metal Limon Sıkacağı, Döküm Narenciye Sıkacağı (DÖKÜM LİMON SIKICI)","158,95 TL",https://www.amazon.com.tr/Deconox-Narenciye-D%C3%96K%C3%9CM-L%C4%B0MON-SIKICI/dp/B0B5HMLBMG/ref=zg_bs_g_kitchen_d_sccl_10/261-4426946-1087664?psc=1
Mutfak,#11,"Philips 8000 Serisi Azur Buharlı Ütü - 3000W, OptimalTEMP Teknolojisi, 55g/dk Sürekli Buhar, Sıfır Yanık Riski, 300 ml'lik Su Haznesi (DST8021/30)","3.929,00 TL",https://www.amazon.com.tr/Philips-DST8021-30-Buharl%C4%B1-OptimalTEMP/dp/B0BJQK6GK4/ref=zg_bs_g_kitchen_d_sccl_11/261-4426946-1087664?psc=1
Mutfak,#12,"Bluefox Dijital Mutfak Terazisi - Paslanmaz Çelik Yüzeyli Hassas Mutfak Tartısı - Dara İşlevi, LED Ekran, 5 Birim Dönüştürme ve Otomatik Kapanma Özellikli - 5 kg Tartı Kapasitesi","299,00 TL",https://www.amazon.com.tr/Bluefox-Dijital-Terazisi-Paslanmaz-Tart%C4%B1s%C4%B1/dp/B08W34BD8J/ref=zg_bs_g_kitchen_d_sccl_12/261-4426946-1087664?psc=1
Mutfak,#13,"Versuni Philips kahve yağı çözücü tabletler, tam otomatik kahve makineleri için","317,00 TL",https://www.amazon.com.tr/Philips-CA6704-10-Ha%C5%9Flama-Kaffeefettloeser-tabletten-makineleri/dp/B074KQM1QG/ref=zg_bs_g_kitchen_d_sccl_13/261-4426946-1087664?psc=1
Mutfak,#14,"Philips Filtre Kahve Makinesi, 1,2 Lt Kapasite, Otomatik Kapanma, Cam Demlikli, Siyah ve Metal, HD7462/20","2.243,12 TL",https://www.amazon.com.tr/Philips-Hd7462-20-Makinesi-S%C3%BCrahi/dp/B00R04CAWA/ref=zg_bs_g_kitchen_d_sccl_14/261-4426946-1087664?psc=1
Mutfak,#15,"Philips 7500 Serisi Buharlı Ütü – 3200W Güç, 55 g/dk Sürekli Buhar, 260 g Güçlendirme, SteamGlide Elite Taban, Otomatik Kapanma, Damlama Önleyici Sistem, 300 ml Tank (DST7511/80)","2.999,00 TL",https://www.amazon.com.tr/Philips-DST7511-80-Buharl%C4%B1-S%C3%BCrekli/dp/B0BXM27M5X/ref=zg_bs_g_kitchen_d_sccl_15/261-4426946-1087664?psc=1
Mutfak,#16,"Stanley Classic Legendary Camp Mug Paslanmaz Çelik Termos Bardak, Pembe Kuvars (Rose Quartz), 0.35 Litre","999,00 TL",https://www.amazon.com.tr/STANLEY-Classic-Legendary-Termos-Kuvars/dp/B0CNTWPSMD/ref=zg_bs_g_kitchen_d_sccl_16/261-4426946-1087664?psc=1
Mutfak,#17,"COOK Premium Filtre Kahve Kağıdı - Ebat 4, 80 adet","160,10 TL",https://www.amazon.com.tr/COOK-Premium-Filtre-Kahve-Ka%C4%9F%C4%B1d%C4%B1/dp/B09W5YXJ85/ref=zg_bs_g_kitchen_d_sccl_17/261-4426946-1087664?psc=1
Mutfak,#18,"Philips 5000 Serisi Izgara ve Tost Makinesi - Ayarlanabilir sıcaklık, Geniş ızgara yüzeyi ve Yüksek Güç performansı, Çıkarılabilir yapışmaz plakalar ve yağ tepsisi (HD6301/90)","4.218,53 TL",https://www.amazon.com.tr/Philips-5000-Serisi-Izgara-Makinesi/dp/B0CZ9SHW6W/ref=zg_bs_g_kitchen_d_sccl_18/261-4426946-1087664?psc=1
Mutfak,#19,BRITA Maxtra Pro Kireç Uzmanı Yedek Su Arıtma Filtresi 6'lı,"1.091,55 TL",https://www.amazon.com.tr/BRITA-MAXTRA-Uzman%C4%B1-Ar%C4%B1tma-Filtresi/dp/B0CLV7GMXT/ref=zg_bs_g_kitchen_d_sccl_19/261-4426946-1087664?psc=1
Mutfak,#20,"Philips Daily Collection Narenciye Sıkacağı, 25W, 500 ml Meyve Suyu Sürahisi, Otomatik Yön Değiştirme, Kablo Saklama, HR2738/00","1.020,00 TL",https://www.amazon.com.tr/Philips-s%C4%B1kaca%C4%9F%C4%B1-narenciye-HR2738-00/dp/B00E38652C/ref=zg_bs_g_kitchen_d_sccl_20/261-4426946-1087664?psc=1
Mutfak,#21,"Philips Airfryer 3000 Serisi L - 4,1L, 13'ü 1 arada işlev, 7 ön ayarlı program,%90 daha az yağ, Rapid Air, HomeID tarif uygulaması, sıcak tutma, bulaşık makinesinde yıkanabilir (HD9243/90)","1.999,00 TL",https://www.amazon.com.tr/Philips-HD9243-90-Airfryer-Kapasite/dp/B0CD2KVVRC/ref=zg_bs_g_kitchen_d_sccl_21/261-4426946-1087664?psc=1
Mutfak,#22,"GuDoQi Dijital Gıda Termometresi - Hızlı ve Hassas Sıcaklık Ölçer | Et, Süt, Yağ, Su, Şeker, Çikolata, Fırın ve Barbekü Kullanımı için Mutfak Termometresi | LCD Ekranlı, Paslanmaz Çelik Prob","119,90 TL",https://www.amazon.com.tr/Dijital-Mutfak-Termometresi-Termometre-G%C4%B1da/dp/B01MRK7MU8/ref=zg_bs_g_kitchen_d_sccl_22/261-4426946-1087664?psc=1
Mutfak,#23,"Vicloon Silikon mutfak yardımcısı, 6 adet silikon spatula, çorba kaşığı, fırın fırçası, spatula, ısıya dayanıklı ve yapışmaz, paslanmaz çelik ve dikişsiz tek parça tasarım (siyah)","304,90 TL",https://www.amazon.com.tr/Vicloon-yard%C4%B1mc%C4%B1s%C4%B1-dayan%C4%B1kl%C4%B1-yap%C4%B1%C5%9Fmaz-paslanmaz/dp/B07QVDFB67/ref=zg_bs_g_kitchen_d_sccl_23/261-4426946-1087664?psc=1
Mutfak,#24,"BRITA Marella XL 3x Maxtra Pro All-in-1 Filtreli Su Arıtma Sürahisi - Beyaz 3,5 lt","1.049,00 TL",https://www.amazon.com.tr/BRITA-Marella-MAXTRA-ALL-Filtreli/dp/B0CLY97VY2/ref=zg_bs_g_kitchen_d_sccl_24/261-4426946-1087664?psc=1
Mutfak,#25,Tefal Titanyum 1X SimpleCook 24 Cm Difüzyon Tabanlı Tava - 2100118535,"699,00 TL",https://www.amazon.com.tr/Tefal-Titanium-Simple-Cook-Tava/dp/B09K44VN25/ref=zg_bs_g_kitchen_d_sccl_25/261-4426946-1087664?psc=1
Mutfak,#26,"papro Airfryer Pişirme Kağıdı, Fritöz Yağlı Kağıdı, Yanmaz Kağıt XXL Uyumlu 50 Adet (Kare) (1, Kare Büyük Boy 20x20)","135,00 TL",https://www.amazon.com.tr/Airfryer-Pi%C5%9Firme-Ka%C4%9F%C4%B1d%C4%B1-Frit%C3%B6z-Yanmaz/dp/B0CZDZ1932/ref=zg_bs_g_kitchen_d_sccl_26/261-4426946-1087664?psc=1
Mutfak,#27,"Busstier 1200 ml 2 Katlı 6 Bölmeli BPA'sız PP Plastik Sefer Tası ve Beslenme Çantası - Hava Kilitli Bento Lunch Box, Çatal ve Kaşık Dahil (Yeşil)","310,00 TL",https://www.amazon.com.tr/Busstier-B%C3%B6lmeli-Plastik-Beslenme-%C3%87antas%C4%B1/dp/B0DFVR4MWM/ref=zg_bs_g_kitchen_d_sccl_27/261-4426946-1087664?psc=1
Mutfak,#28,"Philips Daily Collection Mikser - 300W, 5 Hız + Turbo, Konik Uçlu Çırpıcılar, Hafif, Kaymaz Tutma, Kolay Temizlik, Bulaşık Makinesinde Yıkanabilir Aksesuarlar (HR3705/10)","999,00 TL",https://www.amazon.com.tr/Philips-Collection-Hr3705-10-Mikser/dp/B07H1WHH37/ref=zg_bs_g_kitchen_d_sccl_28/261-4426946-1087664?psc=1
Mutfak,#29,"Busstier Airfryer Pişirme Kağıdı, Fritöz Yağlı Kağıdı, Yanmaz Kağıt 50 Adet (Kare)","109,00 TL",https://www.amazon.com.tr/Airfryer-Pi%C5%9Firme-Ka%C4%9F%C4%B1d%C4%B1-Frit%C3%B6z-Yanmaz/dp/B0BWJM5CV9/ref=zg_bs_g_kitchen_d_sccl_29/261-4426946-1087664?psc=1
Mutfak,#30,"Philips Daily Collection Çay Makinesi - Otomatik Sıcak Tutma, 1.9L Su Isıtıcısı, 0.9L Cam Demlik, Hızlı Kaynatma 1700W, Kireç Filtresi, Kolay Dökme İçin Kablosuz Taban (HD7301/00)","1.724,80 TL",https://www.amazon.com.tr/Philips-Hd7301-00-Makinesi-Siyah/dp/B00KA5SULQ/ref=zg_bs_g_kitchen_d_sccl_30/261-4426946-1087664?psc=1
Mutfak,#31,"Philips 5000 Serisi El Blender - SpeedTrigger Kontrolü, 1200W Motor, Paslanmaz Çelik Bıçaklar, Bebek Maması Hazır, Mikser ve Gıda İşlemci Aksesuarları (HR2695/01)","3.719,00 TL",https://www.amazon.com.tr/HR2695-01-Kapasiteli-SpeedTrigger-Teknolojisi/dp/B0D1KVD99N/ref=zg_bs_g_kitchen_d_sccl_31/261-4426946-1087664?psc=1
Mutfak,#32,"Philips 1000 Serisi Hava Nemlendirici - Kuru Hava Belirtilerini Giderir, 41 m2'ye Kadar Odalar İçin Etkili, 32 Saat Çalışma Süresi, Aromaterapi Özelliği, SkyMist, Beyaz (HU1510/04)","3.499,00 TL",https://www.amazon.com.tr/Philips-1000-Serisi-Hava-Nemlendirici/dp/B0DDCQ3CJF/ref=zg_bs_g_kitchen_d_sccl_32/261-4426946-1087664?psc=1
Mutfak,#33,"Stanley Classic Legendary Yemek Termosu, Pembe Kuvars (Rose Quartz), 0.4 Litre","1.719,00 TL",https://www.amazon.com.tr/STANLEY-Classic-Legendary-ka%C5%9F%C4%B1kl%C4%B1-termos/dp/B0CNTVCWLL/ref=zg_bs_g_kitchen_d_sccl_33/261-4426946-1087664?psc=1
Mutfak,#34,"Stanley GO Quick Flip Paslanmaz Çelik Termos, Mavi (Azure), 0.7 Litre",Fiyat Yok,https://www.amazon.com.tr/Stanley-Quick-Paslanmaz-%C3%87elik-Termos/dp/B0CNTTY8ZJ/ref=zg_bs_g_kitchen_d_sccl_34/261-4426946-1087664?psc=1
Mutfak,#35,Kumtel LX-6331 Füme 2000 W Fanlı Isıtıcı,"774,99 TL",https://www.amazon.com.tr/Kumtel-LX-6331-F%C3%BCme-Fanl%C4%B1-Is%C4%B1t%C4%B1c%C4%B1/dp/B0FWKDV6F4/ref=zg_bs_g_kitchen_d_sccl_35/261-4426946-1087664?psc=1
Mutfak,#36,"Philips 5000 Serisi Türk Kahvesi Makinesi, Közde Türk Kahvesi Pişirme Fonksiyonu, Kullanımı Kolay Dokunmatik Tuşlar, Siyah & Metal, HDA150/61","1.789,00 TL",https://www.amazon.com.tr/HDA150-61-Fonksiyonu-Geleneksel-Kapasiteli/dp/B0CNW73SGV/ref=zg_bs_g_kitchen_d_sccl_36/261-4426946-1087664?psc=1
Mutfak,#37,Hario V60 02 Dripper Filtresi (100 Adet),"323,10 TL",https://www.amazon.com.tr/Hario-V60-Dripper-Filtresi-Adet/dp/B001U7EOYA/ref=zg_bs_g_kitchen_d_sccl_37/261-4426946-1087664?psc=1
Mutfak,#38,"Instant Pot Duo 7'si 1 Arada Akıllı Pişirici, 5.7 L, Düdüklü Tencere, Yumuşak Pişirici, Pilav Pişirici, Sote Tavası, Yoğurt Hazırlayıcı, Buharlı Pişirici Ve Yemek Isıtıcısı, Siyah/Paslanmaz Çelik","5.770,00 TL",https://www.amazon.com.tr/Instant-Pot-arada-Smart-Cooker/dp/B08Z4HCGDH/ref=zg_bs_g_kitchen_d_sccl_38/261-4426946-1087664?psc=1
Müzik Enstrümanları ve DJ,#1,Ernie Ball P02223 Super Slinky 09-42 Elektro Gitar Teli,"385,00 TL",https://www.amazon.com.tr/Ernie-Ball-Slinky-Nickel-Elektro/dp/B0002M6CW6/ref=zg_bs_g_musical-instruments_d_sccl_1/261-4426946-1087664?psc=1
Müzik Enstrümanları ve DJ,#2,Chroma Kaliteli METAL Gitar Bağlama Saz Kaposu - Kapo Capo Kelepçe & Sağlam Metal,"143,12 TL",https://www.amazon.com.tr/Chroma-Kaliteli-METAL-Ba%C4%9Flama-Kaposu/dp/B0BFXK7TYP/ref=zg_bs_g_musical-instruments_d_sccl_2/261-4426946-1087664?psc=1
Müzik Enstrümanları ve DJ,#3,Ernie Ball Hybrid Slinky Nickel Wound Electric Guitar Strings - 9-46 Gauge,"306,52 TL",https://www.amazon.com.tr/Ernie-Ball-Hybrid-Electric-Strings/dp/B0002PBS6S/ref=zg_bs_g_musical-instruments_d_sccl_3/261-4426946-1087664?psc=1
Müzik Enstrümanları ve DJ,#4,LASTVOİCE Nt-106 Tel Nota Sehpası Makaslı (Taşıma Çantalı),"370,35 TL",https://www.amazon.com.tr/LASTVO%C4%B0CE-Nt-106-Sehpas%C4%B1-Makasl%C4%B1-%C3%87antal%C4%B1/dp/B0C62D3RWB/ref=zg_bs_g_musical-instruments_d_sccl_4/261-4426946-1087664?psc=1
Müzik Enstrümanları ve DJ,#5,"Vic firth Baget(Çift) Nova 5A Wood, Hıckory, 16""X0.565"", Med","303,62 TL",https://www.amazon.com.tr/Vic-firth-Baget-H%C4%B1ckory-X0-565/dp/B0002E3GDC/ref=zg_bs_g_musical-instruments_d_sccl_5/261-4426946-1087664?psc=1
Müzik Enstrümanları ve DJ,#6,Yamaha YRS23 Soprano Blok Flüt,Fiyat Yok,https://www.amazon.com.tr/Yamaha-YRS-23Y-Fl%C3%BCt-Yrs-23/dp/B0014ZG676/ref=zg_bs_g_musical-instruments_d_sccl_6/261-4426946-1087664?psc=1
Müzik Enstrümanları ve DJ,#7,Elixir 12002 Nanoweb Super Light Elektro Gitar Teli (9-42),"536,90 TL",https://www.amazon.com.tr/Elixir-009-042-Elektro-Gitar-12002/dp/B0002E1O2W/ref=zg_bs_g_musical-instruments_d_sccl_7/261-4426946-1087664?psc=1
Müzik Enstrümanları ve DJ,#8,Coverzone 2 Adet Kablosuz Karaoke Mikrofonu 6.35mm Amfi hoparlör İçin ve Sahne Performansı Aktiviteler İçin Tak ve Çalıştır Kablosuz Mikrofon Dış Mekan Kullanıma Uygun WN04 Gri Renk (Çiftli WN-04),"999,90 TL",https://www.amazon.com.tr/Coverzone-Mikrofonu-Performans%C4%B1-Aktiviteler-Kullan%C4%B1ma/dp/B0DGTN3ZNG/ref=zg_bs_g_musical-instruments_d_sccl_8/261-4426946-1087664?psc=1
Müzik Enstrümanları ve DJ,#9,Blackstar IDCORE10V4 Combo Amplifikatör,"8.880,00 TL",https://www.amazon.com.tr/BLACKSTAR-IDCORE10V4-Blackstar-Combo-Amplifikat%C3%B6r/dp/B0CRZB9PF9/ref=zg_bs_g_musical-instruments_d_sccl_9/261-4426946-1087664?psc=1
Müzik Enstrümanları ve DJ,#10,Audio-Technica ATH-M20X Stüdyo Kulaklığı,"4.134,48 TL",https://www.amazon.com.tr/Audio-Technica-AUD-ATHM20X-Audio-Technica/dp/B00HVLUR18/ref=zg_bs_g_musical-instruments_d_sccl_10/261-4426946-1087664?psc=1
Müzik Enstrümanları ve DJ,#11,"fobun Kulaklık standı kulaklık tutucu jbl steelseries razer anker beats uyumlu kulaklık standı uninanersal enanrensel kulaklık tutucu Siyah, Fobun",Fiyat Yok,https://www.amazon.com.tr/Kulakl%C4%B1k-kulakl%C4%B1k-steelseries-universal-evrensel/dp/B0C6782HQV/ref=zg_bs_g_musical-instruments_d_sccl_11/261-4426946-1087664?psc=1
Müzik Enstrümanları ve DJ,#12,Chroma STG 101 Gitar Standı Saz Bağlama Enstrüman Gitar Sehpası,"499,95 TL",https://www.amazon.com.tr/Chroma-Stand%C4%B1-Ba%C4%9Flama-Enstr%C3%BCman-Sehpas%C4%B1/dp/B0BQWX2XLS/ref=zg_bs_g_musical-instruments_d_sccl_12/261-4426946-1087664?psc=1
Müzik Enstrümanları ve DJ,#13,Lino Melodika 32 Tuşlu Bez Çanta Pastel Yeşil,"333,72 TL",https://www.amazon.com.tr/Lino-Melodika-Tu%C5%9Flu-%C3%87anta-Pastel/dp/B0BJ68CHT7/ref=zg_bs_g_musical-instruments_d_sccl_13/261-4426946-1087664?psc=1
Müzik Enstrümanları ve DJ,#14,Lastvoice NB40 Stüdyo Masa Mikrofon Standı (50x50 Büyük Boy) Siyah,"740,39 TL",https://www.amazon.com.tr/Lastvoice-St%C3%BCdyo-Mikrofon-Stand%C4%B1-50x50/dp/B0BYJZ3B9G/ref=zg_bs_g_musical-instruments_d_sccl_14/261-4426946-1087664?psc=1
Müzik Enstrümanları ve DJ,#15,Elixir 16027 Nanoweb Phosphor Bronze Akustik Gitar Teli (11-52),"817,00 TL",https://www.amazon.com.tr/Elixir-011-052-Fosfor-Akustik-16027/dp/B000A6EUSW/ref=zg_bs_g_musical-instruments_d_sccl_15/261-4426946-1087664?psc=1
Müzik Enstrümanları ve DJ,#16,Midex KLX-870 Mor Renk Yüksek Kaliteli Ahşap Kalimba 17 Tuşlu Full Set,"586,50 TL",https://www.amazon.com.tr/Midex-KLX-870-Y%C3%BCksek-Kaliteli-Kalimba/dp/B0DL3GQT3N/ref=zg_bs_g_musical-instruments_d_sccl_16/261-4426946-1087664?psc=1
Müzik Enstrümanları ve DJ,#17,"Ernie Ball Gitar Askısı, Polipropilen (Pp), Bordo",Fiyat Yok,https://www.amazon.com.tr/Polipropilenden-yap%C4%B1lm%C4%B1%C5%9F-Ernie-gitar-ask%C4%B1s%C4%B1/dp/B0002D0EA6/ref=zg_bs_g_musical-instruments_d_sccl_17/261-4426946-1087664?psc=1
Müzik Enstrümanları ve DJ,#18,SANEC® Universal Pikap İğnesi Komple Kafasıyla Metal,"191,89 TL",https://www.amazon.com.tr/Universal-Pikap-%C4%B0%C4%9Fnesi-Komple-Kafas%C4%B1yla/dp/B0CDQ82QHH/ref=zg_bs_g_musical-instruments_d_sccl_18/261-4426946-1087664?psc=1
Müzik Enstrümanları ve DJ,#19,"D'Addario Exl120 Elektro Gitar Tel Seti, Xl, 9-42, Nickel Wound, Su","370,00 TL",https://www.amazon.com.tr/DAddario-09-42-Elektro-Gitar-Teller/dp/B0002H0A7E/ref=zg_bs_g_musical-instruments_d_sccl_19/261-4426946-1087664?psc=1
Müzik Enstrümanları ve DJ,#20,Midex UKX-233M Maun Concert Ukulele (Askı Çanta Metod Pena),"1.450,00 TL",https://www.amazon.com.tr/Midex-UKX-233M-Concert-Ukulele-%C3%87anta/dp/B0C55B3CL6/ref=zg_bs_g_musical-instruments_d_sccl_20/261-4426946-1087664?psc=1
Müzik Enstrümanları ve DJ,#21,Ernie Ball Earthwood Light 80/20 Bronze Akustik Gitar Telleri - 11-52 Gauge,"295,75 TL",https://www.amazon.com.tr/Ernie-Ball-Earthwood-Bronze-Akustik/dp/B0002PBS5Y/ref=zg_bs_g_musical-instruments_d_sccl_21/261-4426946-1087664?psc=1
Müzik Enstrümanları ve DJ,#22,Chroma Gitar Bağlama Ukulele Duvar Askı Standı + Dübel ve Vida dahil,"178,95 TL",https://www.amazon.com.tr/Gitar-Ba%C4%9Flama-Ukulele-Duvar-Stand%C4%B1/dp/B0D26J71CW/ref=zg_bs_g_musical-instruments_d_sccl_22/261-4426946-1087664?psc=1
Müzik Enstrümanları ve DJ,#23,LİNO MELODİKA 32 TUŞLU BEZ ÇANTA KIRMIZI,"324,45 TL",https://www.amazon.com.tr/L%C4%B0NO-MELOD%C4%B0KA-TU%C5%9ELU-%C3%87ANTA-KIRMIZI/dp/B0BJ69T4K8/ref=zg_bs_g_musical-instruments_d_sccl_23/261-4426946-1087664?psc=1
Müzik Enstrümanları ve DJ,#24,"Marshall Motif II A.N.C., TWS, Siyah","7.741,98 TL",https://www.amazon.com.tr/Marshall-Motif-N-C-TWS-Siyah/dp/B0CGZJDY84/ref=zg_bs_g_musical-instruments_d_sccl_24/261-4426946-1087664?psc=1
Müzik Enstrümanları ve DJ,#25,"D'Addario Pl009 Elektro Ve Akustik Tek Tel, E-(Mi), High Carbon St","52,00 TL",https://www.amazon.com.tr/Elektro-Akustik-Tek-H%C4%B1gh-Carbon/dp/B000EEJEYK/ref=zg_bs_g_musical-instruments_d_sccl_25/261-4426946-1087664?psc=1
