Kategori,Sıra,Ürün Adı,Fiyat,Link
Bahçe,#1,"Einhell 18V 4,0 Ah PXC Starter Kit (Başlangıç Seti)","1.483,00 TL",https://www.amazon.com.tr/Einhell-18V-Starter-Ba%C5%9Flang%C4%B1%C3%A7-Seti/dp/B01M3SPEZF/ref=zg_bs_g_garden_d_sccl_1/261-4426946-1087664?psc=1
Bahçe,#2,"Bluefox Dijital Oda Termometresi ve Nem Ölçer – LCD Ekranlı, Kompakt Higrometre, İç Mekan Sıcaklık ve Nem Takibi, Mıknatıslı & Ayaklı & Duvar Tipi Kullanım – Mutfak, Bebek Odası, Ofis, Sera için Uygun","199,00 TL",https://www.amazon.com.tr/Bluefox-Dijital-Oda-Termometresi-%C3%96l%C3%A7er/dp/B0BWSM4V67/ref=zg_bs_g_garden_d_sccl_2/261-4426946-1087664?psc=1
Bahçe,#3,"Einhell 18V 2,5 Ah PXC Starter Kit (Başlangıç Seti)","949,05 TL",https://www.amazon.com.tr/Einhell-18V-Starter-Ba%C5%9Flang%C4%B1%C3%A7-Seti/dp/B082TD4R4L/ref=zg_bs_g_garden_d_sccl_3/261-4426946-1087664?psc=1
Bahçe,#4,Xiaomi Mijia Miaomiao Dijital Termometre LCD Ekranlı Isı Nem Ölçer,"494,00 TL",https://www.amazon.com.tr/Xiaomi-Miaomiao-Dijital-Termometre-Ekranl%C4%B1/dp/B083Y1D8WB/ref=zg_bs_g_garden_d_sccl_4/261-4426946-1087664?psc=1
Bahçe,#5,"Bosch 18 V 4, 0 Ah Akü","3.115,80 TL",https://www.amazon.com.tr/Bosch-Home-Garden-1600A011T8-Ak%C3%BC/dp/B07669C4Y4/ref=zg_bs_g_garden_d_sccl_5/261-4426946-1087664?psc=1
Bahçe,#6,"Bahçe mobilyası örtüsü, bahçe mobilyası brandası, su geçirmez, rüzgar geçirmez, UV dayanıklı, bahçe mobilyası örtüsü, Bahçe Mobilya Brandası Masa Sandalye Koruma Örtüsü (GRI, (250 * 210 * 80))","759,05 TL",https://www.amazon.com.tr/mobilyas%C4%B1-brandas%C4%B1-ge%C3%A7irmez-dayan%C4%B1kl%C4%B1-Brandas%C4%B1/dp/B0F9FX44Y4/ref=zg_bs_g_garden_d_sccl_6/261-4426946-1087664?psc=1
Bahçe,#7,MF Botanik Vera Iç Mekan Bitki Toprağı 10 Litre Iç Mekan Çiçek Toprağı Toprak Harcı,"149,00 TL",https://www.amazon.com.tr/Mekan-Bitki-Topra%C4%9F%C4%B1-Litre-Toprak/dp/B09FFHDZW3/ref=zg_bs_g_garden_d_sccl_7/261-4426946-1087664?psc=1
Bahçe,#8,Busstier Fiber Saplı Balta Ergonomik Kaymaz Saplı Çelik Başlı Profesyonel Odun Kesme Balta Kamp ve Bahçe Kullanımı İçin Dayanıklı Darbe Emici Saplı Balta,"279,00 TL",https://www.amazon.com.tr/Busstier-Ergonomik-Profesyonel-Kullan%C4%B1m%C4%B1-Dayan%C4%B1kl%C4%B1/dp/B0FNN9V9VH/ref=zg_bs_g_garden_d_sccl_8/261-4426946-1087664?psc=1
Bahçe,#9,"ThermoPro TP53 Dokunmatik ve Işıklı Ekranlı Dijital Termometre, Yüksek Hassasiyetli İç Mekan Nem Ölçer, Hava Konfor Göstergeli Higrometre, Tüm Zamanlar/24 Saat Kayıt, Manyetik Standlı","589,50 TL",https://www.amazon.com.tr/ThermoPro-TP53-Ayd%C4%B1nlatmal%C4%B1-Profesyonel-Termo-Higrometre/dp/B079JXY1RC/ref=zg_bs_g_garden_d_sccl_9/261-4426946-1087664?psc=1
Bahçe,#10,"Einhell 18V 5,2 Ah Power-X-Change Plus, Akü","2.699,00 TL",https://www.amazon.com.tr/Einhell-18V-P-X-C-Plus-1260/dp/B01NCZCKHX/ref=zg_bs_g_garden_d_sccl_10/261-4426946-1087664?psc=1
Bahçe,#11,Bosch Bahçe Malası,"266,53 TL",https://www.amazon.com.tr/Bosch-06008B5300-Bah%C3%A7e-Malas%C4%B1/dp/B0CZWRW1C9/ref=zg_bs_g_garden_d_sccl_11/261-4426946-1087664?psc=1
Bahçe,#12,"Troy T 27220 Nacak, Siyah","481,37 TL",https://www.amazon.com.tr/Troy-T-27220-Nacak-Siyah/dp/B079HWQ8BW/ref=zg_bs_g_garden_d_sccl_12/261-4426946-1087664?psc=1
Bahçe,#13,DETAN HAMAM BÖCEĞİ YEMİ MAX,"285,00 TL",https://www.amazon.com.tr/DETAN-HAMAM-B%C3%96CE%C4%9E%C4%B0-YEM%C4%B0-MAX/dp/B0D49SJZZB/ref=zg_bs_g_garden_d_sccl_13/261-4426946-1087664?psc=1
Bahçe,#14,"Sonkir Toprak pH ölçer, MS02 3'ü 1 arada Toprak Nemi/Işık/pH Test Cihazı Bitki Bakımı için Bahçe Alet Kitleri, Bahçe, Çim, Çiftlik, İç ve Dış Mekan Kullanımı için Harika (Yeşil)","204,95 TL",https://www.amazon.com.tr/Sonkir-Toprak-Kitleri-%C3%87iftlik-Kullan%C4%B1m%C4%B1/dp/B07BR52P26/ref=zg_bs_g_garden_d_sccl_14/261-4426946-1087664?psc=1
Bahçe,#15,Bosch UniversalAquatak 135 Yüksek Basınçlı Yıkama Makinesi,"6.188,10 TL",https://www.amazon.com.tr/Bosch-Y%C3%BCksek-Bas%C4%B1n%C3%A7l%C4%B1-Y%C4%B1kama-Universalaquatak/dp/B06XRDTQFP/ref=zg_bs_g_garden_d_sccl_15/261-4426946-1087664?psc=1
Bahçe,#16,Yabidur Tibtrap Zehirsiz Fare Kapanı Yapışkanı,"123,41 TL",https://www.amazon.com.tr/Tibtrap-Zehirsiz-Fare-Kapan%C4%B1-Yap%C4%B1%C5%9Fkan%C4%B1/dp/B07YN481GW/ref=zg_bs_g_garden_d_sccl_16/261-4426946-1087664?psc=1
Bahçe,#17,Outdoor Outlet Orkide Toprağı 3 Lt,"134,99 TL",https://www.amazon.com.tr/Outdoor-Outlet-Orkide-Topra%C4%9F%C4%B1-Lt/dp/B0DGY1SWNX/ref=zg_bs_g_garden_d_sccl_17/261-4426946-1087664?psc=1
Bahçe,#18,Bayer K-Othrine AL 1 Litre Genel Haşere İlacı Hazır Sprey,"269,75 TL",https://www.amazon.com.tr/Bayer-K-Othrine-Genel-B%C3%B6cek-Ha%C5%9Fere/dp/B07HP7WF98/ref=zg_bs_g_garden_d_sccl_18/261-4426946-1087664?psc=1
Bahçe,#19,"Einhell 2x 4,0 Ah & Twincharger Kit, Akü & Şarj Cihazı","4.153,83 TL",https://www.amazon.com.tr/Einhell-Twincharger-Kit-%C5%9Earj-Cihaz%C4%B1/dp/B08LQHYX4C/ref=zg_bs_g_garden_d_sccl_19/261-4426946-1087664?psc=1
Bahçe,#20,Bosch Home and Garden Yüksek Basınçlı Yıkama Makinesi için besleme hortumu (3 metre),"744,93 TL",https://www.amazon.com.tr/Bosch-Bas%C4%B1n%C3%A7l%C4%B1-Cihazlar%C4%B1-Filtreli-Hortumu/dp/B0119VBQBA/ref=zg_bs_g_garden_d_sccl_20/261-4426946-1087664?psc=1
Bahçe,#21,ThermoPro TP49 Mini Dijital Nem Ölçer ve Termometre,"351,90 TL",https://www.amazon.com.tr/ThermoPro-TP49-higrometre-termometresi-termometre/dp/B07WCR5Y4B/ref=zg_bs_g_garden_d_sccl_21/261-4426946-1087664?psc=1
Bahçe,#22,"Bluefox Paslanmaz Çelik Izgara Mangal Temizleme Fırçası | Kazıyıcılı, 360º Kapsamlı, 3 Başlı, Ergonomik Tutacaklı Barbekü Fırçası","469,00 TL",https://www.amazon.com.tr/Bluefox-Paslanmaz-Temizleme-F%C4%B1r%C3%A7as%C4%B1-Kaz%C4%B1mal%C4%B1/dp/B095PQ83MM/ref=zg_bs_g_garden_d_sccl_22/261-4426946-1087664?psc=1
Bahçe,#23,"Einhell Akülü Budama Makası GE-LS 18 Li-Solo Power X-Change (18 V, Li-Ion, max. 28 mm dal çapı, bypass bıçaklar, güvenlik düğmesi, Softgrip, akü ve şarj cihazı dahil değildir) - 3408300","3.116,98 TL",https://www.amazon.com.tr/Einhell-X-Change-b%C4%B1%C3%A7aklar-g%C3%BCvenlik-Softgrip/dp/B08W56FL5Y/ref=zg_bs_g_garden_d_sccl_23/261-4426946-1087664?psc=1
Bahçe,#24,"2 adet Plastik Orkide Saksısı Seti 1,5 lt Gizli Tabaklı Şeffaf Saksı 145 x 135 mm","239,95 TL",https://www.amazon.com.tr/Plastik-Orkide-Saks%C4%B1s%C4%B1-Tabakl%C4%B1-%C5%9Eeffaf/dp/B0DRHYVZ1Z/ref=zg_bs_g_garden_d_sccl_24/261-4426946-1087664?psc=1
Bahçe,#25,"HTC-1 Dijital Termometre, İç Mekan Sıcaklık ve Nem Ölçer","219,99 TL",https://www.amazon.com.tr/HTC-1-Dijital-Termometre-Mekan-S%C4%B1cakl%C4%B1k/dp/B0DWKFSSBB/ref=zg_bs_g_garden_d_sccl_25/261-4426946-1087664?psc=1
Bahçe,#26,Genta Genel Kullanım Torfu Toprağı 20 Lt,"329,00 TL",https://www.amazon.com.tr/Genta-Genel-Kullan%C4%B1m-Torfu-Topra%C4%9F%C4%B1/dp/B0CL9XSTX2/ref=zg_bs_g_garden_d_sccl_26/261-4426946-1087664?psc=1
Bahçe,#27,"Bosch Professional GBA 18 Volt 5,0 Ah Li-Ion Akü","3.575,04 TL",https://www.amazon.com.tr/Bosch-Professional-GBA-Volt-Li-Ion/dp/B00IKI352E/ref=zg_bs_g_garden_d_sccl_27/261-4426946-1087664?psc=1
Bahçe,#28,"ToXA Begonya Saksı Tabaklı Drenajlı Mat Plastik Çiçek Saksısı (Yeşil, 3.3 Litre)","219,99 TL",https://www.amazon.com.tr/ToXA-Begonya-Tabakl%C4%B1-Drenajl%C4%B1-Plastik/dp/B0DKC8GB8F/ref=zg_bs_g_garden_d_sccl_28/261-4426946-1087664?psc=1
Bahçe,#29,Tibtrap Yapışkan Karasinek Tuzağı Zehirsiz Sinek Yapışkan Bandı,"80,00 TL",https://www.amazon.com.tr/Yap%C4%B1%C5%9Fkan-Sinek-Kapan%C4%B1-4-Ad/dp/B07FXXDMDG/ref=zg_bs_g_garden_d_sccl_29/261-4426946-1087664?psc=1
Bahçe,#30,"Einhell Akülü Dal Budama Testeresi GE-PS 18/15 Li BL-Solo Power X-Change (18 V, kömürsüz motor, 12,5 cm kesim uzunluğu, aletsiz zincir ve kılavuz değişimi, akü dahil değildir) - 4600040","3.274,99 TL",https://www.amazon.com.tr/Einhell-GE-PS-18-15-Testeresi/dp/B0CCW217QV/ref=zg_bs_g_garden_d_sccl_30/261-4426946-1087664?psc=1
Bahçe,#31,"Einhell 2x18V 4,0 Ah PXC-Twinpack CB 2, Akü","3.249,61 TL",https://www.amazon.com.tr/Einhell-PXC-Twinpack-Volks-Ak%C3%BC-cihazlar%C4%B1-uyarlanm%C4%B1%C5%9F/dp/B07NJ727HW/ref=zg_bs_g_garden_d_sccl_31/261-4426946-1087664?psc=1
Bahçe,#32,MF Botanik Vera Saksı Harcı İthal Torf Cocopeat Karışımı Genel Kullanım Saksı Toprağı 10 LİTRE,"149,00 TL",https://www.amazon.com.tr/MF-Botanik-Saks%C4%B1-Cocopeat-Kar%C4%B1%C5%9F%C4%B1m%C4%B1/dp/B08LRLSJLD/ref=zg_bs_g_garden_d_sccl_32/261-4426946-1087664?psc=1
Bahçe,#33,"Bosch Home and Garden Akü PBA 18 V 4,0 Ah - PowerPlus (1 akü 18 V 4,0 Ah, 18 V sistem, bir kutuda teslimat)","3.248,99 TL",https://www.amazon.com.tr/Bosch-PowerPlus-Volt-sistem-kartonda/dp/B09HN225CF/ref=zg_bs_g_garden_d_sccl_33/261-4426946-1087664?psc=1
Bahçe,#34,Bestway H2OGO! Tsunami Splash Ramp Çift Kaydırak 488 cm,"1.445,00 TL",https://www.amazon.com.tr/Bestway-H2OGO-Tsunami-Splash-Kayd%C4%B1rak/dp/B095XL8YTL/ref=zg_bs_g_garden_d_sccl_34/261-4426946-1087664?psc=1
Bahçe,#35,"Bosch Professional GBL 800E CE Üfleyici (820 W, Hacimsel debi: 4,5 m³/dak)","2.880,00 TL",https://www.amazon.com.tr/Bosch-Professional-GBL-800E-%C3%9Cfleyici/dp/B07CZGXXBQ/ref=zg_bs_g_garden_d_sccl_35/261-4426946-1087664?psc=1
Bahçe,#36,"Bosch Professional GBL 18V-120 Akülü Üfleyici (18 Volt, SOLO, Hava debisi: 120 m³/s, Karton Kutuda)",Fiyat Yok,https://www.amazon.com.tr/Bosch-Professional-V-120-Ak%C3%BCl%C3%BC-%C3%9Cfleyici/dp/B01K4GC03O/ref=zg_bs_g_garden_d_sccl_36/261-4426946-1087664?psc=1
Bahçe,#37,Bosch Home and Garden Yüksek Basınçlı Yıkamalar için 6 Metre Hortum Uzatması (160 Bar'A Kadar Olan Makineler için Uygundur),"786,22 TL",https://www.amazon.com.tr/Bosch-Bas%C4%B1n%C3%A7l%C4%B1-Y%C4%B1kamalar-Uzatmas%C4%B1-makineler/dp/B06W54V82P/ref=zg_bs_g_garden_d_sccl_37/261-4426946-1087664?psc=1
Bahçe,#38,Chrysamed Fibron Gel Bocek Ilaci 5 Gr,"169,00 TL",https://www.amazon.com.tr/CHRYSAMED-Fibron-B%C3%B6ce%C4%9Fi-Kar%C4%B1nca-Hamamb%C3%B6ce%C4%9Fi/dp/B07HKNDFFV/ref=zg_bs_g_garden_d_sccl_38/261-4426946-1087664?psc=1
Bebek,#1,Prima Bebek Bezi Premium Care 5 Numara 108 Adet Aylık Fırsat Paketi,"1.436,25 TL",https://www.amazon.com.tr/Prima-Premium-Junior-F%C4%B1rsat-Paketi/dp/B0855QQ9V4/ref=zg_bs_g_baby-products_d_sccl_1/261-4426946-1087664?psc=1
Bebek,#2,Prima Bebek Bezi Premium Care 4 Numara 126 Adet Aylık Fırsat Paketi,"1.435,00 TL",https://www.amazon.com.tr/Prima-Bebek-Premium-F%C4%B1rsat-Paketi/dp/B0855HV1ZB/ref=zg_bs_g_baby-products_d_sccl_2/261-4426946-1087664?psc=1
Bebek,#3,Prima Bebek Bezi Premium Care 1 Numara 70 Adet Yenidoğan Ekonomik Paket,"520,00 TL",https://www.amazon.com.tr/Prima-Bebek-Premium-Beden-Yenido%C4%9Fan/dp/B0855K179T/ref=zg_bs_g_baby-products_d_sccl_3/261-4426946-1087664?psc=1
Bebek,#4,Prima Bebek Bezi Premium Care 3 Beden 52 Adet Midi Jumbo Paket,"530,00 TL",https://www.amazon.com.tr/Prima-Bebek-Premium-Beden-Jumbo/dp/B0855CDL9B/ref=zg_bs_g_baby-products_d_sccl_4/261-4426946-1087664?psc=1
Bebek,#5,"Molfix Bebek Bezi 3D Junior 5 Beden Aylık Paket 78 Adet, Beyaz","356,96 TL",https://www.amazon.com.tr/Molfix-Bebek-Junior-Beden-Ayl%C4%B1k/dp/B09Y2CYGRT/ref=zg_bs_g_baby-products_d_sccl_5/261-4426946-1087664?psc=1
Bebek,#6,Prima Bebek Bezi Premium Care 6 Numara 62 Adet Ultra Fırsat Paketi,"951,21 TL",https://www.amazon.com.tr/Prima-Premium-Numara-F%C4%B1rsat-Paketi/dp/B08FB8112M/ref=zg_bs_g_baby-products_d_sccl_6/261-4426946-1087664?psc=1
Bebek,#7,"Philips Avent Ultra Air Emzik, Erkek Bebekler için 0-6 Ay, 2’li Paket, Ortodontik Silikon, Geniş Hava Delikli, Mikrodalga Sterilize Edilebilir, BPA İçermez, Taşıma Kutulu, SCF080/05","413,33 TL",https://www.amazon.com.tr/Bebekler-Ortodontik-Mikrodalga-Sterilize-Edilebilir/dp/B09RGHFFV1/ref=zg_bs_g_baby-products_d_sccl_7/261-4426946-1087664?psc=1
Bebek,#8,Prima Bebek Bezi Premium Care 2 Numara 60 Adet Ekonomik Paket,"550,00 TL",https://www.amazon.com.tr/Prima-Bebek-Premium-Beden-Jumbo/dp/B0855RGKMQ/ref=zg_bs_g_baby-products_d_sccl_8/261-4426946-1087664?psc=1
Bebek,#9,"Prima Aktif Bebek, Bebek Bezi 6 Numara, 102 Adet Aylık Fırsat Paketi","1.081,71 TL",https://www.amazon.com.tr/Prima-Bebek-Ekstra-F%C4%B1rsat-Paketi/dp/B07JRDTC67/ref=zg_bs_g_baby-products_d_sccl_9/261-4426946-1087664?psc=1
Bebek,#10,Pampers Prima Islak Havlu Mendil Aqua Pure 432 Yaprak 9'lu Fırsat Paketi,"990,00 TL",https://www.amazon.com.tr/Pampers-Prima-Islak-Mendil-Paket/dp/B07PV4X5CM/ref=zg_bs_g_baby-products_d_sccl_10/261-4426946-1087664?psc=1
Bebek,#11,UNI BABY ŞAMPUAN 900 ML,"119,99 TL",https://www.amazon.com.tr/Uni-Baby-%C5%9Eampuan-900-ml/dp/B0BQJPQ3VM/ref=zg_bs_g_baby-products_d_sccl_11/261-4426946-1087664?psc=1
Bebek,#12,"Prima Aktif Bebek, Bebek Bezi 4 Numara, 136 Adet Aylık Fırsat Paketi","926,10 TL",https://www.amazon.com.tr/Prima-Bebek-Aktif-F%C4%B1rsat-Paketi/dp/B084JJ8ZP1/ref=zg_bs_g_baby-products_d_sccl_12/261-4426946-1087664?psc=1
Bebek,#13,Bepanthol Baby Pişik Önleyici Merhem 100 gr,"369,00 TL",https://www.amazon.com.tr/Bepanthol-Pi%C3%BEik-%C3%96nlemeye-Yard%C3%BDmc%C3%BD-Merhem/dp/B07BQW1TH7/ref=zg_bs_g_baby-products_d_sccl_13/261-4426946-1087664?psc=1
Bebek,#14,Prima Bebek Bezi Aktif Bebek 5 Beden 116 Adet Junior Aylık Fırsat Paketi,"1.081,71 TL",https://www.amazon.com.tr/Prima-Bebek-Junior-F%C4%B1rsat-Paketi/dp/B07JR6JJTL/ref=zg_bs_g_baby-products_d_sccl_14/261-4426946-1087664?psc=1
Bebek,#15,Sleepy Bio Natural Yenidoğan Islak Bebek Bakım Havlusu 24X40 Adet,"615,60 TL",https://www.amazon.com.tr/Sleepy-Natural-Yenido%C4%9Fan-Islak-Havlusu/dp/B09YYS5NHX/ref=zg_bs_g_baby-products_d_sccl_15/261-4426946-1087664?psc=1
Bebek,#16,Prima Bebek Bezi Premium Care 7 Numara 80 Adet Aylık Fırsat Paketi,"1.299,90 TL",https://www.amazon.com.tr/Prima-Premium-Numara-F%C4%B1rsat-Paketi/dp/B08FB7SJDH/ref=zg_bs_g_baby-products_d_sccl_16/261-4426946-1087664?psc=1
Bebek,#17,Prima Premium Care Külot Bebek Bezi 5 Numara 34 Adet Junior,"441,35 TL",https://www.amazon.com.tr/Prima-Premium-K%C3%BClot-Bebek-Junior/dp/B07HLY8LV1/ref=zg_bs_g_baby-products_d_sccl_17/261-4426946-1087664?psc=1
Bebek,#18,Prima Külot Bebek Bezi 6 Numara 52'li 15+ kg Fırsat Paketi,"712,50 TL",https://www.amazon.com.tr/Prima-K%C3%BClot-Bebek-F%C4%B1rsat-Paketi/dp/B09FL7PX46/ref=zg_bs_g_baby-products_d_sccl_18/261-4426946-1087664?psc=1
Bebek,#19,Uni Baby Yenidoğan 480 Yaprak Islak Mendil Beyaz (12 x 40 Adet),"409,90 TL",https://www.amazon.com.tr/Uni-Baby-Yenido%C4%9Fan-Mendil-Yaprak/dp/B0979P122P/ref=zg_bs_g_baby-products_d_sccl_19/261-4426946-1087664?psc=1
Bebek,#20,Uni Baby İlk Adım Islak Mendil Beyaz 24x52 1248 Yaprak,"523,79 TL",https://www.amazon.com.tr/Uni-Baby-Islak-Mendil-Yaprak/dp/B09D7F8V76/ref=zg_bs_g_baby-products_d_sccl_20/261-4426946-1087664?psc=1
Bebek,#21,"WaterWipes Yeni Doğan & Hassas Ciltler için 720 Yaprak Bebek Islak Mendili (12 x 60 Adet), Bitki Tabanlı","2.824,00 TL",https://www.amazon.com.tr/WaterWipes-Mendilleri-12x60l%C4%B1-Biyobozunur-Kokusuz/dp/B08MXSBRSB/ref=zg_bs_g_baby-products_d_sccl_21/261-4426946-1087664?psc=1
Bebek,#22,"Uni Baby Hassas Dokunuş Islak Mendil, 24 x 52 Yaprak, 6 - 12 Ay","580,45 TL",https://www.amazon.com.tr/Baby-Hassas-Dokunu%C5%9F-Paket-Yaprak/dp/B0979M3PCH/ref=zg_bs_g_baby-products_d_sccl_22/261-4426946-1087664?psc=1
Bebek,#23,Sleepy Sensitive Islak Havlu 12 x 90'lı 12 Paket 1080 Yaprak,Fiyat Yok,https://www.amazon.com.tr/Sleepy-Sensitive-Islak-Havlu-Yaprak/dp/B08SMLCKD9/ref=zg_bs_g_baby-products_d_sccl_23/261-4426946-1087664?psc=1
Bebek,#24,Prima Külot Bebek Bezi Premium Care 6 Numara 28 Adet,"441,35 TL",https://www.amazon.com.tr/Prima-Premium-K%C3%BClot-Bebek-Ekstra/dp/B07J6XN2VT/ref=zg_bs_g_baby-products_d_sccl_24/261-4426946-1087664?psc=1
Bebek,#25,"Molfix Fırsat Paketi Yenidoğan 1 Beden Bebek Bezi (1 x 82 Adet), Beyaz","239,95 TL",https://www.amazon.com.tr/Molfix-Bebek-Yenido%C4%9Fan-F%C4%B1rsat-Paketi/dp/B07DQK1GRB/ref=zg_bs_g_baby-products_d_sccl_25/261-4426946-1087664?psc=1
Bebek,#26,Prima Bebek Bezi Aktif Bebek 8 Beden 31 Adet Fırsat Paketi,"549,95 TL",https://www.amazon.com.tr/Prima-Bebek-Aktif-F%C4%B1rsat-Paketi/dp/B07RPYJTXV/ref=zg_bs_g_baby-products_d_sccl_26/261-4426946-1087664?psc=1
Bebek,#27,Sleepy Bio Natural Gross Paket Bebek Bezi 5 Numara Junior 100 Adet,"449,99 TL",https://www.amazon.com.tr/Sleepy-Natural-Gross-Numara-Junior/dp/B0D3FF7HP4/ref=zg_bs_g_baby-products_d_sccl_27/261-4426946-1087664?psc=1
Bebek,#28,Pampers Prima Harmonie Bebek Bezi İkiz Paket 2 Beden 39 Adet,"554,00 TL",https://www.amazon.com.tr/Pampers-Prima-Harmonie-Bebek-Paket/dp/B09KXZJ1LZ/ref=zg_bs_g_baby-products_d_sccl_28/261-4426946-1087664?psc=1
Bebek,#29,"Maoever Burun duş seti, burun temizleme ve burun durulama için burun yıkayıcı，BPA içermez, 300 ml, 30 burun yıkama tuzu paketi ve çıkartma termometresi","1.181,34 TL",https://www.amazon.com.tr/temizleme-durulama-y%C4%B1kay%C4%B1c%C4%B1%EF%BC%8CBPA-%C3%A7%C4%B1kartma-termometresi/dp/B07HQ91761/ref=zg_bs_g_baby-products_d_sccl_29/261-4426946-1087664?psc=1
Bebek,#30,Molfix Maxi 4 Beden Aylık Bebek Bezi (1 x 100 Adet),"356,96 TL",https://www.amazon.com.tr/Molfix-Maxi-Beden-Ayl%C4%B1k-Bebek/dp/B09Y2D71VK/ref=zg_bs_g_baby-products_d_sccl_30/261-4426946-1087664?psc=1
Bebek,#31,Uni Baby Aile Islak Mendil 12x90 1080 Yaprak,"343,37 TL",https://www.amazon.com.tr/Uni-Baby-Islak-Mendil-Yaprak/dp/B0BZ52XB63/ref=zg_bs_g_baby-products_d_sccl_31/261-4426946-1087664?psc=1
Bebek,#32,Ecowell Organik Bebek Şampuanı (1 x 300 mL),"322,00 TL",https://www.amazon.com.tr/Ecowell-Bebek-%C5%9Eampuan%C4%B1-300-Ml/dp/B089ZL4JLW/ref=zg_bs_g_baby-products_d_sccl_32/261-4426946-1087664?psc=1
Bebek,#33,Prima Harmonie Aqua Islak Mendil 144 Yaprak (48 x 3 Paket),"342,95 TL",https://www.amazon.com.tr/Prima-Islak-Mendil-Yaprak-Paket/dp/B07DTNM226/ref=zg_bs_g_baby-products_d_sccl_33/261-4426946-1087664?psc=1
Bebek,#34,Molfix Pure&Soft Ultra Avantaj Paketi Extra Large 6 Beden Bebek Bezi (1 x 54 Adet),"399,00 TL",https://www.amazon.com.tr/Molfix-Ultra-Avantaj-Paketi-Extra/dp/B09Y2BBYGW/ref=zg_bs_g_baby-products_d_sccl_34/261-4426946-1087664?psc=1
Bebek,#35,Johnson's Baby Bebek Şampuanı 750 ml,"139,95 TL",https://www.amazon.com.tr/Johnsons-Baby-%C5%9Eampuan-750-ml/dp/B07NY841N1/ref=zg_bs_g_baby-products_d_sccl_35/261-4426946-1087664?psc=1
Bebek,#36,Sudocrem Bebek Bakım Kremi 400 g,"492,00 TL",https://www.amazon.com.tr/Sudocrem-Bebek-Bak%C4%B1m-Kremi-400/dp/B088TXCYV1/ref=zg_bs_g_baby-products_d_sccl_36/261-4426946-1087664?psc=1
Bebek,#37,"Uni Baby Biberon Ve Emzik Temizleyici, 500 ml","89,90 TL",https://www.amazon.com.tr/Uni-Baby-Biberon-Emzik-Temizleyici/dp/B07DDF266M/ref=zg_bs_g_baby-products_d_sccl_37/261-4426946-1087664?psc=1
Bebek,#38,"Philips Avent Pipetli Bardak, 12 Ay+, 300 ml, Desenli, Damlatmaz, Kolay Tutuş, Bulaşık Makinesinde Yıkanabilir, BPA İçermez, Yeşil, SCF798/01",Fiyat Yok,https://www.amazon.com.tr/Damlatmaz-Makinesinde-Y%C4%B1kanabilir-SCF798-01/dp/B01N9ZANEV/ref=zg_bs_g_baby-products_d_sccl_38/261-4426946-1087664?psc=1
Bebek,#39,Uni Baby Bebek Temizleme Pamuğu 6*60 Adet,"420,00 TL",https://www.amazon.com.tr/Uni-Baby-Bebek-Temizleme-Pamu%C4%9Fu/dp/B0BRYB9LNY/ref=zg_bs_g_baby-products_d_sccl_39/261-4426946-1087664?psc=1
Bebek,#40,"Bioderma ABCDerm Bebek ve Çocuk için Dermatolojik ve Tuzsuz Yüz, Saç, Vücut Şampuanı Normal ve Kuru Ciltler","975,00 TL",https://www.amazon.com.tr/BiodermaABCDerm-Dermatolojik-Tuzsuz-%C5%9Eampuan%C4%B1-Ciltler/dp/B00569UIY8/ref=zg_bs_g_baby-products_d_sccl_40/261-4426946-1087664?psc=1
Bebek,#41,Prima Bebek Bezi Premium Care 0 Numara 30 Adet,"162,49 TL",https://www.amazon.com.tr/Prima-Bebek-Premium-Beden-Premat%C3%BCre/dp/B07HRGCHT6/ref=zg_bs_g_baby-products_d_sccl_41/261-4426946-1087664?psc=1
Bebek,#42,"Baby Einstein 11749 Oyun Halısı, Çok Renkli","2.218,16 TL",https://www.amazon.com.tr/Baby-Einstein-11749-Hal%C4%B1s%C4%B1-Renkli/dp/B07MPCCDM7/ref=zg_bs_g_baby-products_d_sccl_42/261-4426946-1087664?psc=1
Bebek,#43,PADDLERS 4X10 ADET BEBEK BAKIM ÖRTÜSÜ (60X60 Boyutunda),"308,72 TL",https://www.amazon.com.tr/Paddlers-8681371832753-%C3%96rt%C3%BCs%C3%BC-Boyutunda-Renkli/dp/B094N5X664/ref=zg_bs_g_baby-products_d_sccl_43/261-4426946-1087664?psc=1
Bebek,#44,Sleepy Natural Yenidoğan Islak Bebek Bakım Havlusu 24X90 Adet,"880,88 TL",https://www.amazon.com.tr/Sleepy-Natural-Yenido%C4%9Fan-Islak-Havlusu/dp/B09YYPX2GC/ref=zg_bs_g_baby-products_d_sccl_44/261-4426946-1087664?psc=1
Bebek,#45,Kidkid Yüksek Güvenlikli Çekmece ve Dolap Kilidi 5 Adet,"269,91 TL",https://www.amazon.com.tr/Kidkid-Y%C3%BCksek-G%C3%BCvenlikli-%C3%87ekmece-Kilidi/dp/B0CMVLDSST/ref=zg_bs_g_baby-products_d_sccl_45/261-4426946-1087664?psc=1
Bebek,#46,Bebevo VM903 Bebek Monitörü (Beyaz),"2.685,00 TL",https://www.amazon.com.tr/Bebevo-VM903-Bebek-Monit%C3%B6r%C3%BC/dp/B07BQDBXL8/ref=zg_bs_g_baby-products_d_sccl_46/261-4426946-1087664?psc=1
Bilgisayar,#1,OBEV Taşınabilir Laptop Stant Bilgisayar Stant Notebook Stant Tüm Laptoplarla Uyumlu Bilgisayar Standı Taşınabilir Metal Kaymaz Stant Dizüstü Bilgisayar Stantları Stantı,"249,90 TL",https://www.amazon.com.tr/Ta%C5%9F%C4%B1nabilir-Bilgisayar-Notebook-Laptoplarla-Stantlar%C4%B1/dp/B0BHHTZD6R/ref=zg_bs_g_computers_d_sccl_1/261-4426946-1087664?psc=1
Bilgisayar,#2,Baseus Ingenuity Type-C to USB 3.1 Çevirici,"159,00 TL",https://www.amazon.com.tr/Baseus-Ingenuity-Type-C-USB-%C3%87evirici/dp/B0B2V8DZ46/ref=zg_bs_g_computers_d_sccl_2/261-4426946-1087664?psc=1
Bilgisayar,#3,"Apple A16 çipli iPad: 11 inç Liquid Retina Ekran, 128 GB, Wi-Fi 6, 12 MP Ön Kamera/12 MP Arka Kamera, Touch ID, Tüm Gün Süren Pil Ömrü — Gümüş Rengi","17.469,00 TL",https://www.amazon.com.tr/Apple-A16-%C3%A7ipli-iPad-Liquid/dp/B0DZ7845XP/ref=zg_bs_g_computers_d_sccl_3/261-4426946-1087664?psc=1
Bilgisayar,#4,"Klasse Classic Mouse Pad, Dikişli Kenar, Kaymaz Taban, Büyük Boy Pürüzsüz Yüzey, Baskısız Ofis Tipi Masa Koruyucu, Ergonomik Mouse Ped (90x40 cm - XX Large, Siyah)","299,90 TL",https://www.amazon.com.tr/Classic-P%C3%BCr%C3%BCzs%C3%BCz-Bask%C4%B1s%C4%B1z-Koruyucu-Ergonomik/dp/B0BPR551ZB/ref=zg_bs_g_computers_d_sccl_4/261-4426946-1087664?psc=1
Bilgisayar,#5,"North Bayou Nb F80 17-30 "" LCD / LED Monitör Tutucu Kol Amortisörlü Vesa Monitör Standı 2-9 Kg Yeni","1.135,00 TL",https://www.amazon.com.tr/F80-Monit%C3%B6r-Tutucu-Amortis%C3%B6rl%C3%BC-Stand%C4%B1/dp/B01AI2YGK4/ref=zg_bs_g_computers_d_sccl_5/261-4426946-1087664?psc=1
Bilgisayar,#6,Apple USB-C - Lightning Kablosu (1 m),"799,00 TL",https://www.amazon.com.tr/Apple-MUQ93ZM-A-USB-C-Lightning/dp/B0CX23929Q/ref=zg_bs_g_computers_d_sccl_6/261-4426946-1087664?psc=1
Bilgisayar,#7,Spigen USB-C to USB-C 1 Metre Kablo 60W Güç/PPS 2.0 Desteği Super Hızlı Şarj / 480 Mbps Data Aktarım Hızı Type-C Ekstra Dayanıklı Black - ACA08718,"199,90 TL",https://www.amazon.com.tr/Spigen-Deste%C4%9Fi-Aktar%C4%B1m-Type-C-Dayan%C4%B1kl%C4%B1/dp/B0F2MHMCNM/ref=zg_bs_g_computers_d_sccl_7/261-4426946-1087664?psc=1
Bilgisayar,#8,"KIOXIA TransMemory U366 64GB USB Bellek – USB 3.2 Gen 1, Metal","219,00 TL",https://www.amazon.com.tr/KIOXIA-64GB-METAL-FLASH-BELLEK/dp/B09J3WD62J/ref=zg_bs_g_computers_d_sccl_8/261-4426946-1087664?psc=1
Bilgisayar,#9,"Logitech M171 Kablosuz Mouse, PC, Mac, Dizüstü Bilgisayar için, 2,4 GHz, USB Mini Alıcılı, Optik İzleme, 12 Aylık Pil Ömrü, Sağ ve Sol Elle Kullanıma Uygun, Kırmızı","354,75 TL",https://www.amazon.com.tr/Logitech-Kablosuz-Mouse-K%C4%B1rm%C4%B1z%C4%B1-910-004641/dp/B019RPQML4/ref=zg_bs_g_computers_d_sccl_9/261-4426946-1087664?psc=1
Bilgisayar,#10,"TP-Link UB500, Bluetooth 5.3, (PC dizüstü bilgisayar masaüstü bilgisayar için, Windows 10/8.1/8/7 Plug & Play destekler), Nano USB Bluetooth Adaptör","302,95 TL",https://www.amazon.com.tr/TP-Link-Bluetooth-Masa%C3%BCst%C3%BC-Bilgisayar-%C3%A7al%C4%B1%C5%9Ft%C4%B1r/dp/B098K3H92Z/ref=zg_bs_g_computers_d_sccl_10/261-4426946-1087664?psc=1
Bilgisayar,#11,"Samsung EVO Plus microSDXC Hafıza Kartı 512 GB, 160 MB/s, U3, V30, A2, MB-MC512SA/TR (2024 Serisi)","1.949,23 TL",https://www.amazon.com.tr/Samsung-microSDXC-Haf%C4%B1za-%E2%80%8EMB-MC512SA-TR/dp/B0D3QNB55F/ref=zg_bs_g_computers_d_sccl_11/261-4426946-1087664?psc=1
Bilgisayar,#12,"KIOXIA TransMemory U202 64GB USB Bellek – USB 2.0, Beyaz",Fiyat Yok,https://www.amazon.com.tr/KIOXIA-64GB-BEYAZ-FLASH-BELLEK/dp/B088PFC4JW/ref=zg_bs_g_computers_d_sccl_12/261-4426946-1087664?psc=1
Bilgisayar,#13,Apple iPad 11.Nesil A16 11inç/10.Nesil 10.9inç ile uyumlu Kılıf Flip Cover Kalem Bölmeli PC Case Lacivert,"449,90 TL",https://www.amazon.com.tr/11-Nesil-10-Nesil-10-9in%C3%A7-B%C3%B6lmeli-Lacivert/dp/B0DWN96PNV/ref=zg_bs_g_computers_d_sccl_13/261-4426946-1087664?psc=1
Bilgisayar,#14,"Razer BlackShark V2 X - Premium Espor Oyun Kulaklığı (50mm Sürücü Kablolu Kulaklık, PC, Mac, PS4, Xbox One ve Switch için Gürültü Önleyici) Siyah","2.292,36 TL",https://www.amazon.com.tr/Razer-BlackShark-V2-Kulakl%C4%B1%C4%9F%C4%B1-Kulakl%C4%B1klar/dp/B089SSFV85/ref=zg_bs_g_computers_d_sccl_14/261-4426946-1087664?psc=1
Bilgisayar,#15,"KabelDirekt – Ethernet Kablosu, Ağ Kablosu, LAN – 15m – 0,25-30m arasında mevcuttur (10Gbps, Gigabit Ağlar için Fiber Hızı, RJ45 ile Switch/Router/Modem, siyah/mavi)","444,91 TL",https://www.amazon.com.tr/KabelDirekt-Cat6-Ethernet-Gigabit-kablosu-621/dp/B018M7BC4K/ref=zg_bs_g_computers_d_sccl_15/261-4426946-1087664?psc=1
Bilgisayar,#16,"UGREEN USB C Hub, PD 100W, 4K HDMI, MacBook Pro/Air, iPad Pro/Air, Surface Pro/Go, Galaxy Tab, Galaxy S23/S22 vb. ile uyumlu USB A 3.0.","699,00 TL",https://www.amazon.com.tr/UGREEN-MacBook-Surface-Galaxy-uyumlu/dp/B0BR3M8XHK/ref=zg_bs_g_computers_d_sccl_16/261-4426946-1087664?psc=1
Bilgisayar,#17,64GB microSDXC Canvas Select Plus Gen3 100MB/s A1 Card + Adapter,"289,00 TL",https://www.amazon.com.tr/64GB-microSDXC-Canvas-Select-Adapter/dp/B0FD16QM6Y/ref=zg_bs_g_computers_d_sccl_17/261-4426946-1087664?psc=1
