Rank,Kategori,Site Sırası,Ürün Adı,Fiyat,Link
385,Kitap,#36,Sevginin Gücü,"48,00 TL",https://www.amazon.com.tr/Sevginin-G%C3%BCc%C3%BC-Caroline-Richards/dp/6052959924/ref=zg_bs_g_books_d_sccl_36/258-2201869-4432107?psc=1
386,Kitap,#37,Esme Lennox Nasıl Yok Oldu,"170,44 TL",https://www.amazon.com.tr/Esme-Lennox-Nas%C4%B1l-Yok-Oldu/dp/6051983562/ref=zg_bs_g_books_d_sccl_37/258-2201869-4432107?psc=1
387,Kitap,#38,Telefon Melefon Yok!,"133,75 TL",https://www.amazon.com.tr/Telefon-Melefon-Yok-%C5%9Eermin-Ya%C5%9Far/dp/6259621019/ref=zg_bs_g_books_d_sccl_38/258-2201869-4432107?psc=1
388,Moda,#1,6'lı Kutu Premium Likralı Erkek Boxer,Fiyat Yok,https://www.amazon.com.tr/KUTU-PREMIUM-BOXER-THOMAS-S%C4%B0YAH/dp/B09983G7TV/ref=zg_bs_g_apparel_d_sccl_1/258-2201869-4432107?psc=1
389,Moda,#2,"Anthony Jackson Ultra Hafif ABS Valiz TRION (Antrasit, 3'lü Set)",Fiyat Yok,https://www.amazon.com.tr/Anthony-Jackson-Ultra-TRION-Antrasit/dp/B0FKH5MWN3/ref=zg_bs_g_apparel_d_sccl_2/258-2201869-4432107?psc=1
390,Moda,#3,GoWith 6'lı Bambu Premium Siyah - Renkli Dikişsiz Kutulu Nefes Alabilir Klasik Erkek - Kadın Çorap 3560,"334,90 TL",https://www.amazon.com.tr/GoWith-6l%C4%B1-Bambu-Premium-Siyah/dp/B0DWTCPS28/ref=zg_bs_g_apparel_d_sccl_3/258-2201869-4432107?psc=1
391,Moda,#4,Anthony Jackson 3'lü Kutu Premium Erkek Tişört Starlight,"749,90 TL",https://www.amazon.com.tr/Anthony-Jackson-Premium-T-Shirt-Starlight/dp/B0DC1246ZD/ref=zg_bs_g_apparel_d_sccl_4/258-2201869-4432107?psc=1
392,Moda,#5,Anthony Jackson 5'li Kutu Premium Klasik Erkek Atlet ALEXANDER Ekstra Uzun- Taranmış İnce Fitilli Organik Pamuk (Düz),Fiyat Yok,https://www.amazon.com.tr/Anthony-Jackson-Premium-ALEXANDER-Taranm%C4%B1%C5%9F/dp/B0BYTF1KZK/ref=zg_bs_g_apparel_d_sccl_5/258-2201869-4432107?psc=1
393,Moda,#6,GoWith 2'li-4'lü Alpaka Yünlü Termal Yıkamalı Yumuşak Doğal Kışlık Ayakkabı Bot İçin Kar Desen Kadın ve Erkek Çorap 3097,"709,90 TL",https://www.amazon.com.tr/GoWith-Y%C4%B1kamal%C4%B1-Yumu%C5%9Fak-Ayakkab%C4%B1-3097/dp/B0C2DGCVVZ/ref=zg_bs_g_apparel_d_sccl_6/258-2201869-4432107?psc=1
394,Moda,#7,GoWith 2'li-4'lü Alpaka Yünlü Termal Yıkamalı Yumuşak Doğal Kışlık Ayakkabı Bot İçin Ribana Desen Kadın ve Erkek Çorap 3096,"709,90 TL",https://www.amazon.com.tr/GoWith-Y%C4%B1kamal%C4%B1-Yumu%C5%9Fak-Ayakkab%C4%B1-3096/dp/B0C2DBH3KK/ref=zg_bs_g_apparel_d_sccl_7/258-2201869-4432107?psc=1
395,Moda,#8,Anthony Jackson Likralı 3'lü Kutu Premium Erkek Boxer,"389,90 TL",https://www.amazon.com.tr/Anthony-Jackson-Likral%C4%B1-Premium-SERGIO/dp/B0C6C32V76/ref=zg_bs_g_apparel_d_sccl_8/258-2201869-4432107?psc=1
396,Moda,#9,"GoWith 4'lü-5'li%100 Doğal Pamuktan Üretilmiş, Yumuşak, Ön Yıkamalı, Dikişsiz, Cilt Dostu, Ribana Örgü, Bio Naturel Kadın ve Erkek Soket Çorap","539,90 TL",https://www.amazon.com.tr/Gowith-100-Pamuktan-%C3%9Cretilmi%C5%9F-Y%C4%B1kamal%C4%B1-Diki%C5%9Fsiz/dp/B0BZS3XJGZ/ref=zg_bs_g_apparel_d_sccl_9/258-2201869-4432107?psc=1
397,Moda,#10,GoWith Alpaka Yünlü Termal Kalın Tam Havlulu Yıkamalı Yumuşak Doğal Kışlık Kadın Erkek Bot Çorabı 6005-6006,"299,90 TL",https://www.amazon.com.tr/GoWith-Alpaka-Y%C4%B1kamal%C4%B1-Yumu%C5%9Fak-6005-6006/dp/B0B9HSD1CM/ref=zg_bs_g_apparel_d_sccl_10/258-2201869-4432107?psc=1
398,Moda,#11,adidas GALAXY 7 M Erkek Yürüyüş Ayakkabısı,"1.533,00 TL",https://www.amazon.com.tr/adidas-GALAXY-Erkek-Ayakkab%C4%B1-Futbol/dp/B0DL74NC32/ref=zg_bs_g_apparel_d_sccl_11/258-2201869-4432107?psc=1
399,Moda,#12,Anthony Jackson 10 Çift Kutulu BAMBU Premium Bay-Bayan Patik Çorap - Bilek Boy Kısa Spor Koşu ve Yürüyüş Çorabı JESUS,Fiyat Yok,https://www.amazon.com.tr/Anthony-Jackson-Kutulu-Premium-Bay-Bayan/dp/B0CLM7D5MV/ref=zg_bs_g_apparel_d_sccl_12/258-2201869-4432107?psc=1
400,Moda,#13,Anthony Jackson 10'lu Kutu BAMBU Premium Dikişsiz Bay - Bayan Sneaker Çorap,"549,90 TL",https://www.amazon.com.tr/Premium-Diki%C5%9Fsiz-Sneaker-numeric_37-numeric_49/dp/B0BMB8L8SN/ref=zg_bs_g_apparel_d_sccl_13/258-2201869-4432107?psc=1
401,Moda,#14,GoWith 3'lü Pamuklu Topuk Burun Destekli Dayanıklı Havlulu Termal Etkili Nem Kontrollü Outdoor Trekking İş ve Performans Çorabı 6016,"349,90 TL",https://www.amazon.com.tr/GoWith-Destekli-Dayan%C4%B1kl%C4%B1-Kontroll%C3%BC-Performans/dp/B0B1JS4NS1/ref=zg_bs_g_apparel_d_sccl_14/258-2201869-4432107?psc=1
402,Moda,#15,Black Deer Hyper Boost Technology X30 Soft Comfort Siyah-Turuncu Ortopedik Tabanlık Turuncu Siyah 42-43,"159,90 TL",https://www.amazon.com.tr/Technology-Comfort-Siyah-Turuncu-Ortopedik-Tabanl%C4%B1k/dp/B09QZTM4Z2/ref=zg_bs_g_apparel_d_sccl_15/258-2201869-4432107?psc=1
403,Moda,#16,Anthony Jackson 6 Çift Kutulu BAMBU Premium Klasik Erkek Çorap,"479,90 TL",https://www.amazon.com.tr/Anthony-Jackson-Kutulu-Premium-Bay-Bayan/dp/B0CLDS4GGY/ref=zg_bs_g_apparel_d_sccl_16/258-2201869-4432107?psc=1
404,Moda,#17,Anthony Jackson Premium Erkek Triko Kazak Tomasso,Fiyat Yok,https://www.amazon.com.tr/Anthony-Jackson-Premium-Erkek-Tomasso/dp/B0FTT9RW77/ref=zg_bs_g_apparel_d_sccl_17/258-2201869-4432107?psc=1
405,Moda,#18,ac&co 4A5221100016 Sweatshirt Erkek,"517,59 TL",https://www.amazon.com.tr/Alt%C4%B1ny%C4%B1ld%C4%B1z-Classics-Erkek-Lacivert-Anti-pilling-Sweatshirt/dp/B0CQYXQXW6/ref=zg_bs_g_apparel_d_sccl_18/258-2201869-4432107?psc=1
406,Moda,#19,DeFacto B7834ax Polo süveter Kadın,"319,99 TL",https://www.amazon.com.tr/DeFacto-Kad%C4%B1n-Polo-S%C3%BCveter-Ye%C5%9Fil/dp/B0CQJPWKFB/ref=zg_bs_g_apparel_d_sccl_19/258-2201869-4432107?psc=1
407,Moda,#20,Anthony Jackson Likralı 3'lü Kutu Premium Erkek Boxer Özel Kolleksiyon,"389,90 TL",https://www.amazon.com.tr/Anthony-Jackson-Likral%C4%B1-Premium-Collection/dp/B0C8D9LRTQ/ref=zg_bs_g_apparel_d_sccl_20/258-2201869-4432107?psc=1
408,Moda,#21,Erkek Desenli Premium Penye Pamuklu Likralı Boxer - 10'lu Set,"449,90 TL",https://www.amazon.com.tr/VIEN-KARL-Erkek-Likral%C4%B1-Lacivert/dp/B09BJQZXPZ/ref=zg_bs_g_apparel_d_sccl_21/258-2201869-4432107?psc=1
409,Moda,#22,Anthony Jakson 6 Çift Kutulu Premium Bay - Bayan Dikişsiz Spor Koşu Yürüyüş ve Antrenman Çorabı Walker,Fiyat Yok,https://www.amazon.com.tr/ANTHONY-JACKSON-%C3%87ift-Kutulu-Premium/dp/B0DJ9FS6N1/ref=zg_bs_g_apparel_d_sccl_22/258-2201869-4432107?psc=1
410,Moda,#23,DeFacto A4453ax Tişört Kadınlar,"123,75 TL",https://www.amazon.com.tr/DeFacto-Kad%C4%B1n-ti%C5%9F%C3%B6rt%C3%BC-Beyaz-XS/dp/B0BWKB9MPF/ref=zg_bs_g_apparel_d_sccl_23/258-2201869-4432107?psc=1
411,Moda,#24,Tutku Elit erkek termal içlik tayt siyah 1306,"238,00 TL",https://www.amazon.com.tr/Tutku-erkek-termal-i%C3%A7lik-siyah/dp/B08L8981KD/ref=zg_bs_g_apparel_d_sccl_24/258-2201869-4432107?psc=1
412,Moda,#25,Anthony Jackson Doğal Pamuktan Üretilmiş 4'lü Kutu Dikişsiz Ribana Örgü Bio Naturel Kadın ve Erkek Çorap NaturWalk,"539,90 TL",https://www.amazon.com.tr/Jackson-100-Pamuktan-%C3%9Cretilmi%C5%9F-Diki%C5%9Fsiz-NaturWalk/dp/B0DLX5QD5F/ref=zg_bs_g_apparel_d_sccl_25/258-2201869-4432107?psc=1
413,Moda,#26,DeFacto B7833ax Sweatshirt Erkek,Fiyat Yok,https://www.amazon.com.tr/DeFacto-Erkek-sweatshirt-Haki-L/dp/B0CQJS9WLN/ref=zg_bs_g_apparel_d_sccl_26/258-2201869-4432107?psc=1
414,Moda,#27,GoWith 3'lü-6'lı Bambu Renkli Spor Desenli Güçlendirilmiş Yıkamalı Kutulu Dikişsiz Koşu Yürüyüş Spor Performans Kısa Fit Patik Erkek Çorap,"469,90 TL",https://www.amazon.com.tr/GoWith-G%C3%BC%C3%A7lendirilmi%C5%9F-Y%C4%B1kamal%C4%B1-Performans-3150/dp/B08PZ986PL/ref=zg_bs_g_apparel_d_sccl_27/258-2201869-4432107?psc=1
415,Moda,#28,"3'lü Tatlı Noel Çorapları, Noel baba, Noel anne, Noel şekeri, Yeni Yıl Hediyesi, Christmas Hediyesi, Sevdiklerinize Yılbaşı Sıcaklığı!","245,00 TL",https://www.amazon.com.tr/%C3%87oraplar%C4%B1-Hediyesi-Sevdiklerinize-S%C4%B1cakl%C4%B1%C4%9F%C4%B1-Mer210/dp/B0CNS1SR8Y/ref=zg_bs_g_apparel_d_sccl_28/258-2201869-4432107?psc=1
416,Moda,#29,Erkek Su Geçirmez Çıkarılabilir Kapüşonlu Şişme Mont 720DNGR,"1.349,90 TL",https://www.amazon.com.tr/Erkek-Ge%C3%A7irmez-%C3%87%C4%B1kar%C4%B1labilir-Kap%C3%BC%C5%9Fonlu-%C5%9Ei%C5%9Fme/dp/B0C5XLRWB5/ref=zg_bs_g_apparel_d_sccl_29/258-2201869-4432107?psc=1
417,Moda,#30,GoWith 3'lü Norveç Tipi Yünlü Kalın Moline Renkli Tam Havlulu Güçlendirilmiş Ön Yıkamalı Kışlık Termal Kadın Çorap Seti 2038,"419,90 TL",https://www.amazon.com.tr/GoWith-Havlulu-G%C3%BC%C3%A7lendirilmi%C5%9F-Y%C4%B1kamal%C4%B1-2038/dp/B08PZD22H9/ref=zg_bs_g_apparel_d_sccl_30/258-2201869-4432107?psc=1
418,Moda,#31,"GoWith 4’lü ORGANİK PAMUK Taban Altı Havlulu Erkek Kadın Spor Çorap, Siyah Beyaz Gri Ekru Soket Boy Tenis Çorabı, Ribana Örgü Dikişşiz Retro Çorap 3504",Fiyat Yok,https://www.amazon.com.tr/GoWith-ORGAN%C4%B0K-Havlulu-Diki%C5%9F%C5%9Fiz-3504/dp/B0F6DCNNHQ/ref=zg_bs_g_apparel_d_sccl_31/258-2201869-4432107?psc=1
419,Moda,#32,GoWith 5'li Bambu Likralı Dikişsiz 200 İğne Yıkamalı Esnek Sıkmayan Kaliteli Elegance Kutulu Siyah Lacivert ve Renkli Erkek Çorabı 3557,"599,90 TL",https://www.amazon.com.tr/GoWith-Diki%C5%9Fsiz-Y%C4%B1kamal%C4%B1-S%C4%B1kmayan-Kaliteli/dp/B08FT2SW8T/ref=zg_bs_g_apparel_d_sccl_32/258-2201869-4432107?psc=1
420,Moda,#33,Anthony Jackson Premium Erkek Polo Yaka Triko Kazak Massimiliano,Fiyat Yok,https://www.amazon.com.tr/Anthony-Jackson-Premium-Massimiliano-LAC%C4%B0VERT/dp/B0FTTDHT1Y/ref=zg_bs_g_apparel_d_sccl_33/258-2201869-4432107?psc=1
421,Moda,#34,Crocs Crocband Clog Kadın Terlik,"1.754,25 TL",https://www.amazon.com.tr/Crocs-Unisex-Yeti%C5%9Fkin-Crocband-Takunya/dp/B002JCSSSS/ref=zg_bs_g_apparel_d_sccl_34/258-2201869-4432107?psc=1
422,Moda,#35,GoWith 2'li-4'lü Alpaka Yünlü Termal Yıkamalı Yumuşak Doğal Kışlık Ayakkabı Bot İçin Kadın ve Erkek Çorap 3095,"399,90 TL",https://www.amazon.com.tr/GoWith-Y%C4%B1kamal%C4%B1-Yumu%C5%9Fak-Ayakkab%C4%B1-3095/dp/B08PZBSVK3/ref=zg_bs_g_apparel_d_sccl_35/258-2201869-4432107?psc=1
423,Moda,#36,GoWith 3'lü Norveç Tipi Moline Yünlü Tabanaltı Yarım Havlulu Kışlık Termal Erkek Çorap 6001-6004,"399,90 TL",https://www.amazon.com.tr/GoWith-Norve%C3%A7-Tabanalt%C4%B1-Havlulu-6001-6004/dp/B0BF2VRBCM/ref=zg_bs_g_apparel_d_sccl_36/258-2201869-4432107?psc=1
424,Moda,#37,COMEOR Erkek Pamuk Eşofman Altı - Spor Koşu Pantolonu | Boş Zaman Pantolonu Fermuarlı Cepler,"659,99 TL",https://www.amazon.com.tr/COMEOR-E%C5%9Fofman-alt%C4%B1-Erkek-Pamuklu/dp/B09Y4FWRHZ/ref=zg_bs_g_apparel_d_sccl_37/258-2201869-4432107?psc=1
425,Moda,#38,SONNORS 3 Çift Termal Erkek Çorap - Uzun Havlu Kışlık Kar Outdoor Kamp Çorabı Kadın - Pamuklu Yastıklı Nefes Alabilen Kalın Çorap - Siyah,"449,00 TL",https://www.amazon.com.tr/SONNORS-Outdoor-%C3%87oraplar%C4%B1-Yast%C4%B1kl%C4%B1-Alabilen/dp/B0CRJ1K44P/ref=zg_bs_g_apparel_d_sccl_38/258-2201869-4432107?psc=1
426,Mutfak,#1,"Stanley The Aerolight Transit Mug Termos Bardak, Yeşil (Hammertone Green), 0.47 Litre","1.349,00 TL",https://www.amazon.com.tr/Stanley-AeroLight-Transit-Mug-0-47L/dp/B0DWK3C1R7/ref=zg_bs_g_kitchen_d_sccl_1/258-2201869-4432107?psc=1
427,Mutfak,#2,"Stanley Quencher Pipetli Termos Bardak, Pembe Kuvars (Rose Quartz), 1.18 Litre","2.200,00 TL",https://www.amazon.com.tr/Stanley-Quencher-Pipetli-Termos-Bardak/dp/B0CNTWY3VM/ref=zg_bs_g_kitchen_d_sccl_2/258-2201869-4432107?psc=1
428,Mutfak,#3,"BRITA MAXTRA PRO Pure Performance Yedek Su Arıtma Filtresi, 6’lı",Fiyat Yok,https://www.amazon.com.tr/BRITA-MAXTRA-Yedek-Ar%C4%B1tma-Filtresi/dp/B0CLNZ4NPV/ref=zg_bs_g_kitchen_d_sccl_3/258-2201869-4432107?psc=1
429,Mutfak,#4,"Koroplast Hazır Kesilmiş Pişirme Kağıdı 16 adet 42x37 cm, Helal Sertifikalı BPA İçermez, Fırında Tavuk, Et, Tatlı, Börek Pişirmek için Yüksek Isıya Dayanıklı Hazır Fırın Pişirme Kağıdı Yapışmaz Yanmaz","91,58 TL",https://www.amazon.com.tr/Koroplast-Haz%C4%B1r-Kesilmi%C5%9F-Pi%C5%9Firme-Ka%C4%9F%C4%B1d%C4%B1/dp/B075XM3CG3/ref=zg_bs_g_kitchen_d_sccl_4/258-2201869-4432107?psc=1
430,Mutfak,#5,"Stanley Classic Legendary Vakumlu Çelik Termos, Yeşil (Hammertone Green), 2.3 Litre","2.519,30 TL",https://www.amazon.com.tr/Stanley-Klasik-Vakumlu-Paslanmaz-Termos/dp/B0BKLPF6FX/ref=zg_bs_g_kitchen_d_sccl_5/258-2201869-4432107?psc=1
431,Mutfak,#6,"Philips 5500 Serisi LatteGo Tam Otomatik Espresso Makinesi, 20 Sıcak ve Soğuk İçecek, QuickStart, SilentBrew Teknolojisi, Dokunmatik Ekran, EP5547/90","24.599,00 TL",https://www.amazon.com.tr/Philips-LatteGo-Otomatik-Espresso-Makinesi/dp/B0CZ7D5DTQ/ref=zg_bs_g_kitchen_d_sccl_6/258-2201869-4432107?psc=1
432,Mutfak,#7,BRITA Maxtra Pro Kireç Uzmanı Yedek Su Arıtma Filtresi 6'lı,Fiyat Yok,https://www.amazon.com.tr/BRITA-MAXTRA-Uzman%C4%B1-Ar%C4%B1tma-Filtresi/dp/B0CLV7GMXT/ref=zg_bs_g_kitchen_d_sccl_7/258-2201869-4432107?psc=1
433,Mutfak,#8,PHILIPS CA6903/10 Espresso Makinesi Kireç ve Su Filtresi,"813,00 TL",https://www.amazon.com.tr/Philips-CA6903-10-AquaClean-Filtresi/dp/B0B5L4LYHZ/ref=zg_bs_g_kitchen_d_sccl_8/258-2201869-4432107?psc=1
434,Mutfak,#9,ARVALE Çift Cidarlı Cam Kupa Ev Ofis Fincanı Çift Katlı Isı Yalıtımlı Kulplu Cam Bardak (2 Adet Helsinki 250 ml),"209,99 TL",https://www.amazon.com.tr/ARVALE-Cidarl%C4%B1-Fincan%C4%B1-Yal%C4%B1t%C4%B1ml%C4%B1-Helsinki/dp/B0CZDT6LJ5/ref=zg_bs_g_kitchen_d_sccl_9/258-2201869-4432107?psc=1
435,Mutfak,#10,"Philips 8000 Serisi Azur Buharlı Ütü - 3000W, OptimalTEMP Teknolojisi, 55g/dk Sürekli Buhar, Sıfır Yanık Riski, 300 ml'lik Su Haznesi (DST8021/30)","3.929,00 TL",https://www.amazon.com.tr/Philips-DST8021-30-Buharl%C4%B1-OptimalTEMP/dp/B0BJQK6GK4/ref=zg_bs_g_kitchen_d_sccl_10/258-2201869-4432107?psc=1
436,Mutfak,#11,"Bluefox Dijital Mutfak Terazisi - Paslanmaz Çelik Yüzeyli Hassas Mutfak Tartısı - Dara İşlevi, LED Ekran, 5 Birim Dönüştürme ve Otomatik Kapanma Özellikli - 5 kg Tartı Kapasitesi","299,00 TL",https://www.amazon.com.tr/Bluefox-Dijital-Terazisi-Paslanmaz-Tart%C4%B1s%C4%B1/dp/B08W34BD8J/ref=zg_bs_g_kitchen_d_sccl_11/258-2201869-4432107?psc=1
437,Mutfak,#12,"Philips 5000 Serisi Izgara ve Tost Makinesi - Ayarlanabilir sıcaklık, Geniş ızgara yüzeyi ve Yüksek Güç performansı, Çıkarılabilir yapışmaz plakalar ve yağ tepsisi (HD6301/90)","4.370,00 TL",https://www.amazon.com.tr/Philips-5000-Serisi-Izgara-Makinesi/dp/B0CZ9SHW6W/ref=zg_bs_g_kitchen_d_sccl_12/258-2201869-4432107?psc=1
438,Mutfak,#13,"Stanley Classic Legendary Vakumlu Yemek Termosu, Paslanmaz Çelik, 0.5 Litre","2.045,00 TL",https://www.amazon.com.tr/Stanley-Adventure-Vakumlu-Yemek-Termosu/dp/B07PVDV8S9/ref=zg_bs_g_kitchen_d_sccl_13/258-2201869-4432107?psc=1
439,Mutfak,#14,"COOK Premium Filtre Kahve Kağıdı - Ebat 4, 80 adet","141,00 TL",https://www.amazon.com.tr/COOK-Premium-Filtre-Kahve-Ka%C4%9F%C4%B1d%C4%B1/dp/B09W5YXJ85/ref=zg_bs_g_kitchen_d_sccl_14/258-2201869-4432107?psc=1
440,Mutfak,#15,PHILIPS CA6704/10 Espresso Makinesi Kahve Yağı Çözücü Tablet,"275,00 TL",https://www.amazon.com.tr/Philips-CA6704-10-Kahve-%C3%87%C4%B1kar%C4%B1c%C4%B1/dp/B0B1JPZDNW/ref=zg_bs_g_kitchen_d_sccl_15/258-2201869-4432107?psc=1
441,Mutfak,#16,"EYNEL Yılbaşı Şekilli Adam Çam Ağacı Basmalı Kurabiye Kalıbı Gingerbread Man Desenli Şeker Hamuru Kesici Aparat (Konsept 1, Krem-Turuncu)","129,99 TL",https://www.amazon.com.tr/EYNEL-Y%C4%B1lba%C5%9F%C4%B1-Kurabiye-Gingerbread-Krem-Turuncu/dp/B0BNGKBK7F/ref=zg_bs_g_kitchen_d_sccl_16/258-2201869-4432107?psc=1
442,Mutfak,#17,"Versuni Philips kahve yağı çözücü tabletler, tam otomatik kahve makineleri için","279,00 TL",https://www.amazon.com.tr/Philips-CA6704-10-Ha%C5%9Flama-Kaffeefettloeser-tabletten-makineleri/dp/B074KQM1QG/ref=zg_bs_g_kitchen_d_sccl_17/258-2201869-4432107?psc=1
443,Mutfak,#18,"Philips 5000 Serisi El Blender - SpeedTrigger Kontrolü, 1200W Motor, Paslanmaz Çelik Bıçaklar, Bebek Maması Hazır, Mikser ve Gıda İşlemci Aksesuarları (HR2695/01)","3.617,00 TL",https://www.amazon.com.tr/HR2695-01-Kapasiteli-SpeedTrigger-Teknolojisi/dp/B0D1KVD99N/ref=zg_bs_g_kitchen_d_sccl_18/258-2201869-4432107?psc=1
444,Mutfak,#19,"Shark Neverchange Hava Temizleyici, 5 Yıla Kadar Filtre Ömrü, 130 M²’ Ye Kadar Büyük Alanlar, HEPA Filtre, Otomatik Mod, Led Ekran, Sessiz, Beyaz Renk","11.999,00 TL",https://www.amazon.com.tr/Shark-NeverChange5-Clean-Temizleyicisi-HP300EU/dp/B0CX92GNCX/ref=zg_bs_g_kitchen_d_sccl_19/258-2201869-4432107?psc=1
445,Mutfak,#20,"Stanley Klasik Paslanmaz Çelik Cep Matarası, Mat Siyah, 0.23 Litre",Fiyat Yok,https://www.amazon.com.tr/Stanley-Klasik-Cep-Mataras%C4%B1-0-23/dp/B07PWC7X9P/ref=zg_bs_g_kitchen_d_sccl_20/258-2201869-4432107?psc=1
446,Mutfak,#21,Yui CX1 Şarjlı (Type C) Tüy Ve Tiftik toplama temizleme makinesi+ 1 Adet yedek Bıçak Hediyeli,"425,83 TL",https://www.amazon.com.tr/Yui-CX1-temizleme-makinesi-Hediyeli/dp/B0CTQG1G1L/ref=zg_bs_g_kitchen_d_sccl_21/258-2201869-4432107?psc=1
447,Mutfak,#22,"Philips Airfryer 3000 Serisi L - 4,1L, 13'ü 1 arada işlev, 7 ön ayarlı program,%90 daha az yağ, Rapid Air, HomeID tarif uygulaması, sıcak tutma, bulaşık makinesinde yıkanabilir (HD9243/90)","2.199,00 TL",https://www.amazon.com.tr/Philips-HD9243-90-Airfryer-Kapasite/dp/B0CD2KVVRC/ref=zg_bs_g_kitchen_d_sccl_22/258-2201869-4432107?psc=1
448,Mutfak,#23,"GuDoQi Dijital Gıda Termometresi - Hızlı ve Hassas Sıcaklık Ölçer | Et, Süt, Yağ, Su, Şeker, Çikolata, Fırın ve Barbekü Kullanımı için Mutfak Termometresi | LCD Ekranlı, Paslanmaz Çelik Prob","119,90 TL",https://www.amazon.com.tr/Dijital-Mutfak-Termometresi-Termometre-G%C4%B1da/dp/B01MRK7MU8/ref=zg_bs_g_kitchen_d_sccl_23/258-2201869-4432107?psc=1
449,Mutfak,#24,Kumtel LX-6331 Füme 2000 W Fanlı Isıtıcı,"772,64 TL",https://www.amazon.com.tr/Kumtel-LX-6331-F%C3%BCme-Fanl%C4%B1-Is%C4%B1t%C4%B1c%C4%B1/dp/B0FWKDV6F4/ref=zg_bs_g_kitchen_d_sccl_24/258-2201869-4432107?psc=1
450,Mutfak,#25,"Philips Serisi 3000 2000W Enerji Tasarruflu Bağlantılı Isıtıcı, EcoAI ile%50'ye Kadar Enerji Tasarrufu, Sessiz, 5 Güvenlik Fonksiyonu, 45°'lik Salınım, Koyu Gri (CX3120/01)","3.699,00 TL",https://www.amazon.com.tr/PHILIPS-CX3120-01-Is%C4%B1t%C4%B1c%C4%B1-Uygulamas%C4%B1/dp/B0D6MZL2XW/ref=zg_bs_g_kitchen_d_sccl_25/258-2201869-4432107?psc=1
451,Mutfak,#26,"Philips Daily Collection Narenciye Sıkacağı, 25W, 500 ml Meyve Suyu Sürahisi, Otomatik Yön Değiştirme, Kablo Saklama, HR2738/00","999,00 TL",https://www.amazon.com.tr/Philips-s%C4%B1kaca%C4%9F%C4%B1-narenciye-HR2738-00/dp/B00E38652C/ref=zg_bs_g_kitchen_d_sccl_26/258-2201869-4432107?psc=1
452,Mutfak,#27,Hario V60 02 Dripper Filtresi (100 Adet),"258,00 TL",https://www.amazon.com.tr/Hario-V60-Dripper-Filtresi-Adet/dp/B001U7EOYA/ref=zg_bs_g_kitchen_d_sccl_27/258-2201869-4432107?psc=1
453,Mutfak,#28,"Philips Daily Collection Mikser - 300W, 5 Hız + Turbo, Konik Uçlu Çırpıcılar, Hafif, Kaymaz Tutma, Kolay Temizlik, Bulaşık Makinesinde Yıkanabilir Aksesuarlar (HR3705/10)","939,85 TL",https://www.amazon.com.tr/Philips-Collection-Hr3705-10-Mikser/dp/B07H1WHH37/ref=zg_bs_g_kitchen_d_sccl_28/258-2201869-4432107?psc=1
454,Mutfak,#29,"Philips Daily Collection Çay Makinesi - Otomatik Sıcak Tutma, 1.9L Su Isıtıcısı, 0.9L Cam Demlik, Hızlı Kaynatma 1700W, Kireç Filtresi, Kolay Dökme İçin Kablosuz Taban (HD7301/00)","1.699,00 TL",https://www.amazon.com.tr/Philips-Hd7301-00-Makinesi-Siyah/dp/B00KA5SULQ/ref=zg_bs_g_kitchen_d_sccl_29/258-2201869-4432107?psc=1
455,Mutfak,#30,"Busstier Airfryer Pişirme Kağıdı, Fritöz Yağlı Kağıdı, Yanmaz Kağıt 50 Adet (Kare)","78,90 TL",https://www.amazon.com.tr/Airfryer-Pi%C5%9Firme-Ka%C4%9F%C4%B1d%C4%B1-Frit%C3%B6z-Yanmaz/dp/B0BWJM5CV9/ref=zg_bs_g_kitchen_d_sccl_30/258-2201869-4432107?psc=1
456,Mutfak,#31,"Philips 7500 Serisi Buharlı Ütü – 3200W Güç, 55 g/dk Sürekli Buhar, 260 g Güçlendirme, SteamGlide Elite Taban, Otomatik Kapanma, Damlama Önleyici Sistem, 300 ml Tank (DST7511/80)","3.199,00 TL",https://www.amazon.com.tr/Philips-DST7511-80-Buharl%C4%B1-S%C3%BCrekli/dp/B0BXM27M5X/ref=zg_bs_g_kitchen_d_sccl_31/258-2201869-4432107?psc=1
457,Mutfak,#32,"Philips Filtre Kahve Makinesi, 1,2 Lt Kapasite, Otomatik Kapanma, Cam Demlikli, Siyah ve Metal, HD7462/20","2.331,12 TL",https://www.amazon.com.tr/Philips-Hd7462-20-Makinesi-S%C3%BCrahi/dp/B00R04CAWA/ref=zg_bs_g_kitchen_d_sccl_32/258-2201869-4432107?psc=1
458,Mutfak,#33,BRITA Marella XL 3x Maxtra Pro All-In-1 Filtreli Su Arıtma Sürahisi Mavi (3.5 lt),Fiyat Yok,https://www.amazon.com.tr/BRITA-Marella-MAXTRA-ALL-Filtreli/dp/B0CLYBXY71/ref=zg_bs_g_kitchen_d_sccl_33/258-2201869-4432107?psc=1
459,Mutfak,#34,Sinbo Fanlı Isıtıcı (SFH- 6940) 2000w Sıcak - Soğuk ve Yatay - Dikey Kullanıma Uygun,"598,05 TL",https://www.amazon.com.tr/Sinbo-Fanl%C4%B1-Is%C4%B1t%C4%B1c%C4%B1-SFH-6940-2000w/dp/B0DMDY3MKN/ref=zg_bs_g_kitchen_d_sccl_34/258-2201869-4432107?psc=1
460,Mutfak,#35,"Stanley IceFlow Flip Straw Tumbler Pipetli Termos Bardak, Lacivert (Twilight), 0.89 Litre","2.227,49 TL",https://www.amazon.com.tr/Stanley-IceFlow-Tumbler-Lacivert-Twilight/dp/B0FHGXSN22/ref=zg_bs_g_kitchen_d_sccl_35/258-2201869-4432107?psc=1
461,Mutfak,#36,"Deconox Döküm Limon Sıkacağı Limon Presi Büyük Boy 24 cm, Siyah Metal Limon Sıkacağı, Döküm Narenciye Sıkacağı (DÖKÜM LİMON SIKICI)","152,59 TL",https://www.amazon.com.tr/Deconox-Narenciye-D%C3%96K%C3%9CM-L%C4%B0MON-SIKICI/dp/B0B5HMLBMG/ref=zg_bs_g_kitchen_d_sccl_36/258-2201869-4432107?psc=1
462,Mutfak,#37,"Stanley Aerolight IceFlow Fast Flow İçecek Şişesi, Açık Yeşil (Citron), 0.60 Litre","1.469,00 TL",https://www.amazon.com.tr/STANLEY-Aerolight-IceFlow-%C4%B0%C3%A7ecek-%C5%9Ei%C5%9Fesi/dp/B0CNTX1NJ2/ref=zg_bs_g_kitchen_d_sccl_37/258-2201869-4432107?psc=1
463,Mutfak,#38,Bialetti - Moka Express: 6 Cups Ocak Üstü Espresso Pişirici - 270ml - Gümüş Renk - Alüminyum Gövde - Patentli Güvenlik Valfi - Tüm Ocak Türleri İçin Uygundur (İndüksiyon Hariç),"1.550,06 TL",https://www.amazon.com.tr/Bialetti-Moka-Pot-Express-cup/dp/B00004RFRU/ref=zg_bs_g_kitchen_d_sccl_38/258-2201869-4432107?psc=1
464,Müzik Enstrümanları ve DJ,#1,Ernie Ball Hybrid Slinky Nickel Wound Electric Guitar Strings - 9-46 Gauge,"352,27 TL",https://www.amazon.com.tr/Ernie-Ball-Hybrid-Electric-Strings/dp/B0002PBS6S/ref=zg_bs_g_musical-instruments_d_sccl_1/258-2201869-4432107?psc=1
465,Müzik Enstrümanları ve DJ,#2,Elixir 12002 Nanoweb Super Light Elektro Gitar Teli (9-42),"551,80 TL",https://www.amazon.com.tr/Elixir-009-042-Elektro-Gitar-12002/dp/B0002E1O2W/ref=zg_bs_g_musical-instruments_d_sccl_2/258-2201869-4432107?psc=1
466,Müzik Enstrümanları ve DJ,#3,BEHRINGER BH470-BK Stüdyo Kulaklığı - Siyah,"1.792,00 TL",https://www.amazon.com.tr/BEHRINGER-BH470-BK-St%C3%BCdyo-Kulakl%C4%B1%C4%9F%C4%B1-Siyah/dp/B0F32S52W1/ref=zg_bs_g_musical-instruments_d_sccl_3/258-2201869-4432107?psc=1
467,Müzik Enstrümanları ve DJ,#4,"Alesis Nitro Max Kit - Elektronik Davul Seti, Dijital Bateri, Sessiz Mesh Pedli, 10 İnç Çift Bölgeli Trampet, Bluetooth, 440+ Otantik Ses, Drumeo, USB MIDI, Tekme Pedalı","25.999,00 TL",https://www.amazon.com.tr/Alesis-Elektronik-Pedleri-Bluetooth-Orijinal/dp/B0C43R8SRB/ref=zg_bs_g_musical-instruments_d_sccl_4/258-2201869-4432107?psc=1
468,Müzik Enstrümanları ve DJ,#5,JBL PARTYBOX KABLOSUZ MIC Dijital kablosuz mikrofonlar,"5.489,00 TL",https://www.amazon.com.tr/JBL-PARTYBOX-KABLOSUZ-kablosuz-mikrofonlar/dp/B0CY5PBPJD/ref=zg_bs_g_musical-instruments_d_sccl_5/258-2201869-4432107?psc=1
469,Müzik Enstrümanları ve DJ,#6,Coverzone 2 Adet Kablosuz Karaoke Mikrofonu 6.35mm Amfi hoparlör İçin ve Sahne Performansı Aktiviteler İçin Tak ve Çalıştır Kablosuz Mikrofon Dış Mekan Kullanıma Uygun WN04 Gri Renk (Çiftli WN-04),"999,90 TL",https://www.amazon.com.tr/Coverzone-Mikrofonu-Performans%C4%B1-Aktiviteler-Kullan%C4%B1ma/dp/B0DGTN3ZNG/ref=zg_bs_g_musical-instruments_d_sccl_6/258-2201869-4432107?psc=1
470,Müzik Enstrümanları ve DJ,#7,"Vic firth Baget(Çift) Nova 5A Wood, Hıckory, 16""X0.565"", Med","326,03 TL",https://www.amazon.com.tr/Vic-firth-Baget-H%C4%B1ckory-X0-565/dp/B0002E3GDC/ref=zg_bs_g_musical-instruments_d_sccl_7/258-2201869-4432107?psc=1
471,Müzik Enstrümanları ve DJ,#8,presto carries value... Sap Dayamalı Elektro Gitar Sehpası Standı (Black),"479,90 TL",https://www.amazon.com.tr/Presto-Dayamal%C4%B1-Elektro-Sehpas%C4%B1-Stand%C4%B1/dp/B097QG2WYT/ref=zg_bs_g_musical-instruments_d_sccl_8/258-2201869-4432107?psc=1
472,Müzik Enstrümanları ve DJ,#9,RODE PSA1+ Stüdyo Aksesuarı,"7.591,00 TL",https://www.amazon.com.tr/Profesyonel-uygulamalar%C4%B1-PSA1-s%C3%B6n%C3%BCmlemeli-k%C4%B1lavuzlu/dp/B09JBVR5B4/ref=zg_bs_g_musical-instruments_d_sccl_9/258-2201869-4432107?psc=1
473,Müzik Enstrümanları ve DJ,#10,SANEC® Universal Pikap İğnesi Komple Kafasıyla Metal,"193,41 TL",https://www.amazon.com.tr/Universal-Pikap-%C4%B0%C4%9Fnesi-Komple-Kafas%C4%B1yla/dp/B0CDQ82QHH/ref=zg_bs_g_musical-instruments_d_sccl_10/258-2201869-4432107?psc=1
474,Müzik Enstrümanları ve DJ,#11,RODE NT1 Signature Series Large-Diaphragm Condenser Mikrofon (Siyah),Fiyat Yok,https://www.amazon.com.tr/Signature-Large-Diaphragm-Condenser-Mikrofon-Siyah/dp/B0CKVD62NX/ref=zg_bs_g_musical-instruments_d_sccl_11/258-2201869-4432107?psc=1
475,Müzik Enstrümanları ve DJ,#12,Ernie Ball Jacquard Weave Gitar Askısı Kalıbı: Gold Black Paisley,"1.203,00 TL",https://www.amazon.com.tr/Ernie-Ball-Black-Paisley-Jacquard/dp/B07N283PMK/ref=zg_bs_g_musical-instruments_d_sccl_12/258-2201869-4432107?psc=1
476,Müzik Enstrümanları ve DJ,#13,Ernie Ball Sarı Polypro Gitar Askısı,"465,00 TL",https://www.amazon.com.tr/Ernie-Polypro-Gitar-Ask%C4%B1s%C4%B1-P05351/dp/B0BBSLZXGR/ref=zg_bs_g_musical-instruments_d_sccl_13/258-2201869-4432107?psc=1
477,Müzik Enstrümanları ve DJ,#14,Midex KLX-456 Hakiki Maun Ağacı Kalimba 17 Çelik Tuşlu (Türkçe Metod Çanta Çekiç),"649,00 TL",https://www.amazon.com.tr/Midex-KLX-456-Hakiki-Kalimba-T%C3%BCrk%C3%A7e/dp/B0BXY1HCQB/ref=zg_bs_g_musical-instruments_d_sccl_14/258-2201869-4432107?psc=1
