Kategori,Sıra,Ürün Adı,Fiyat,Link
Ev ve Yaşam,#25,"Philips 9000 Serisi AquaTrio Kablosuz Dikey Süpürge, Otomatik Temizleme ve Şarj İstasyonu, AquaSpin Başlık, PowerCyclone Aqua, XW9463/11","23.950,00 TL",https://www.amazon.com.tr/Philips-Otomatik-Temizlik-XW9463-11/dp/B0DCGD7Y8K/ref=zg_bs_g_home_d_sccl_25/261-4426946-1087664?psc=1
Ev ve Yaşam,#26,Coverzone 10 Metre Fişli RGB Led Işık Noel Yılbaşı Ağacı Işığı Led Ampül Çam Ağacı Balkon Merdiven Salon Yada Oda Süslemelerinde Kullanıma Uygun 220v Prizden Enerjisini Alır,"199,90 TL",https://www.amazon.com.tr/Coverzone-Merdiven-S%C3%BCslemelerinde-Kullan%C4%B1ma-Enerjisini/dp/B0DQTV2ZJQ/ref=zg_bs_g_home_d_sccl_26/261-4426946-1087664?psc=1
Ev ve Yaşam,#27,Philips Marathon Ultimate Toz Torbasız Süpürge XB7150/07,"8.697,00 TL",https://www.amazon.com.tr/Philips-XB7150-07-Marathon-PowerCyclone/dp/B0C7RHJMF6/ref=zg_bs_g_home_d_sccl_27/261-4426946-1087664?psc=1
Ev ve Yaşam,#28,Miss Collection Lüx Serisi Pedallı 25 Litre Çöp Kovası Siyah,"499,90 TL",https://www.amazon.com.tr/Miss-Collection-Serisi-Pedall%C4%B1-Kovas%C4%B1/dp/B0DKR2BXVN/ref=zg_bs_g_home_d_sccl_28/261-4426946-1087664?psc=1
Ev ve Yaşam,#29,"Philips LED Classic 100W A67 Filament Ampul, 2700 Sıcak Beyaz, E27 Normal Duy, Dim Edilmez","304,99 TL",https://www.amazon.com.tr/Philips-Classic-100W-2700K-Edilmez/dp/B08HTZ4R6T/ref=zg_bs_g_home_d_sccl_29/261-4426946-1087664?psc=1
Ev ve Yaşam,#30,Air Wick Elektrikli Oda Kokusu Yedek Şişe Vanilya,"139,00 TL",https://www.amazon.com.tr/Air-Wick-Elektrikli-Kokusu-Vanilya/dp/B0CSG29SGB/ref=zg_bs_g_home_d_sccl_30/261-4426946-1087664?psc=1
Ev ve Yaşam,#31,"Amber LED Hareket Sensörlü Ledli Gece Lambası Şarj Edilebilir, Taşınabilir 4000k Günışığı (2 Adet)","319,00 TL",https://www.amazon.com.tr/Hareket-Sens%C3%B6rl%C3%BC-Edilebilir-Ta%C5%9F%C4%B1nabilir-G%C3%BCn%C4%B1%C5%9F%C4%B1%C4%9F%C4%B1/dp/B0CJQKG2TP/ref=zg_bs_g_home_d_sccl_31/261-4426946-1087664?psc=1
Ev ve Yaşam,#32,"Sihirli Paspas Su Emici Banyo Paspası Kaymaz Tabanlı Abdest Paspası 3,5 Mm 40x60cm","113,85 TL",https://www.amazon.com.tr/Sihirli-Paspas-Paspas%C4%B1-Tabanl%C4%B1-40x60cm/dp/B0BT9RK623/ref=zg_bs_g_home_d_sccl_32/261-4426946-1087664?psc=1
Ev ve Yaşam,#33,Vileda 1-2 Spray Max Sprey Mop,Fiyat Yok,https://www.amazon.com.tr/Vileda-1-2-Spray-Max-Sprey/dp/B06Y5W5LV4/ref=zg_bs_g_home_d_sccl_33/261-4426946-1087664?psc=1
Ev ve Yaşam,#34,Cata Martı Cabınet Şarjlı Kolay Taşınabilir Mıknatıslı Led Işık Kablosuz Kademeli 3 Renk Aplik,"218,00 TL",https://www.amazon.com.tr/Cata-Ta%C5%9F%C4%B1nabilir-M%C4%B1knat%C4%B1sl%C4%B1-Kablosuz-Kademeli/dp/B0C74L5TGY/ref=zg_bs_g_home_d_sccl_34/261-4426946-1087664?psc=1
Ev ve Yaşam,#35,Philips LEDBulb 8-60W E27 6500K Beyaz Işık 720 lümen,"60,00 TL",https://www.amazon.com.tr/Philips-LEDBulb-8-60W-6500K-Beyaz/dp/B0CZ46XRWZ/ref=zg_bs_g_home_d_sccl_35/261-4426946-1087664?psc=1
Ev ve Yaşam,#36,TİNEKE Siyah Renk Kare Kötü Koku Önleyici Silikon Mat Banyo Mutfak Lavabo Balkon Gider Tıpası Kapağı,"93,00 TL",https://www.amazon.com.tr/T%C4%B0NEKE-%C3%96nleyici-Silikon-Mutfak-Lavabo/dp/B0DRWB6VT3/ref=zg_bs_g_home_d_sccl_36/261-4426946-1087664?psc=1
Ev ve Yaşam,#37,"Yenigeldi 6 Adet Noel Baba Yılbaşı Ağacı Süsü, Kırmızı",Fiyat Yok,https://www.amazon.com.tr/Yenigeldi-Adet-Y%C4%B1lba%C5%9F%C4%B1-A%C4%9Fac%C4%B1-K%C4%B1rm%C4%B1z%C4%B1/dp/B0FX58QN7Q/ref=zg_bs_g_home_d_sccl_37/261-4426946-1087664?psc=1
Ev ve Yaşam,#38,Waldern Yılbaşı 6lı Merry Christmas Çan Süs 5cm,Fiyat Yok,https://www.amazon.com.tr/Waldern-Y%C4%B1lba%C5%9F%C4%B1-6l%C4%B1-Merry-Christmas/dp/B0F1MYQT4K/ref=zg_bs_g_home_d_sccl_38/261-4426946-1087664?psc=1
Ev ve Yaşam,#39,"Vileda 170644 Spino Ultra Temizlik Seti, Siyah/Kırmızı","849,00 TL",https://www.amazon.com.tr/Vileda-170644-Spino-Temizlik-K%C4%B1rm%C4%B1z%C4%B1/dp/B09R4Q224B/ref=zg_bs_g_home_d_sccl_39/261-4426946-1087664?psc=1
Ev ve Yaşam,#40,"Vileda Düz Hijyenik Bulaşık Süngeri, 5'li Ekonomik Paket, Yeşil","66,00 TL",https://www.amazon.com.tr/Vileda-Hijyenik-Bula%C5%9F%C4%B1k-S%C3%BCngeri-Ekonomik/dp/B079SBMML9/ref=zg_bs_g_home_d_sccl_40/261-4426946-1087664?psc=1
Ev ve Yaşam,#41,"Coverzone Dekoratif Dijital Alarmlı Saat, 12/24 Dönüştürme Gece Görüşlü Yatak Başucu Saati Masa Saati Led Ekran Pilli Çalar Saat 13 x 4.5x 7.5cm (Beyaz)","311,00 TL",https://www.amazon.com.tr/Dijital-Alarml%C4%B1-Saati-Ekran-Pilli/dp/B08WS4M653/ref=zg_bs_g_home_d_sccl_41/261-4426946-1087664?psc=1
Ev ve Yaşam,#42,Parex Wondero Otomatik Temizlik Seti,"1.145,00 TL",https://www.amazon.com.tr/PAREX-Wondero-Otomatik-Temizlik-Seti/dp/B0BN9JL2W9/ref=zg_bs_g_home_d_sccl_42/261-4426946-1087664?psc=1
Ev ve Yaşam,#43,"Deconox One Click Mop Paleti 4XL Büyük Palet 32cm, 8 Adet Bez Hediyeli, Asansörlü Mekanizma Çok Pratik, Tembel El Değmeden Islak Havlu Ve Bez Kullan At Otomatik, Kullan At Bezlerin Hepsine Uyumludur.","498,90 TL",https://www.amazon.com.tr/Deconox-Hediyeli-Asans%C3%B6rl%C3%BC-Mekanizma-Uyumludur/dp/B0FDMJVSP4/ref=zg_bs_g_home_d_sccl_43/261-4426946-1087664?psc=1
Ev ve Yaşam,#44,"Philips Hue GO V2 Taşınabilir Akıllı Led Masa Lambası, Bluetooth Özellikli, Beyaz ve Renkli","3.695,00 TL",https://www.amazon.com.tr/Philips-Hue-Ta%C5%9F%C4%B1nabilir-LED-Lamba/dp/B07SQ2FZTK/ref=zg_bs_g_home_d_sccl_44/261-4426946-1087664?psc=1
Ev ve Yaşam,#45,Würth 38x60 cm Sentetik Mavi Temizlik Bezi,"115,90 TL",https://www.amazon.com.tr/W%C3%BCrth-Sentetik-G%C3%BCderi-Bez-38x60/dp/B07DKF4PXG/ref=zg_bs_g_home_d_sccl_45/261-4426946-1087664?psc=1
Ev ve Yaşam,#46,"Comb Yıldızlı gökyüzü gece lambası, projektör, astronot projektör lamba, odayı dekore etmek, gece lambası ambiyansı, çocuklar ve yetişkinler için ev partisi hediyesi","624,00 TL",https://www.amazon.com.tr/Comb-projekt%C3%B6r-LED-projekt%C3%B6r-s%C3%BCslemeleri-yeti%C5%9Fkinler/dp/B09NZGRMZ7/ref=zg_bs_g_home_d_sccl_46/261-4426946-1087664?psc=1
Evcil Hayvan Ürünleri,#1,Proline Aktif Karbonlu Kedi Kumu 20 L,"334,93 TL",https://www.amazon.com.tr/Proline-Aktif-Karbonlu-Kedi-Kumu/dp/B0DDSWZVZ7/ref=zg_bs_g_pet-supplies_d_sccl_1/261-4426946-1087664?psc=1
Evcil Hayvan Ürünleri,#2,"Royal Canin Sterilised Kedi Maması, 10 Kg","3.872,41 TL",https://www.amazon.com.tr/Royal-Canin-Sterilised-Kedi-Mamas%C4%B1/dp/B0015QDXL6/ref=zg_bs_g_pet-supplies_d_sccl_2/261-4426946-1087664?psc=1
Evcil Hayvan Ürünleri,#3,"Enjoy Kuru Kedi Maması, Tavuklu, Yetişkin, 15 Kg Kahverengi","1.100,00 TL",https://www.amazon.com.tr/Enjoy-Tavuk-Etli-Yeti%C5%9Fkin-Mamas%C4%B1/dp/B07J47WMJJ/ref=zg_bs_g_pet-supplies_d_sccl_3/261-4426946-1087664?psc=1
Evcil Hayvan Ürünleri,#4,Pro Plan Purina Kısırlaştırılmış Yetişkin Kediler İçin Somonlu Kedi Maması 3 Kg,"1.091,55 TL",https://www.amazon.com.tr/Pro-Plan-K%C4%B1s%C4%B1rla%C5%9Ft%C4%B1r%C4%B1lm%C4%B1%C5%9F-Yeti%C5%9Fkin-Kediler/dp/B07BRMD923/ref=zg_bs_g_pet-supplies_d_sccl_4/261-4426946-1087664?psc=1
Evcil Hayvan Ürünleri,#5,Proline Aktif Karbonlu Topaklanan Kedi Kumu 10 Lt,"199,00 TL",https://www.amazon.com.tr/Line-Aktif-Karbonlu-Topaklanan-Kedi/dp/B0BTVYBZ3P/ref=zg_bs_g_pet-supplies_d_sccl_5/261-4426946-1087664?psc=1
Evcil Hayvan Ürünleri,#6,"Pro Plan Sterilised Kısırlaştırılmış Kediler için Somonlu Kedi Maması, 10 Kg","3.285,75 TL",https://www.amazon.com.tr/Plan-Sterilised-Somonlu-Kedi-Mamas%C4%B1/dp/B009FYKL6K/ref=zg_bs_g_pet-supplies_d_sccl_6/261-4426946-1087664?psc=1
Evcil Hayvan Ürünleri,#7,Ever Clean Litterfree Paws Esanslı Kedi Kumu Tozsuz Formül 10 Lt,"795,39 TL",https://www.amazon.com.tr/Ever-Clean-Litterfree-Paws-Kedi/dp/B0828ZP78F/ref=zg_bs_g_pet-supplies_d_sccl_7/261-4426946-1087664?psc=1
Evcil Hayvan Ürünleri,#8,Wondersand 20 Lt İnce Tane Aktif Carbon Kokusuz Süper Topaklanan Premium Kedi Kumu,Fiyat Yok,https://www.amazon.com.tr/Wondersand-Carbon-Kokusuz-Topaklanan-Premium/dp/B0BV72FTVJ/ref=zg_bs_g_pet-supplies_d_sccl_8/261-4426946-1087664?psc=1
Evcil Hayvan Ürünleri,#9,"GimCat Malt Soft Extra Kediler İçin Tamamlayıcı Mama, Zengin Protein 20 g","104,99 TL",https://www.amazon.com.tr/GimCat-Kediler-Tamamlay%C4%B1c%C4%B1-Zengin-Protein/dp/B0083B7DX0/ref=zg_bs_g_pet-supplies_d_sccl_9/261-4426946-1087664?psc=1
Evcil Hayvan Ürünleri,#10,Bonnie Basic Yetişkin Dana Etli Kedi Maması 10 Kg,"733,95 TL",https://www.amazon.com.tr/Bonnie-Basic-Adult-Cat-Beef/dp/B09XF748YB/ref=zg_bs_g_pet-supplies_d_sccl_10/261-4426946-1087664?psc=1
Evcil Hayvan Ürünleri,#11,Wanpy Karışık Sıvı Kedi Ödülü 25x14 gr,"249,00 TL",https://www.amazon.com.tr/Wanpy-Kar%C4%B1%C5%9F%C4%B1k-S%C4%B1v%C4%B1-%C3%96d%C3%BCl%C3%BC-RA-M%C4%B0X/dp/B08J6HSR41/ref=zg_bs_g_pet-supplies_d_sccl_11/261-4426946-1087664?psc=1
Evcil Hayvan Ürünleri,#12,"Royal Canin Kitten Kuru Kedi Maması, Yavru Kedi, 4 Kg","1.513,12 TL",https://www.amazon.com.tr/Royal-Canin-Kitten-Kedi-Mamas%C4%B1/dp/B0015U0QKI/ref=zg_bs_g_pet-supplies_d_sccl_12/261-4426946-1087664?psc=1
Evcil Hayvan Ürünleri,#13,Proline Marsilya Sabunu Kokulu Kedi Kumu 20 L,"299,99 TL",https://www.amazon.com.tr/Proline-Marsilya-Sabunu-Kokulu-Kedi/dp/B0DDT1H7HD/ref=zg_bs_g_pet-supplies_d_sccl_13/261-4426946-1087664?psc=1
Evcil Hayvan Ürünleri,#14,Proline Bebek Pudra Kokulu Bentonit Kedi Kumu 20 L,"310,23 TL",https://www.amazon.com.tr/Proline-Pudras%C4%B1-Kokulu-Bentonit-Ambalajda/dp/B0CBB9DMGQ/ref=zg_bs_g_pet-supplies_d_sccl_14/261-4426946-1087664?psc=1
Evcil Hayvan Ürünleri,#15,"Proline Sabun Kokulu Bentonit Kedi Kumu, 10 L","199,99 TL",https://www.amazon.com.tr/Line-Marsilya-Sabunu-Kokulu-Bentonit/dp/B07J4L4C34/ref=zg_bs_g_pet-supplies_d_sccl_15/261-4426946-1087664?psc=1
Evcil Hayvan Ürünleri,#16,"Enjoy Kuru Kedi Maması, Tavuklu, Yetişkin, Keten Tohumu ile Omega 3 & 6 Katkısı, 1 Kg","129,99 TL",https://www.amazon.com.tr/Enjoy-Tavuk-Etli-Yeti%C5%9Fkin-Mamas%C4%B1/dp/B07J48WT8M/ref=zg_bs_g_pet-supplies_d_sccl_16/261-4426946-1087664?psc=1
Evcil Hayvan Ürünleri,#17,"Busstier Akıllı Kedi Oyuncağı, Otomatik Yuvarlanan İnteraktif Top, Hareketli Kuyruk, USB Şarjlı, LED Işıklı, 3 Oyun Modu, Evcil Hayvanlar İçin Eğlenceli Oyuncak","249,00 TL",https://www.amazon.com.tr/Busstier-Yuvarlanan-%C4%B0nteraktif-Hareketli-Hayvanlar/dp/B0DRQX51X4/ref=zg_bs_g_pet-supplies_d_sccl_17/261-4426946-1087664?psc=1
Evcil Hayvan Ürünleri,#18,"GimCat Kediler İçin Multi-Vitamin, 100 g, Keten Tohumu Yağı (Omega-3 Yağ Asitleri, Dha ve Epa'nın Temelini Oluşturan Linolenik Asit İçerir), 12 Temel Vitamin","414,99 TL",https://www.amazon.com.tr/Gimcat-Multi-Vitamin-Paste-100gr/dp/B001N02MZM/ref=zg_bs_g_pet-supplies_d_sccl_18/261-4426946-1087664?psc=1
Evcil Hayvan Ürünleri,#19,Ever Clean Lavender Lavanta Kokulu Kedi Kumu 10 Lt,"775,00 TL",https://www.amazon.com.tr/Ever-Clean-Lavander-Lavantal%C4%B1-Kedi/dp/B00V7XP6AS/ref=zg_bs_g_pet-supplies_d_sccl_19/261-4426946-1087664?psc=1
Evcil Hayvan Ürünleri,#20,"Ever Clean Extra Strong Kokusuz Kedi Kumu, 10 lt","899,95 TL",https://www.amazon.com.tr/Ever-Clean-Unscented-Extra-Strong/dp/B00VTMVY9E/ref=zg_bs_g_pet-supplies_d_sccl_20/261-4426946-1087664?psc=1
Evcil Hayvan Ürünleri,#21,"Wanpy Karışık Dört Lezzetli Krema Kedi Ödülü, 50x14 Gram","439,00 TL",https://www.amazon.com.tr/Wanpy-Kar%C4%B1%C5%9F%C4%B1k-Lezzetli-Krema-%C3%96d%C3%BCl%C3%BC/dp/B0DNTN8H2W/ref=zg_bs_g_pet-supplies_d_sccl_21/261-4426946-1087664?psc=1
Evcil Hayvan Ürünleri,#22,Pro Plan Sterilised Hindili Kuru Kedi Maması 10 kg Standart,"3.196,90 TL",https://www.amazon.com.tr/Proplan-Sterilised-Hindili-Kedi-Mamas%C4%B1/dp/B009FYKI54/ref=zg_bs_g_pet-supplies_d_sccl_22/261-4426946-1087664?psc=1
Evcil Hayvan Ürünleri,#23,Gourmet Gold Kıyılmış Tavuklu Yaş Kedi Maması 85 gr x 24 Adet,"783,07 TL",https://www.amazon.com.tr/Purina-Gourmet-K%C4%B1y%C4%B1lm%C4%B1%C5%9F-Konserve-Mamas%C4%B1/dp/B08G9J77CF/ref=zg_bs_g_pet-supplies_d_sccl_23/261-4426946-1087664?psc=1
Evcil Hayvan Ürünleri,#24,LaVital Kuzulu Kısırlaştırılmış Kedi Maması 12 kg,"1.802,00 TL",https://www.amazon.com.tr/Lavital-Kuzulu-K%C4%B1s%C4%B1r-Kedi-Mamas%C4%B1/dp/B08FFG1CGZ/ref=zg_bs_g_pet-supplies_d_sccl_24/261-4426946-1087664?psc=1
Evcil Hayvan Ürünleri,#25,Pro Plan Derma Care Somonlu Tüy Sağlığı Destekleyici Kedi Maması 10 Kg,"3.046,61 TL",https://www.amazon.com.tr/Pro-Plan-DermaPlus-Hairball-Mamas%C4%B1/dp/B08BX1D2QH/ref=zg_bs_g_pet-supplies_d_sccl_25/261-4426946-1087664?psc=1
Evcil Hayvan Ürünleri,#26,Royal Canin Sterilised 37 Kısırlaştırılmış Kedi Maması 4 Kg,"1.699,00 TL",https://www.amazon.com.tr/Royal-Canin-Sterilised-K%C4%B1s%C4%B1rla%C5%9Ft%C4%B1r%C4%B1lm%C4%B1%C5%9F-Mamas%C4%B1/dp/B0015U850Q/ref=zg_bs_g_pet-supplies_d_sccl_26/261-4426946-1087664?psc=1
Evcil Hayvan Ürünleri,#27,Pro Plan Liveclear Somonlu Kısırlaştırılmış Kedi Maması 1.4 kg,"611,00 TL",https://www.amazon.com.tr/Pro-Plan-Liveclear-Sterilised-K%C4%B1s%C4%B1rla%C5%9Ft%C4%B1r%C4%B1lm%C4%B1%C5%9F/dp/B09445D4HJ/ref=zg_bs_g_pet-supplies_d_sccl_27/261-4426946-1087664?psc=1
Evcil Hayvan Ürünleri,#28,Reflex Tavuklu ve Pirinçli Yetişkin Kedi Maması 15 Kg,"1.749,99 TL",https://www.amazon.com.tr/Reflex-Tavuklu-Pirin%C3%A7li-Yeti%C5%9Fkin-Mamas%C4%B1/dp/B09ZTTTW4C/ref=zg_bs_g_pet-supplies_d_sccl_28/261-4426946-1087664?psc=1
Evcil Hayvan Ürünleri,#29,Busstier Avokado Kedi Nanesi Kedi Otu Topu Kedi Oyuncağı Yapışkanlı Catnip,Fiyat Yok,https://www.amazon.com.tr/Avokado-Nanesi-Oyunca%C4%9F%C4%B1-Yap%C4%B1%C5%9Fkanl%C4%B1-Catnip/dp/B0BT7YC5MQ/ref=zg_bs_g_pet-supplies_d_sccl_29/261-4426946-1087664?psc=1
Evcil Hayvan Ürünleri,#30,"Royal Canin Mini Adult Köpek Maması, 8 Kg","2.369,04 TL",https://www.amazon.com.tr/Royal-Canin-Adult-K%C3%BC%C3%A7%C3%BCk-Mamas%C4%B1/dp/B000T4FWQ4/ref=zg_bs_g_pet-supplies_d_sccl_30/261-4426946-1087664?psc=1
Evcil Hayvan Ürünleri,#31,Purina One Somonlu Kısır Kedi Maması 1.5 kg,"440,00 TL",https://www.amazon.com.tr/PURINA-ONE-Somonlu-K%C4%B1s%C4%B1r-Mamas%C4%B1/dp/B01M2BOCG5/ref=zg_bs_g_pet-supplies_d_sccl_31/261-4426946-1087664?psc=1
Evcil Hayvan Ürünleri,#32,Purina Cat Chow Kısırlaştırılmış Tavuklu Yetişkin Kedi Maması 15 KgCNDST15CCS,"2.100,00 TL",https://www.amazon.com.tr/Purina-Cat-Chow-K%C4%B1s%C4%B1rla%C5%9Ft%C4%B1r%C4%B1lm%C4%B1%C5%9F-Mamas%C4%B1/dp/B00O4BAPVU/ref=zg_bs_g_pet-supplies_d_sccl_32/261-4426946-1087664?psc=1
Evcil Hayvan Ürünleri,#33,"Royal Canin British ShortHair Adult Kedi Maması, 4 Kg","1.917,00 TL",https://www.amazon.com.tr/Royal-Canin-British-Shorthair-Kg/dp/B002TE0910/ref=zg_bs_g_pet-supplies_d_sccl_33/261-4426946-1087664?psc=1
Evcil Hayvan Ürünleri,#34,Miapet Elekli Kedi Tuvalet Önü Paspası 90 x 59 Cm Gri,"245,00 TL",https://www.amazon.com.tr/Miapet-Elekli-Kedi-Tuvalet-Paspas%C4%B1/dp/B092R7BCBW/ref=zg_bs_g_pet-supplies_d_sccl_34/261-4426946-1087664?psc=1
Evcil Hayvan Ürünleri,#35,Proline Doğal Topaklanan İnce Taneli Lavanta Kokulu Kedi Kumu 10 Lt,"192,45 TL",https://www.amazon.com.tr/Proline-Topaklanan-Taneli-Lavanta-Kokulu/dp/B08FR624H1/ref=zg_bs_g_pet-supplies_d_sccl_35/261-4426946-1087664?psc=1
Evcil Hayvan Ürünleri,#36,"GimCat Kedi Macunu, Yavru Kediler İçin, 50 g","250,12 TL",https://www.amazon.com.tr/Gimcat-Kitten-Paste-Vitamin-Macunu/dp/B07DJH39LZ/ref=zg_bs_g_pet-supplies_d_sccl_36/261-4426946-1087664?psc=1
Evcil Hayvan Ürünleri,#37,Pro Plan Original Somonlu Kuru Kedi Maması 10 kg,"3.035,00 TL",https://www.amazon.com.tr/Proplan-Somonlu-Yeti%C5%9Fkin-Kedi-Mamas%C4%B1/dp/B006UAB1CU/ref=zg_bs_g_pet-supplies_d_sccl_37/261-4426946-1087664?psc=1
Evcil Hayvan Ürünleri,#38,Pro Plan Original Tavuklu Kuru Yavru Kedi Maması 3 kg,"1.108,80 TL",https://www.amazon.com.tr/Pro-Plan-Original-Tavuklu-Mamas%C4%B1/dp/B07HLF74ZM/ref=zg_bs_g_pet-supplies_d_sccl_38/261-4426946-1087664?psc=1
Evcil Hayvan Ürünleri,#39,Hill's SCIENCE PLAN Somonlu Kısırlaştırılmış Yetişkin Kedi Maması 3kg,"1.300,00 TL",https://www.amazon.com.tr/Hills-SCIENCE-Somonlu-K%C4%B1s%C4%B1rla%C5%9Ft%C4%B1r%C4%B1lm%C4%B1%C5%9F-Yeti%C5%9Fkin/dp/B0DM1KV2SN/ref=zg_bs_g_pet-supplies_d_sccl_39/261-4426946-1087664?psc=1
Evcil Hayvan Ürünleri,#40,Trendline Biftekli Yetişkin Köpek Maması 15 kg,"653,39 TL",https://www.amazon.com.tr/Trendline-Biftekli-Yeti%C5%9Fkin-K%C3%B6pek-Mamas%C4%B1/dp/B07J47K6VH/ref=zg_bs_g_pet-supplies_d_sccl_40/261-4426946-1087664?psc=1
Evcil Hayvan Ürünleri,#41,"Ever Reek Kedi Kumu (10 Litre, Marsilya Sabunu Kokulu)","169,75 TL",https://www.amazon.com.tr/Ever-Reek-Marsilya-Sabunu-Kokulu/dp/B0C1T652ZC/ref=zg_bs_g_pet-supplies_d_sccl_41/261-4426946-1087664?psc=1
Evcil Hayvan Ürünleri,#42,Tineke Elastik Kendinden Yapışkanlı Renkli Kedi Oyun Oltası Kedi Oyuncağı Yapışkanlı Olta Eğitim Oyuncağı,"77,00 TL",https://www.amazon.com.tr/Tineke-Elastik-Kendinden-Yap%C4%B1%C5%9Fkanl%C4%B1-Oyunca%C4%9F%C4%B1/dp/B0CD4DM6XV/ref=zg_bs_g_pet-supplies_d_sccl_42/261-4426946-1087664?psc=1
Evcil Hayvan Ürünleri,#43,Gourmet Gold Kıyılmış Sığır Etli Yaş Kedi Maması (24 x 85 gr),"824,23 TL",https://www.amazon.com.tr/Gourmet-K%C4%B1y%C4%B1lm%C4%B1%C5%9F-S%C4%B1%C4%9F%C4%B1r-Etli-Konserve/dp/B08G9RQFF9/ref=zg_bs_g_pet-supplies_d_sccl_43/261-4426946-1087664?psc=1
Evcil Hayvan Ürünleri,#44,PRO PLAN Sterilised Somonlu Kuru Kedi Maması 10 kg +2 kg Hediye,"3.949,40 TL",https://www.amazon.com.tr/PLAN-Sterilised-Somonlu-Mamas%C4%B1-Hediye/dp/B07J568MTJ/ref=zg_bs_g_pet-supplies_d_sccl_44/261-4426946-1087664?psc=1
Evcil Hayvan Ürünleri,#45,Proline Lavanta Kokulu Bentonit Kedi Kumu 20 L,"299,99 TL",https://www.amazon.com.tr/Proline-Lavanta-Kokulu-Kedi-Kumu/dp/B0DDT2D369/ref=zg_bs_g_pet-supplies_d_sccl_45/261-4426946-1087664?psc=1
Evcil Hayvan Ürünleri,#46,"Royal Canin Fıt 32 Kedi Maması, 15 Kg","4.611,00 TL",https://www.amazon.com.tr/Royal-Canin-Fit-Kedi-Mamas%C4%B1/dp/B0099KZEJY/ref=zg_bs_g_pet-supplies_d_sccl_46/261-4426946-1087664?psc=1
Gıda Ürünleri,#1,Kahve Dünyası Lavi Karışık Dolgulu Çikolata 1kg,"500,00 TL",https://www.amazon.com.tr/D%C3%BCnyas%C4%B1-Kar%C4%B1%C5%9F%C4%B1k-Dolgulu-%C3%87ikolata-Kutulu/dp/B0CN733719/ref=zg_bs_g_grocery_d_sccl_1/261-4426946-1087664?psc=1
Gıda Ürünleri,#2,RAFFAELLO çikolata kutusu 150 gr,"128,95 TL",https://www.amazon.com.tr/Ferrero-RAFFAELLO-T15-6/dp/B002UU1P8Y/ref=zg_bs_g_grocery_d_sccl_2/261-4426946-1087664?psc=1
Gıda Ürünleri,#3,"Julius Meinl President Çekirdek Kahve, Orta Kavrulmuş, Classic Aromalı, 500 g","678,90 TL",https://www.amazon.com.tr/Julius-Meinl-Praes%C4%B1dent-500G-Bean/dp/B009PIIMXA/ref=zg_bs_g_grocery_d_sccl_3/261-4426946-1087664?psc=1
Gıda Ürünleri,#4,"Nutella - Kakaolu fındık kreması, 750 g","269,10 TL",https://www.amazon.com.tr/Nutella-750-gr/dp/B01GD0KZSC/ref=zg_bs_g_grocery_d_sccl_4/261-4426946-1087664?psc=1
Gıda Ürünleri,#5,Starbucks Veranda Blend Öğütülmüş Kahve 200 g,"288,00 TL",https://www.amazon.com.tr/Starbucks-Caffe-Veranda-Blonde-Roast/dp/B0C7CLFFWM/ref=zg_bs_g_grocery_d_sccl_5/261-4426946-1087664?psc=1
Gıda Ürünleri,#6,"Avoya Sade Maden Suyu, 6 Adet, 200 Mililitre","38,95 TL",https://www.amazon.com.tr/Avoya-Sade-Maden-Suyu-Mililitre/dp/B0DPBGZ8PV/ref=zg_bs_g_grocery_d_sccl_6/261-4426946-1087664?psc=1
Gıda Ürünleri,#7,KAHVE DUNYASI Dünyası Espresso Kavrulmuş Çekirdeği 1Kg,"650,77 TL",https://www.amazon.com.tr/Kahve-D%C3%BCnyas%C4%B1-Espresso-Kavrulmu%C5%9F-%C3%87ekirde%C4%9Fi/dp/B08XZGDBV7/ref=zg_bs_g_grocery_d_sccl_7/261-4426946-1087664?psc=1
Gıda Ürünleri,#8,Jacobs Selection Filtre Kahve 250 Gr,"199,00 TL",https://www.amazon.com.tr/Jacobs-Selection-Filtre-Kahve-250/dp/B08PW5VDLN/ref=zg_bs_g_grocery_d_sccl_8/261-4426946-1087664?psc=1
Gıda Ürünleri,#9,"Nescafe, Mocha Çikolatalı Ve Köpüklü Çözünebilir Kahve Karışımı, 17 Gram x 9 Adet",Fiyat Yok,https://www.amazon.com.tr/Nescafe-%C3%87ikolatal%C4%B1-K%C3%B6p%C3%BCkl%C3%BC-%C3%87%C3%B6z%C3%BCnebilir-Kar%C4%B1%C5%9F%C4%B1m%C4%B1/dp/B0CS6GXNYD/ref=zg_bs_g_grocery_d_sccl_9/261-4426946-1087664?psc=1
Gıda Ürünleri,#10,Züber Nutzilla Kakaolu Fındık Kreması 315gr,"355,50 TL",https://www.amazon.com.tr/Z%C3%BCber-F%C4%B1nd%C4%B1k-Kremas%C4%B1-Kakaolu-315Gr/dp/B0CSVZN96C/ref=zg_bs_g_grocery_d_sccl_10/261-4426946-1087664?psc=1
Gıda Ürünleri,#11,Kurukahveci Mehmet Efendi Türk Kahvesi 100gr Folyo Ambalaj,"83,45 TL",https://www.amazon.com.tr/Mehmet-Efendi-T%C3%BCrk-Kahvesi-100/dp/B0190KXUCU/ref=zg_bs_g_grocery_d_sccl_11/261-4426946-1087664?psc=1
Gıda Ürünleri,#12,Kahve Dünyası Filtre Kahve 250gr,"214,95 TL",https://www.amazon.com.tr/Kahve-D%C3%BCnyas%C4%B1-Filtre-250gr/dp/B07XLD4Y8Q/ref=zg_bs_g_grocery_d_sccl_12/261-4426946-1087664?psc=1
Gıda Ürünleri,#13,Lipton Earl Grey Dökme Bergamot Aromalı Siyah Çay Özel Seri 1000 GR,"357,90 TL",https://www.amazon.com.tr/Lipton-Earl-Grey-D%C3%B6kme-1000gr/dp/B078GP5VN3/ref=zg_bs_g_grocery_d_sccl_13/261-4426946-1087664?psc=1
Gıda Ürünleri,#14,Caprisun Multi Vitamin Karışık Meyveli (200 ml x 20 Adet),"330,00 TL",https://www.amazon.com.tr/200-Caprisun-Multi-20Li-Po%C5%9Fet/dp/B08TWTBY9G/ref=zg_bs_g_grocery_d_sccl_14/261-4426946-1087664?psc=1
Gıda Ürünleri,#15,"Julius Meinl Präsident Blend Öğütülmüş Filtre Kahve, Orta Kavrulmuş, Yumuşak İçim 220 g","304,99 TL",https://www.amazon.com.tr/Julius-Meinl-Praes%C4%B1dent-Blend-Ground/dp/B009PIIP82/ref=zg_bs_g_grocery_d_sccl_15/261-4426946-1087664?psc=1
Gıda Ürünleri,#16,Lipton Earl Grey Demlik Süzen Poşet Bergamot Aramolı Siyah Çay 100'lü Paket,"157,50 TL",https://www.amazon.com.tr/L%C4%B0PTON-Early-Demlik-Po%C5%9Fet-100l%C3%BC/dp/B07K8XP123/ref=zg_bs_g_grocery_d_sccl_16/261-4426946-1087664?psc=1
Gıda Ürünleri,#17,Balparmak Çam Balı 850 g,Fiyat Yok,https://www.amazon.com.tr/BALPARMAK-%C3%87AM-BALI-850-G/dp/B00EG6C4SU/ref=zg_bs_g_grocery_d_sccl_17/261-4426946-1087664?psc=1
Gıda Ürünleri,#18,Starbucks By Nespresso Blonde Espresso Kapsül Kahve 1 X 10 Adet,"314,50 TL",https://www.amazon.com.tr/Starbucks-Nespresso-Blonde-Espresso-Kaps%C3%BCl/dp/B07SYYDKW7/ref=zg_bs_g_grocery_d_sccl_18/261-4426946-1087664?psc=1
Gıda Ürünleri,#19,İnişdibi Maden Suyu 24'lü Paket (200 ml x 24 Adet),"349,40 TL",https://www.amazon.com.tr/%C4%B0N%C4%B0%C5%9ED%C4%B0B%C4%B0-%C4%B0ni%C5%9Fdibi-Maden-Suyu-24l%C3%BC/dp/B08TWW3SBY/ref=zg_bs_g_grocery_d_sccl_19/261-4426946-1087664?psc=1
Gıda Ürünleri,#20,Lipton Yellow Label Dökme Siyah Çay 1000 Gr,"249,95 TL",https://www.amazon.com.tr/L%C4%B0PTON-Yellow-Label-D%C3%B6kme-1000/dp/B07K8YDLT1/ref=zg_bs_g_grocery_d_sccl_20/261-4426946-1087664?psc=1
Gıda Ürünleri,#21,Züber%100 Fıstık Ezmesi 315 g,"204,15 TL",https://www.amazon.com.tr/Z%C3%BCber-100-F%C4%B1st%C4%B1k-Ezmesi-315/dp/B0C7JS376M/ref=zg_bs_g_grocery_d_sccl_21/261-4426946-1087664?psc=1
Gıda Ürünleri,#22,Jacobs Monarch 250 Gram Filtre Kahve,"244,30 TL",https://www.amazon.com.tr/Jacobs-Monarch-Filtre-Kahve-250/dp/B00QWZ2SMA/ref=zg_bs_g_grocery_d_sccl_22/261-4426946-1087664?psc=1
Gıda Ürünleri,#23,Milka Spread Fındıklı Sürülebilir Çikolata - 350 gr,"119,90 TL",https://www.amazon.com.tr/Milka-Spread-F%C4%B1nd%C4%B1kl%C4%B1-S%C3%BCr%C3%BClebilir-%C3%87ikolata/dp/B0DFMK28TV/ref=zg_bs_g_grocery_d_sccl_23/261-4426946-1087664?psc=1
Gıda Ürünleri,#24,Balparmak Çıtkapak Yüksek Yayla Çiçek Balı (Özel Seçim) 600 Gr,"584,00 TL",https://www.amazon.com.tr/Balparmak-%C3%87%C4%B1tkapak-Se%C3%A7im-S%C3%BCzme-%C3%87i%C3%A7ek/dp/B07MXNPMVX/ref=zg_bs_g_grocery_d_sccl_24/261-4426946-1087664?psc=1
Gıda Ürünleri,#25,Moliendo Finest Coffee House Blend Filtre Kahve (Öğütülmüş Filtre Kahve) 250 g,"287,28 TL",https://www.amazon.com.tr/Moliendo-House-Blend-Filtre-%C3%96%C4%9F%C3%BCt%C3%BClm%C3%BC%C5%9F/dp/B0B7XL1MFY/ref=zg_bs_g_grocery_d_sccl_25/261-4426946-1087664?psc=1
Gıda Ürünleri,#26,KAHVE DUNYASI Dünyası Filtre Kavrulmuş Çekirdek 1 Kg,"621,34 TL",https://www.amazon.com.tr/Kahve-D%C3%BCnyas%C4%B1-Filtre-Kavrulmu%C5%9F-%C3%87ekirdek/dp/B0B724Q6Y8/ref=zg_bs_g_grocery_d_sccl_26/261-4426946-1087664?psc=1
Gıda Ürünleri,#27,Dardanel Ayçiçek Yağlı Ton Balığı 2x140 gr,"159,90 TL",https://www.amazon.com.tr/Dardanel-Ay%C3%A7i%C3%A7ek-Ya%C4%9Fl%C4%B1-Bal%C4%B1%C4%9F%C4%B1-2x140/dp/B0BD63T269/ref=zg_bs_g_grocery_d_sccl_27/261-4426946-1087664?psc=1
Gıda Ürünleri,#28,Eti Lifalif Yulaf Ezmesi 950 g,Fiyat Yok,https://www.amazon.com.tr/Eti-Lifalif-Yulaf-Ezmesi-950/dp/B0C3RMKZ53/ref=zg_bs_g_grocery_d_sccl_28/261-4426946-1087664?psc=1
Gıda Ürünleri,#29,"Nescafé Gold Çözünebilir Kahve Ekopaket, 200 g","399,00 TL",https://www.amazon.com.tr/Nescaf%C3%A9-%C3%87%C3%B6z%C3%BCnebilir-Kahve-200gr-Ekopaket/dp/B00K1VTTHS/ref=zg_bs_g_grocery_d_sccl_29/261-4426946-1087664?psc=1
Gıda Ürünleri,#30,Ahmad Tea English Breakfast Bardak Poşet Çay (25'li),"87,85 TL",https://www.amazon.com.tr/Ahmad-Tea-English-Breakfast-Bardak/dp/B091RCKBTD/ref=zg_bs_g_grocery_d_sccl_30/261-4426946-1087664?psc=1
Gıda Ürünleri,#31,"Jacobs Barista Editions Crema Italiano Çekirdek Kahve, 1 kg","715,90 TL",https://www.amazon.com.tr/Jacobs-Barista-Editions-Italiano-%C3%87ekirdek/dp/B09J4TV4NQ/ref=zg_bs_g_grocery_d_sccl_31/261-4426946-1087664?psc=1
Gıda Ürünleri,#32,yayla 1 kg Baldo Pirinç,"108,48 TL",https://www.amazon.com.tr/Yayla-Baldo-Pirin%C3%A7-1-Kg/dp/B07SRM4BZK/ref=zg_bs_g_grocery_d_sccl_32/261-4426946-1087664?psc=1
Gıda Ürünleri,#33,Moliendo Finest Coffee Amalfi Espresso Blend Kahve (Çekirdek) 250 g,"311,22 TL",https://www.amazon.com.tr/Moliendo-Amalfi-Espresso-Blend-%C3%87ekirdek/dp/B08XZS2B5V/ref=zg_bs_g_grocery_d_sccl_33/261-4426946-1087664?psc=1
Gıda Ürünleri,#34,Lipton Tiryaki Harmanı 1000g,"299,95 TL",https://www.amazon.com.tr/Lipton-Tiryaki-Harman%C4%B1-1000g/dp/B0DV915HK4/ref=zg_bs_g_grocery_d_sccl_34/261-4426946-1087664?psc=1
Gıda Ürünleri,#35,Julius Meinl Jubilaum Öğütülmüş Filtre Kahve 220 Gram,"359,10 TL",https://www.amazon.com.tr/Julius-Meinl-Jubilaum-%C3%96%C4%9F%C3%BCt%C3%BClm%C3%BC%C5%9F-Filtre/dp/B08QNRCS26/ref=zg_bs_g_grocery_d_sccl_35/261-4426946-1087664?psc=1
