Rank,Kategori,Site Sırası,Ürün Adı,Fiyat,Link
570,Otomotiv,#15,Matte Lastik Kar Çorabı Kar Zinciri Muadili Yüksek Kalite Tekstil Kar Zinciri Superx Series (Large),"849,00 TL",https://www.amazon.com.tr/Matte-Lastik-Zinciri-Muadili-Tekstil/dp/B0BJQHHMKR/ref=zg_bs_g_automotive_d_sccl_15/258-2201869-4432107?psc=1
571,Otomotiv,#16,Osram H7 Ampul 55w 12v 0332185,"99,00 TL",https://www.amazon.com.tr/Osram-64210-Halojen-Ampul%C3%BC-folding/dp/B000UXA6AQ/ref=zg_bs_g_automotive_d_sccl_16/258-2201869-4432107?psc=1
572,Otomotiv,#17,VAVANA Spin Araba Klima Kokusu - Profesyonel Otomobil Kokusu | BPA & Sıvı İçermez | 90 Gün Etkili | Araç Parfümü (MYSTIC),"249,00 TL",https://www.amazon.com.tr/VAVANA-Araba-Klima-Kokusu-MYSTIC/dp/B09GPJRGJ3/ref=zg_bs_g_automotive_d_sccl_17/258-2201869-4432107?psc=1
573,Otomotiv,#18,"Nasiol Araç Kurulama Havlusu 60X90 cm, 600 gsm","549,00 TL",https://www.amazon.com.tr/Nasiol-Ara%C3%A7-Kurulama-Havlusu-60X90/dp/B0CB4CFJ6W/ref=zg_bs_g_automotive_d_sccl_18/258-2201869-4432107?psc=1
574,Otomotiv,#19,WÜRTH ARAÇ İÇİ TEMİZLEME SPREYİ 500ML,"299,00 TL",https://www.amazon.com.tr/W%C3%9CRTH-ARA%C3%87-TEM%C4%B0ZLEME-SPREY%C4%B0-500ML/dp/B07DKGFG5W/ref=zg_bs_g_automotive_d_sccl_19/258-2201869-4432107?psc=1
575,Otomotiv,#20,BODYGARD Motosiklet Brandası Su Geçirmez Motor Branda - Gri (LARGE),"599,00 TL",https://www.amazon.com.tr/BODYGARD-Motosiklet-Brandas%C4%B1-Ge%C3%A7irmez-Branda/dp/B0D17R8X9D/ref=zg_bs_g_automotive_d_sccl_20/258-2201869-4432107?psc=1
576,Otomotiv,#21,"Busstier Çevirmeli Ayarlı Torpido Üstü Silindir Numaratör, Telefon Numarası Gösterici, Pratik ve Şık Tasarım, Kolay Kullanım","78,90 TL",https://www.amazon.com.tr/Busstier-%C3%87evirmeli-Silindir-Numarat%C3%B6r-G%C3%B6sterici/dp/B0DSVB4YGT/ref=zg_bs_g_automotive_d_sccl_21/258-2201869-4432107?psc=1
577,Otomotiv,#22,"Nasiol Glasshield Araç Nano Yağmur Kaydırıcı Ve Su İtici Sprey-50 Ml-2 Yıl Etkili-Cam Koruma,Otomobil,Motosiklet Cam,Ayna Su Kaydırıcı,Yağmur Tutmaz Nano Kaplama","410,00 TL",https://www.amazon.com.tr/Nasiol-Glasshield-Kayd%C4%B1r%C4%B1c%C4%B1-%C4%B0tici-Etkili/dp/B071XD4KY1/ref=zg_bs_g_automotive_d_sccl_22/258-2201869-4432107?psc=1
578,Otomotiv,#23,Romofy Manyetik Araç İçi Telefon Tutucu MagSafe İle Uyumlu [Güçlü Mıknatıslar] - iPhone 11-16 Pro Max/Plus Serileri İle Uyumlu - Cep Telefonu Tutacağı Araba Telefon Tutucu,"349,00 TL",https://www.amazon.com.tr/Romofy-Manyetik-Telefon-MagSafe-M%C4%B1knat%C4%B1slar/dp/B0DGGMS36X/ref=zg_bs_g_automotive_d_sccl_23/258-2201869-4432107?psc=1
579,Otomotiv,#24,Würth 18 x 13 x 6 cm Araba Yıkama Süngeri,"138,00 TL",https://www.amazon.com.tr/W%C3%BCrth-Y%C4%B1kama-S%C3%BCngeri-Made-Germany/dp/B0797SG17M/ref=zg_bs_g_automotive_d_sccl_24/258-2201869-4432107?psc=1
580,Otomotiv,#25,"Romofy Oto Bagaj Organizer [Kalın Keçe] - Kapaklı Toparlayıcı Bagaj Çantası - Araba Aksesuar Toparlayıcı, Araç Organizer - Altında ve Yanında Bagaja Yapışan Malzeme","279,00 TL",https://www.amazon.com.tr/Romofy-Bagaj-Organizer-Kal%C4%B1n-Ke%C3%A7e/dp/B0FH2FRB8F/ref=zg_bs_g_automotive_d_sccl_25/258-2201869-4432107?psc=1
581,Otomotiv,#26,"Xiaomi Taşınabilir Elektrikli Hava Kompresörü 2 - Taşınabilir Hava Kompresörü (0,2 10,3 bar/3-150 psi, 6 mod, 2000 mAh pil, 14,4 Wh, USB-C şarj, LED ekran), siyah (ES versiyonu)","1.834,00 TL",https://www.amazon.com.tr/Xiaomi-Ta%C5%9F%C4%B1nabilir-Elektrikli-Hava-Kompres%C3%B6r%C3%BC/dp/B0CBBP8BQX/ref=zg_bs_g_automotive_d_sccl_26/258-2201869-4432107?psc=1
582,Otomotiv,#27,"Motosiklet Eldiveni Kışlık, Darbe Korumalı Kumaş Soğuk Rüzgar Geçirmez Suya Dayanıklı, Hassas Dokunmatik Ekran Uyumlu, L Beden","599,00 TL",https://www.amazon.com.tr/RVK-Kyncilor-Motosiklet-Eldiveni-Dokunmatik/dp/B0C69QZW3K/ref=zg_bs_g_automotive_d_sccl_27/258-2201869-4432107?psc=1
583,Otomotiv,#28,Romofy Oto Ruhsat Kabı Termo Deri - Araba Ruhsat Kılıfı - Araç Ruhsat Cüzdanı (Gri),"149,00 TL",https://www.amazon.com.tr/Romofy-Ruhsat-Kab%C4%B1-Termo-Deri/dp/B0DFMH568V/ref=zg_bs_g_automotive_d_sccl_28/258-2201869-4432107?psc=1
584,Otomotiv,#29,Dijital Temassız Ateş Ölçer Termometre Tabanca Model Hafızalı Pilli Bebek Çocuk Kedi Köpek Ortam Nesne Yemek Havuz,"242,20 TL",https://www.amazon.com.tr/Dijital-Temass%C4%B1z-Termometre-Tabanca-Haf%C4%B1zal%C4%B1/dp/B0F1DM7YJ2/ref=zg_bs_g_automotive_d_sccl_29/258-2201869-4432107?psc=1
585,Otomotiv,#30,Xiaomi Portable Electric Air Compressor 2 Pro,"2.745,00 TL",https://www.amazon.com.tr/Xiaomi-Portable-Electric-Air-Compressor/dp/B0DLBGZG3N/ref=zg_bs_g_automotive_d_sccl_30/258-2201869-4432107?psc=1
586,Otomotiv,#31,"Laiser Mini, Katlanabilir LED Ekranlı 17.000 PA 3ın1 Çekme-Vakum-Üfleme Özellikli Şarjlı Araç Süpürgesi","1.316,00 TL",https://www.amazon.com.tr/Laiser-Katlanabilir-%C3%87ekme-Vakum-%C3%9Cfleme-%C3%96zellikli-S%C3%BCp%C3%BCrgesi/dp/B0FXXHGJ5C/ref=zg_bs_g_automotive_d_sccl_31/258-2201869-4432107?psc=1
587,Otomotiv,#32,AEE® Kablosuz Güçlü Araç Süpürgesi ve Hava Üfleyici | 20000Pa Turbo Vakum Gücü | 3 Kademeli Fırçasız Motor | Şarjlı Mini El Süpürgesi | HEPA Filtreli Oto Süpürgesi | Ev Ofis Araba Temizlik Makinesi |,"1.699,99 TL",https://www.amazon.com.tr/Kablosuz-S%C3%BCp%C3%BCrgesi-%C3%9Cfleyici-Kademeli-F%C4%B1r%C3%A7as%C4%B1z/dp/B0G4HFH6KG/ref=zg_bs_g_automotive_d_sccl_32/258-2201869-4432107?psc=1
588,Otomotiv,#33,UTRAI Jstar Mini 13000mAh 1000A Jump Starter Taşınabilir Akü Takviye Cihazı ( Powerbank + Led Lamba),"3.749,00 TL",https://www.amazon.com.tr/UTRAI-Jstar-Mini-Ta%C5%9F%C4%B1nabilir-Powerbank/dp/B08NJR6RX2/ref=zg_bs_g_automotive_d_sccl_33/258-2201869-4432107?psc=1
589,Otomotiv,#34,Romofy Numaratör Araç İçi Park Telefon Numarası - Çevirmeli Dayanıklı Parkmatik Torpido Üstü Araba Telefon Numaralık - Oto Aksesuar Numaramatik,"139,00 TL",https://www.amazon.com.tr/Romofy-Telefon-Numaras%C4%B1-Fosforlu-Numarat%C3%B6r/dp/B0D8JHW1SH/ref=zg_bs_g_automotive_d_sccl_34/258-2201869-4432107?psc=1
590,Otomotiv,#35,"Cewaal 100 Adet Araba Gövde Döşeme Klipsleri, Araba Tutucu Klipsleri, Evrensel Oto Perçin Döşeme Kelepçesi, Araba Kapı Tampon Çamurluk Tutucu Klipsleri Astar Sızdırmazlık Şeridi Sabit Klipsler","189,90 TL",https://www.amazon.com.tr/Cewaal-Klipsleri-Evrensel-Kelep%C3%A7esi-S%C4%B1zd%C4%B1rmazl%C4%B1k/dp/B09JXP99ZH/ref=zg_bs_g_automotive_d_sccl_35/258-2201869-4432107?psc=1
591,Otomotiv,#36,AEE® 9'lu Matkap Ucu Fırça Seti Temizleme Parlatma Pasta Cila Jant Tekerlik Far Araba Araç Oto Temizlik Fırçası Seti Banyo Fayans Mutfak Duşakabin Tuvalet Halı Temizleme Kiti Parke Fayans Parlatma,"299,99 TL",https://www.amazon.com.tr/Temizleme-Parlatma-Tekerlik-Temizlik-Du%C5%9Fakabin/dp/B0F6RZ2T6W/ref=zg_bs_g_automotive_d_sccl_36/258-2201869-4432107?psc=1
592,Otomotiv,#37,"YunHan Araba Yıkama Fırçası,Araba Mopu, Paspas Temizleme Aleti Uzun Saplı Yıkama Detaylandırma Fırçası,Mikrofiber Temizleme Aleti Seti Fırça Silgi Için Arabalar Araç İçin Çiziksiz Temizleme Seti","251,90 TL",https://www.amazon.com.tr/YunHan-Temizleme-Detayland%C4%B1rma-Mikrofiber-Arabalar/dp/B0CX525Q7Z/ref=zg_bs_g_automotive_d_sccl_37/258-2201869-4432107?psc=1
593,Otomotiv,#38,Araç İçi Temizlik Fırça Seti 7'li Oto Detay Fırçası Yumuşak Toz Alma Klima Havalandırma Torpido Temizlik Aleti Jant Köpük Temizleme Motor Detay,"148,20 TL",https://www.amazon.com.tr/Temizlik-F%C4%B1r%C3%A7as%C4%B1-Yumu%C5%9Fak-Havaland%C4%B1rma-Temizleme/dp/B0FJCG8XWX/ref=zg_bs_g_automotive_d_sccl_38/258-2201869-4432107?psc=1
594,Otomotiv,#39,"Orret Home Şemsiye Şeklinde Katlanabilir Oto Güneşlik ve Oto Numaratör Seti – Araç Güneşliği, Otomobil Ön Cam Güneşlik, Araba Güneşliği, Numaratör Hediyeli Güneş Koruyucu (140x79 cm)","288,90 TL",https://www.amazon.com.tr/Orret-Home-%C5%9Eeklinde-Katlanabilir-Numarat%C3%B6r/dp/B0F79CYJX8/ref=zg_bs_g_automotive_d_sccl_39/258-2201869-4432107?psc=1
595,Otomotiv,#40,Sonax Konsantre Şampuan 1 Litre,"440,00 TL",https://www.amazon.com.tr/Sonax-Konsantre-%C5%9Eampuan-1-Litre/dp/B000S6AQOQ/ref=zg_bs_g_automotive_d_sccl_40/258-2201869-4432107?psc=1
596,Otomotiv,#41,safestore Lastik Tamir Kiti Kauçuk Vida Seti,"78,00 TL",https://www.amazon.com.tr/safestore-Lastik-Tamir-Kiti-Kau%C3%A7uk/dp/B0B99NKXZG/ref=zg_bs_g_automotive_d_sccl_41/258-2201869-4432107?psc=1
597,Otomotiv,#42,Netex Cam Suyu Antifrizli Sampuanli 5 Lt-20,"170,32 TL",https://www.amazon.com.tr/Netex-Suyu-Antifrizli-Sampuanli-Lt-20/dp/B0FTXJ7ZP5/ref=zg_bs_g_automotive_d_sccl_42/258-2201869-4432107?psc=1
598,Otomotiv,#43,Michelin MC31456 1Litre Portakal Kokulu Süper Konsantre Oto Şampuanı / 30 Yıkama,"245,00 TL",https://www.amazon.com.tr/Michelin-Mc31456-Portakal-Konsantre-%C5%9Eampuan%C4%B1/dp/B07SC2FH5T/ref=zg_bs_g_automotive_d_sccl_43/258-2201869-4432107?psc=1
599,Otomotiv,#44,Michelin MC32712 150ml Vanilya Kokulu Klima Temizleyici Sprey,"280,00 TL",https://www.amazon.com.tr/Michelin-MC32712-Vanilya-Kokulu-Temizleyici/dp/B09HY2XD4B/ref=zg_bs_g_automotive_d_sccl_44/258-2201869-4432107?psc=1
600,Otomotiv,#45,Shell Kışlık Cam Suyu -30°C Dereceye Kadar Dayanıklı Antifrizli 3 Lt Poşet Ambalaj,"449,00 TL",https://www.amazon.com.tr/Shell-Dereceye-Dayan%C4%B1kl%C4%B1-Antifrizli-Ambalaj/dp/B0DKY5NYXP/ref=zg_bs_g_automotive_d_sccl_45/258-2201869-4432107?psc=1
601,Otomotiv,#46,Spark 7050 Mikrofiber Şönil Oto Temizlik ve Kurulama Eldiveni 16x24 cm. GRİ,"150,00 TL",https://www.amazon.com.tr/Spark-7050-Mikrofiber-Temizlik-Kurulama/dp/B0B38YTFNN/ref=zg_bs_g_automotive_d_sccl_46/258-2201869-4432107?psc=1
602,Oyuncak,#1,"LEGO Yılbaşı Süsü Koleksiyonu 40744 – 6 Yaş ve Üzeri Çocuklar için Renkli Asılabilen Hediye, Noel Baba, Kardan Adam ve Ren Geyiği Yılbaşı Ağacı Süsleri İçeren Yaratıcı Oyuncak Yapım Seti (153 Parça)",Fiyat Yok,https://www.amazon.com.tr/LEGO-40744-tbd-40744/dp/B0DM64FJ8W/ref=zg_bs_g_toys_d_sccl_1/258-2201869-4432107?psc=1
603,Oyuncak,#2,"LEGO Speed Champions Ferrari SF-24 F1 Yarış Arabası 77242 – 10 Yaş ve Üzeri Kız ve Erkek Çocukları için Koleksiyonluk Sürücü Minifigürü İçeren Yapım Seti, Motor Hayranları için Model Kiti (275 Parça)",Fiyat Yok,https://www.amazon.com.tr/LEGO-Champions-Ferrari-Arabas%C4%B1-77242/dp/B0DHSBBV6R/ref=zg_bs_g_toys_d_sccl_2/258-2201869-4432107?psc=1
604,Oyuncak,#3,"LEGO Noel Baba’nın Dağıtım Kamyonu 40746 – 8 Yaş ve Üzeri Çocuklar için Yılbaşı Hediyeleri, Elf Minifigürü ve Aracın Üstüne Takılabilen Mini LEGO Yılbaşı Ağacı içeren Oyuncak Yapım Seti (224 Parça)","499,00 TL",https://www.amazon.com.tr/LEGO-40746-tbd-40746/dp/B0DK36JK7Z/ref=zg_bs_g_toys_d_sccl_3/258-2201869-4432107?psc=1
605,Oyuncak,#4,"LEGO F1 Koleksiyonluk Yarış Arabaları 71049 – 6 Yaş ve Üzeri Çocuklar için Hediye Fikri, Ferrari ve McLaren Dahil 12 Formula 1 Takımının Mini Modellerini İçeren Oyuncak Araba Yapım Seti (29 Parça)",Fiyat Yok,https://www.amazon.com.tr/LEGO-Koleksiyonluk-Arabalar%C4%B1-Tak%C4%B1m%C4%B1n%C4%B1n-Modellerini/dp/B0DHSCJX3W/ref=zg_bs_g_toys_d_sccl_4/258-2201869-4432107?psc=1
606,Oyuncak,#5,LEGO Gül 40460 Yapım Seti (120 Parça),Fiyat Yok,https://www.amazon.com.tr/LEGO-40460-Iconic-Rose/dp/B0BYZHTMVW/ref=zg_bs_g_toys_d_sccl_5/258-2201869-4432107?psc=1
607,Oyuncak,#6,"LEGO Botanicals Mini Orkide 10343 – Açık Renkli Terakota Saksı ve Ahşap Efektli Kaide İçeren Yetişkin Kadın ve Erkekler için Dekoratif Çiçek Yapım Seti, Ev ve Ofis Dekorasyonu Hediye Fikri (274 Parça)",Fiyat Yok,https://www.amazon.com.tr/LEGO-System-fig%C3%BCr-Classic-elbise/dp/B01N6CJ1QW/ref=zg_bs_g_toys_d_sccl_6/258-2201869-4432107?psc=1
608,Oyuncak,#7,"LEGO Creator Noel Baba ile Baca Eğlencesi 30692 – 6 Yaş ve Üzeri Erkek ve Kız Çocuklar için Hayal Gücünü Geliştiren Oyuncak Yapım Seti, Yeni Yıl Temalı Doğum Günü Hediye Fikri (60 Parça)","260,72 TL",https://www.amazon.com.tr/LEGO-Creator-Noel-E%C4%9Flencesi-30692/dp/B0DX6S9DDT/ref=zg_bs_g_toys_d_sccl_7/258-2201869-4432107?psc=1
609,Oyuncak,#8,"LEGO Speed Champions 2023 McLaren Formula 1 Yarış Arabası Set 76919 – 9 Yaş ve Üzeri Çocuklar için Doğum Günü Hediyesi Fikri, Sürücü Minifigürü İçeren Yaratıcı Oyuncak Yapım Seti (245 Parça)",Fiyat Yok,https://www.amazon.com.tr/LEGO-Champions-%C3%87ocuklar-Koleksiyonluk-Sergilenebilir/dp/B0CFVWTFN6/ref=zg_bs_g_toys_d_sccl_8/258-2201869-4432107?psc=1
610,Oyuncak,#9,LEGO Speed Champions Oracle Red Bull Racing RB20 F1 Yarış Arabası 77243 – Yetişkinler için Koleksiyonluk Sürücü Minifigürü ve Orijinal Detaylar İçeren Koleksiyonluk Model Yapım Seti (251 Parça),Fiyat Yok,https://www.amazon.com.tr/LEGO-Champions-Oracle-Arabas%C4%B1-77243/dp/B0DHSFBRPB/ref=zg_bs_g_toys_d_sccl_9/258-2201869-4432107?psc=1
611,Oyuncak,#10,"LEGO Yılbaşı Masa Süsü 40743 – 12 Yaş Üzeri Çocuklar için Kırmızı Mum, Orman Meyveleri, Altın Yıldızlar ve Yeşil Yapraklar İçeren Yılbaşı Temalı Yaratıcı Koleksiyonluk Oyuncak Yapım Seti (433 Parça)","999,00 TL",https://www.amazon.com.tr/LEGO-40743-tbd-40743/dp/B0DK374QGF/ref=zg_bs_g_toys_d_sccl_10/258-2201869-4432107?psc=1
612,Oyuncak,#11,LEGO Icons Krizantem 10368 - Yetişkinler için Dekoratif Kasımpatı Çiçeği Yapım Seti (278 Parça),Fiyat Yok,https://www.amazon.com.tr/LEGO-Icons-Krizantem-10368-Yeti%C5%9Fkinler/dp/B00CALHYF6/ref=zg_bs_g_toys_d_sccl_11/258-2201869-4432107?psc=1
613,Oyuncak,#12,"LEGO Botanicals Lotus Çiçekleri 40647 - Dekoratif, Koleksiyonluk ve Sergilenebilir Çiçek Modeli Yapım Seti (220 Parça)",Fiyat Yok,https://www.amazon.com.tr/Iconic-%C3%87i%C3%A7ekleri-40647-8-Dekoratif-Sergilenebilir/dp/B0C7HBX24Y/ref=zg_bs_g_toys_d_sccl_12/258-2201869-4432107?psc=1
614,Oyuncak,#13,LEGO Speed Champions Mercedes-AMG F1 W15 Yarış Arabası 77244 – 10 Yaş ve Üzeri Kız ve Erkek Çocukları için Koleksiyonluk Sürücü Minifigürü İçeren Yapım Seti ve Sergileme Seti (267 Parça),Fiyat Yok,https://www.amazon.com.tr/LEGO-Champions-Mercedes-AMG-Arabas%C4%B1-77244/dp/B0DHS9Y433/ref=zg_bs_g_toys_d_sccl_13/258-2201869-4432107?psc=1
615,Oyuncak,#14,"LEGO Speed Champions Aston Martin Aramco F1 AMR24 Yarış Arabası 77245 – 10 Yaş ve Üzeri için Koleksiyonluk Sürücü Minifigürü İçeren Yapım ve Sergileme Seti, Babalar Günü Hediyesi (269 Parça)",Fiyat Yok,https://www.amazon.com.tr/LEGO-Champions-77245-10-%C3%87ocuklar-Minifig%C3%BCr%C3%BC/dp/B0DHSDWPP2/ref=zg_bs_g_toys_d_sccl_14/258-2201869-4432107?psc=1
616,Oyuncak,#15,"LEGO Botanicals Mutlu Bitkiler 10349-9 Yaş ve Üzeri Bitki Sever Çocuklar için Renkli Saksılı Yapım Seti, Oyun ve Dekorasyon için Eğlenceli ve Öğretici LEGO Seti, Doğum Günü Hediyesi (217 Parça)","739,44 TL",https://www.amazon.com.tr/LEGO-Botanicals-Bitkiler-Dekorasyon-E%C4%9Flenceli/dp/B0DWDRZDZC/ref=zg_bs_g_toys_d_sccl_15/258-2201869-4432107?psc=1
617,Oyuncak,#16,"LEGO Botanicals Ayçiçeği 40524 – 8 Yaş ve Üzeri Çocuklar için Doğum Günü Hediyesi Fikri, Ayarlanabilir Yeşil Saplı ve Yapraklı 2 Ayçiçeği İçeren Dekoratif Yaratıcı Oyuncak Yapım Seti (191 Parça)",Fiyat Yok,https://www.amazon.com.tr/LEGO-Creator-Ay%C3%A7i%C3%A7e%C4%9Fi-Seti-40524/dp/B09PJ8ZZ1G/ref=zg_bs_g_toys_d_sccl_16/258-2201869-4432107?psc=1
618,Oyuncak,#17,LEGO Speed Champions Williams Racing FW46 F1 Yarış Arabası 77249 – 10 Yaş ve Üzeri Kız ve Erkek Çocukları ile Yetişkin Motorseverler için Sürücü Minifigürü İçeren Yapım ve Sergileme Seti (263 Parça),Fiyat Yok,https://www.amazon.com.tr/LEGO-Champions-Williams-Arabas%C4%B1-77249/dp/B0DHSD9VPK/ref=zg_bs_g_toys_d_sccl_17/258-2201869-4432107?psc=1
619,Oyuncak,#18,"Hasbro Gaming Star Wars 25'in üzerinde ses ve hareket kombinasyonuyla Çocuk elektronik baskısı, Mandalorian oyuncak","2.095,90 TL",https://www.amazon.com.tr/Star-Wars-Animatronic-Mandalorian-Oyunca%C4%9F%C4%B1/dp/B084PTVQLZ/ref=zg_bs_g_toys_d_sccl_18/258-2201869-4432107?psc=1
620,Oyuncak,#19,"LEGO NINJAGO Kai’nin Ninja Yarış Arabası EVO 71780 – 6 Yaş ve Üzeri Kız ve Erkek Çocuklar için Yılbaşı Hediyesi Fikri, Oyuncak Araba ve Kai Minifigürü İçeren Yaratıcı Oyuncak Yapım Seti (94 Parça)","460,00 TL",https://www.amazon.com.tr/NINJAGO%C2%AE-Arabas%C4%B1-%C3%87ocuklar-Minifig%C3%BCr%C3%BC-Yarat%C4%B1c%C4%B1/dp/B0BBRZYFB9/ref=zg_bs_g_toys_d_sccl_19/258-2201869-4432107?psc=1
621,Oyuncak,#20,"LEGO City McLaren Yarış Arabalı F1 Sürücüsü 60442-6 Yaş ve Üzeri Çocuklar için Mini Yarış Arabası İçeren Yaratıcı Oyuncak Yapım Seti, Doğum Günü Hediyesi (86 Parça)","479,90 TL",https://www.amazon.com.tr/LEGO-S%C3%BCr%C3%BCc%C3%BCs%C3%BC-%C3%87ocuklar-Yarat%C4%B1c%C4%B1-Hediyesi/dp/B0DHSFT1V1/ref=zg_bs_g_toys_d_sccl_20/258-2201869-4432107?psc=1
622,Oyuncak,#21,LEGO ǀ Disney Stiç 43249-9 Yaş ve Üzeri Çocuklar için Dondurma Külahlı İnşa Edilebilen Yaratıcı Oyuncak Yapım Seti (730 Parça),Fiyat Yok,https://www.amazon.com.tr/LEGO-%C3%87ocuklar-Dondurma-Edilebilen-Yarat%C4%B1c%C4%B1/dp/B0CFVZG5TR/ref=zg_bs_g_toys_d_sccl_21/258-2201869-4432107?psc=1
623,Oyuncak,#22,"LEGO Botanicals Pembe Çiçek Buketi 10342 – Yetişkinler için Gül, Papatya, Orkide, Mürver Çiçeği, Düğün Çiçeği gibi 9 Farklı Çiçek İçeren Çiçek Yapım Seti (749 Parça)","2.242,07 TL",https://www.amazon.com.tr/LEGO-Botanicals-10342-Yeti%C5%9Fkinler-Peygamber/dp/B0DHSDBVKV/ref=zg_bs_g_toys_d_sccl_22/258-2201869-4432107?psc=1
624,Oyuncak,#23,Molfy What Do You Mood Moodun Ne - Eğlenceli Grup Arkadaş Aile Kutu Oyunu - Hangisi Mod Moodun Do You Meme - Durum Kartı Oyunu,"349,00 TL",https://www.amazon.com.tr/What-You-Mood-Moodun-E%C4%9Flenceli/dp/B0CHYXQ1T4/ref=zg_bs_g_toys_d_sccl_23/258-2201869-4432107?psc=1
625,Oyuncak,#24,"BIC Kids Kid Couleur Ultra Yıkanabilir Keçeli Boya Kalemi 12 Renk, Kolayca Çoğu Kumaştan Çıkar, Su Bazlı Keçeli Kalem","107,00 TL",https://www.amazon.com.tr/Couleur-Ke%C3%A7eli-Boya-Kalemi-12Li/dp/B00008D0TQ/ref=zg_bs_g_toys_d_sccl_24/258-2201869-4432107?psc=1
626,Oyuncak,#25,"Mattel Games UNO No Mercy Kartlar Çocuklara, yetişkinlere, aileyle bir araya gelinen akşamlara, partilere ve seyahatlere yönelik UNO No Mercy Kart Oyunu HWV18",Fiyat Yok,https://www.amazon.com.tr/Mattel-HWV18-UNO-Mercy-Kartlar/dp/B0CBNR2ML6/ref=zg_bs_g_toys_d_sccl_25/258-2201869-4432107?psc=1
627,Oyuncak,#26,"LEGO Classic Büyük Boy Yaratıcı Parçalar Yapım Kutusu 10698 – 4 Yaş ve Üzeri Çocuklar için Hediye Fikri, 2 Yeşil Taban Plakası, 3 Çift Göz, 6 Lastik ve 6 Jant İçeren Oyuncak Yapım Seti (790 Parça)",Fiyat Yok,https://www.amazon.com.tr/Classic-B%C3%BCy%C3%BCk-Yarat%C4%B1c%C4%B1-Kutusu-10698/dp/B00PY3EYQO/ref=zg_bs_g_toys_d_sccl_26/258-2201869-4432107?psc=1
628,Oyuncak,#27,"LEGO Creator 3’ü 1 Arada Oyunbaz Kedi 31163-8 Yaş ve Üzeri Çocuklar için Köpek veya Güvercin Figürüne Dönüşebilen Oyuncak Yapım Seti, Doğum Günü Hediyesi (407 Parça)","922,43 TL",https://www.amazon.com.tr/LEGO-%C3%87ocuklar-G%C3%BCvercin-Fig%C3%BCr%C3%BCne-D%C3%B6n%C3%BC%C5%9Febilen/dp/B0DHSDDDZ6/ref=zg_bs_g_toys_d_sccl_27/258-2201869-4432107?psc=1
629,Oyuncak,#28,"LEGO Speed Champions Mercedes–AMG G 63 ve Mercedes–AMG SL 63 76924 – 10 Yaş ve Üzeri Kız ve Erkek Çocukları için Doğum Günü Hediyesi Fikri, 2 Model İçeren Yaratıcı Oyuncak Yapım Seti (808 Parça)",Fiyat Yok,https://www.amazon.com.tr/LEGO-Mercedes-AMG-76924-Tutkunlar%C4%B1-Edilebilen/dp/B0CWH3J5D6/ref=zg_bs_g_toys_d_sccl_28/258-2201869-4432107?psc=1
630,Oyuncak,#29,"BIC Plastidecor Elleri Kirletmeyen Pastel Boya, 18'li Kutu, Elleri Boyamaz, 30 Aydan Büyük Çocuklar İçin İdeal","75,10 TL",https://www.amazon.com.tr/BIC-Plastidecor-Kirletmeyen-Boyamaz-%C3%87ocuklar/dp/B004E9MGKK/ref=zg_bs_g_toys_d_sccl_29/258-2201869-4432107?psc=1
631,Oyuncak,#30,Tomy Şakacı Korsan,"565,99 TL",https://www.amazon.com.tr/Tomy-T7028A1-%C5%9Eakac%C4%B1-Korsan/dp/B00000JICB/ref=zg_bs_g_toys_d_sccl_30/258-2201869-4432107?psc=1
632,Oyuncak,#31,"LEGO Technic Arazi Uçağı 42198 – 8 Yaş üstü Erkek ve Kız Çocuklar için Dönen Pervane ve Pistonlu Motor İçeren Yaratıcı Rol Yapma Oyuncağı, Hediye Fikri (333 Parça)",Fiyat Yok,https://www.amazon.com.tr/LEGO-Technic-Arazi-U%C3%A7a%C4%9F%C4%B1-42198/dp/B0DHSD7JVT/ref=zg_bs_g_toys_d_sccl_31/258-2201869-4432107?psc=1
633,Oyuncak,#32,Oyuncak 2.4 Ghz Uzaktan Kumandalı Şarjlı LED Işıklı Drift Atan 15 Km Hız Yapan Off Road Araba 45 Dk Sürüş Süresi 1200 Mah Batarya (Mavi),"1.299,90 TL",https://www.amazon.com.tr/Oyuncak-Uzaktan-Kumandal%C4%B1-%C5%9Earjl%C4%B1-Batarya/dp/B0FT13HLJ9/ref=zg_bs_g_toys_d_sccl_32/258-2201869-4432107?psc=1
634,Oyuncak,#33,"Hasbro Gaming Tabu XL Kutu Oyunu, 4 Farklı Oyun Alternatifi, Klasik Oyunun Yanı Sıra Çizerek, Tabu Kuklasıyla Anlatarak ve En Fazla 15 Kelime Kullanarak Tabu Oynayın",Fiyat Yok,https://www.amazon.com.tr/Hasbro-04199131-Tabu-XL/dp/B002E2LUM4/ref=zg_bs_g_toys_d_sccl_33/258-2201869-4432107?psc=1
635,Oyuncak,#34,"LEGO ICONS Orkide 10311 - Yetişkinler İçin Dekoratif, Koleksiyonluk ve Sergilenebilir Çiçek Modeli Yapım Seti (608 Parça)","2.327,03 TL",https://www.amazon.com.tr/LEGO%C2%AE-Orkide-10311-Yeti%C5%9Fkinler-Dekoratif/dp/B09BNV2Q49/ref=zg_bs_g_toys_d_sccl_34/258-2201869-4432107?psc=1
636,Oyuncak,#35,Oyuncak Uzaktan Kumandalı El Sensörlü Akıllı WALL-E Robot Dahili Şarjlı Işıklı Sesli FULL Fonksiyonlu El Hareketlerini Algılayabilen Farklı Işık Kombinasyonlu Akıllı RC Robot (MAVİ),"999,90 TL",https://www.amazon.com.tr/Kumandal%C4%B1-Fonksiyonlu-Hareketlerini-Alg%C4%B1layabilen-Kombinasyonlu/dp/B0FJ8ZTQ7D/ref=zg_bs_g_toys_d_sccl_35/258-2201869-4432107?psc=1
637,Oyuncak,#36,"Çözülmemiş Davalar Dedektiflik Suç Çözümleme Oyunu Elif Akman Dosyası - Gizem Bulmaca Cinayet Çözme Kutu Oyunları - Katil Bulma Dedektif Oyunu - Suçlu Kim, Cinayeti Çözebilir Misin? (Dava-1)","179,00 TL",https://www.amazon.com.tr/%C3%87%C3%B6z%C3%BClmemi%C5%9F-Davalar-Dedektiflik-%C3%87%C3%B6z%C3%BCmleme-Dosyas%C4%B1/dp/B0C4HMXR9K/ref=zg_bs_g_toys_d_sccl_36/258-2201869-4432107?psc=1
638,Oyuncak,#37,"Colortouch Çıkartma Seti - 1000 Adet Çocuklar, Kızlar, Gençler ve Yetişkinler için - Scrapbook, Laptop, Günlük, Ajanda ve Planner için Bullet Journal Koleksiyon Kitabı","149,99 TL",https://www.amazon.com.tr/colortouch-Sticker-Set-Yeti%C5%9Fkinler-Koleksiyon/dp/B09RQC3FBW/ref=zg_bs_g_toys_d_sccl_37/258-2201869-4432107?psc=1
639,Oyuncak,#38,"LEGO BrickHeadz Harry Potter Azkaban Tutsağı Figürleri 40677-10 Yaş ve Üzeri Çocuklar için Dekoratif, Hediyelik Yaratıcı Model Yapım Seti (697 Parça)","1.585,00 TL",https://www.amazon.com.tr/LEGO-BrickHeadz-40677-Prisoner-Azkaban/dp/B0CX43LBLL/ref=zg_bs_g_toys_d_sccl_38/258-2201869-4432107?psc=1
640,Sağlık ve Bakım,#1,"Nutraxin Magnesium Complex Gıda Takviyesi, 60 Tablet","284,00 TL",https://www.amazon.com.tr/Nutraxin-Manesium-60-Tablet/dp/B0BX424G1Z/ref=zg_bs_g_hpc_d_sccl_1/258-2201869-4432107?psc=1
641,Sağlık ve Bakım,#2,"OMO Express Fresh Kötü Koku Karşıtı Beyaz ve Renkliler Sıvı Çamaşır Deterjanı, 1480 ml","199,00 TL",https://www.amazon.com.tr/OMO-Express-Kar%C5%9F%C4%B1t%C4%B1-Renkliler-Deterjan%C4%B1/dp/B0DCZS98ZT/ref=zg_bs_g_hpc_d_sccl_2/258-2201869-4432107?psc=1
642,Sağlık ve Bakım,#3,Nutraxin D3K2 Vitamin 30 Ml,"193,29 TL",https://www.amazon.com.tr/Nutraxin-D3K2-Vitamin-30-Ml/dp/B0BX3ZXLS8/ref=zg_bs_g_hpc_d_sccl_3/258-2201869-4432107?psc=1
643,Sağlık ve Bakım,#4,Oral-B Şarjlı/Elektrikli Diş Fırçası Vitality Pro Siyah Koruma ve Temizlik,Fiyat Yok,https://www.amazon.com.tr/Oral-B-Elektrikli-F%C4%B1r%C3%A7as%C4%B1-Vitality-Temizlik/dp/B0B51CWCN7/ref=zg_bs_g_hpc_d_sccl_4/258-2201869-4432107?psc=1
644,Sağlık ve Bakım,#5,Nutraxin Vitals Omega-3 2000 mg EPA + DHA Balık Yağı içeren Takviye Edici Gıda (1 x 60 kapsül),"387,99 TL",https://www.amazon.com.tr/Nutraxin-Omega-2000-Mg-Softgel/dp/B07HRY67XJ/ref=zg_bs_g_hpc_d_sccl_5/258-2201869-4432107?psc=1
645,Sağlık ve Bakım,#6,Sleepy Easy Clean Yüzey Temizlik Havlusu&Mendili 100 Yaprak,"74,00 TL",https://www.amazon.com.tr/Sleepy-Clean-Temizlik-Havlusu-Yaprak/dp/B0B97Y7T13/ref=zg_bs_g_hpc_d_sccl_6/258-2201869-4432107?psc=1
646,Sağlık ve Bakım,#7,Sleepy Easy Clean Çamaşır Suyu Katkılı Yüzey Temizlik Havlusu&Mendili 100 Yaprak,"70,00 TL",https://www.amazon.com.tr/Sleepy-%C3%87ama%C5%9F%C4%B1r-Katk%C4%B1l%C4%B1-Temizlik-Havlusu/dp/B0CFFKDKXV/ref=zg_bs_g_hpc_d_sccl_7/258-2201869-4432107?psc=1
647,Sağlık ve Bakım,#8,SOLO Bambu Katkılı Tuvalet Kağıdı 40’lı,"289,90 TL",https://www.amazon.com.tr/Solo-Tuvalet-Ka%C4%9F%C4%B1d%C4%B1-Bambu-Katk%C4%B1l%C4%B1/dp/B0C4Z1DDSL/ref=zg_bs_g_hpc_d_sccl_8/258-2201869-4432107?psc=1
648,Sağlık ve Bakım,#9,Sleepy Easy Clean Arap Sabunu Katkılı Yüzey Temizlik Havlusu&Mendili 100 Yaprak,"68,00 TL",https://www.amazon.com.tr/Sleepy-Sabunu-Katk%C4%B1l%C4%B1-Temizlik-Havlusu/dp/B0CFFJQNWH/ref=zg_bs_g_hpc_d_sccl_9/258-2201869-4432107?psc=1
649,Sağlık ve Bakım,#10,Perwoll Yenileme Siyahlar için Sıvı Deterjan 54 Yıkama 2.97 Lt,"203,31 TL",https://www.amazon.com.tr/Perwoll-Hassas-%C3%87ama%C5%9F%C4%B1r-Deterjan%C4%B1-Siyah/dp/B00LN89EBO/ref=zg_bs_g_hpc_d_sccl_10/258-2201869-4432107?psc=1
650,Sağlık ve Bakım,#11,SOLO Bambu Katkılı Kağıt Havlu 16'lı,"245,61 TL",https://www.amazon.com.tr/Solo-Ka%C4%9F%C4%B1t-Havlu-Bambu-Katk%C4%B1l%C4%B1/dp/B0C4Z228D8/ref=zg_bs_g_hpc_d_sccl_11/258-2201869-4432107?psc=1
651,Sağlık ve Bakım,#12,Asperox Sparx Diamond Bulaşık Makinesi Kapsülü 60 Adet,"195,93 TL",https://www.amazon.com.tr/Asperox-Diamond-Bula%C5%9F%C4%B1k-Makinesi-Kaps%C3%BCl%C3%BC/dp/B08MVSZ79P/ref=zg_bs_g_hpc_d_sccl_12/258-2201869-4432107?psc=1
652,Sağlık ve Bakım,#13,Perwoll Geliştirilmiş Renkli Sıvı Çamaşır Detarjanı 2970 ml,"253,00 TL",https://www.amazon.com.tr/Perwoll-Hassas-%C3%87ama%C5%9F%C4%B1r-Deterjan%C4%B1-Renkli/dp/B00KHB2ZIW/ref=zg_bs_g_hpc_d_sccl_13/258-2201869-4432107?psc=1
