Kategori,Sıra,Ürün Adı,Fiyat,Link
Otomotiv,#29,"WÖRF Araba Cam Buz Çözücü Sprey, Buzlanma Önleyici, 500 ml, 2'li Set, Buz Kazıyıcı Hediyeli","299,00 TL",https://www.amazon.com.tr/%C3%87%C3%B6z%C3%BCc%C3%BC-Buzlanma-%C3%96nleyici-Kaz%C4%B1y%C4%B1c%C4%B1-Hediyeli/dp/B0FZJDX1PC/ref=zg_bs_g_automotive_d_sccl_29/261-4426946-1087664?psc=1
Otomotiv,#30,AEE® 9'lu Matkap Ucu Fırça Seti Temizleme Parlatma Pasta Cila Jant Tekerlik Far Araba Araç Oto Temizlik Fırçası Seti Banyo Fayans Mutfak Duşakabin Tuvalet Halı Temizleme Kiti Parke Fayans Parlatma,"299,99 TL",https://www.amazon.com.tr/Temizleme-Parlatma-Tekerlik-Temizlik-Du%C5%9Fakabin/dp/B0F6RZ2T6W/ref=zg_bs_g_automotive_d_sccl_30/261-4426946-1087664?psc=1
Otomotiv,#31,Sahler Tesla Model Y Juniper 2025+ ile Uyumlu 4.5D PRO Premium Oto Havuzlu Paspas,"1.963,99 TL",https://www.amazon.com.tr/Sahler-Juniper-Uyumlu-Premium-Havuzlu/dp/B0FBS4Z36X/ref=zg_bs_g_automotive_d_sccl_31/261-4426946-1087664?psc=1
Otomotiv,#32,Sahler Vw Golf 8 eTsi Otomatik ile Uyumlu (2021+) Araca Özel 4.5D Havuzlu Oto Paspas,"1.530,99 TL",https://www.amazon.com.tr/Sahler-Volkswagen-Otomatik-Havuzlu-Paspas/dp/B0BDLW11LR/ref=zg_bs_g_automotive_d_sccl_32/261-4426946-1087664?psc=1
Otomotiv,#33,"Busstier Geniş Torpido Fırçası, Klima ve Torpido Temizlik Aleti, Araç İçi Derinlemesine Temizlik","109,00 TL",https://www.amazon.com.tr/Busstier-Torpido-F%C4%B1r%C3%A7as%C4%B1-Temizlik-Derinlemesine/dp/B0D6XGZFS8/ref=zg_bs_g_automotive_d_sccl_33/261-4426946-1087664?psc=1
Otomotiv,#34,"Xiaomi Taşınabilir Elektrikli Hava Kompresörü 2 - Taşınabilir Hava Kompresörü (0,2 10,3 bar/3-150 psi, 6 mod, 2000 mAh pil, 14,4 Wh, USB-C şarj, LED ekran), siyah (ES versiyonu)","1.939,00 TL",https://www.amazon.com.tr/Xiaomi-Ta%C5%9F%C4%B1nabilir-Elektrikli-Hava-Kompres%C3%B6r%C3%BC/dp/B0CBBP8BQX/ref=zg_bs_g_automotive_d_sccl_34/261-4426946-1087664?psc=1
Otomotiv,#35,"Romofy Oto Bagaj Organizer [Kalın Keçe] - Kapaklı Toparlayıcı Bagaj Çantası - Araba Aksesuar Toparlayıcı, Araç Organizer - Altında ve Yanında Bagaja Yapışan Malzeme","279,00 TL",https://www.amazon.com.tr/Romofy-Bagaj-Organizer-Kal%C4%B1n-Ke%C3%A7e/dp/B0FH2FRB8F/ref=zg_bs_g_automotive_d_sccl_35/261-4426946-1087664?psc=1
Otomotiv,#36,Aluminyum Sibop Kapağı Dörtlü Set Jet Siyah,"149,00 TL",https://www.amazon.com.tr/Aluminyum-Sibop-Kapa%C4%9F%C4%B1-D%C3%B6rtl%C3%BC-Siyah/dp/B0B9HVW3N6/ref=zg_bs_g_automotive_d_sccl_36/261-4426946-1087664?psc=1
Otomotiv,#37,"Tesla Wall Connector Gen 3 Tip 2 22KW/32A 7,3m Kablolu 4 Yıl Garanti Elektrikli Araç Şarj İstasyonu","27.535,00 TL",https://www.amazon.com.tr/TESLA-Wall-Connector-Gen-3/dp/B0BW16BBKQ/ref=zg_bs_g_automotive_d_sccl_37/261-4426946-1087664?psc=1
Otomotiv,#38,Alisveristime Oto Ruhsat Kabı Suni Deri (Siyah),"158,90 TL",https://www.amazon.com.tr/Ruhsat-Kab%C4%B1-Suni-Deri-Siyah/dp/B07CN71X65/ref=zg_bs_g_automotive_d_sccl_38/261-4426946-1087664?psc=1
Oyuncak,#1,"LEGO Speed Champions Ferrari SF-24 F1 Yarış Arabası 77242 – 10 Yaş ve Üzeri Kız ve Erkek Çocukları için Koleksiyonluk Sürücü Minifigürü İçeren Yapım Seti, Motor Hayranları için Model Kiti (275 Parça)","999,90 TL",https://www.amazon.com.tr/LEGO-Champions-Ferrari-Arabas%C4%B1-77242/dp/B0DHSBBV6R/ref=zg_bs_g_toys_d_sccl_1/261-4426946-1087664?psc=1
Oyuncak,#2,"LEGO F1 Koleksiyonluk Yarış Arabaları 71049 – 6 Yaş ve Üzeri Çocuklar için Hediye Fikri, Ferrari ve McLaren Dahil 12 Formula 1 Takımının Mini Modellerini İçeren Oyuncak Araba Yapım Seti (29 Parça)","153,92 TL",https://www.amazon.com.tr/LEGO-Koleksiyonluk-Arabalar%C4%B1-Tak%C4%B1m%C4%B1n%C4%B1n-Modellerini/dp/B0DHSCJX3W/ref=zg_bs_g_toys_d_sccl_2/261-4426946-1087664?psc=1
Oyuncak,#3,LEGO Speed Champions Oracle Red Bull Racing RB20 F1 Yarış Arabası 77243 – Yetişkinler için Koleksiyonluk Sürücü Minifigürü ve Orijinal Detaylar İçeren Koleksiyonluk Model Yapım Seti (251 Parça),"958,30 TL",https://www.amazon.com.tr/LEGO-Champions-Oracle-Arabas%C4%B1-77243/dp/B0DHSFBRPB/ref=zg_bs_g_toys_d_sccl_3/261-4426946-1087664?psc=1
Oyuncak,#4,"LEGO Yılbaşı Süsü Koleksiyonu 40744 – 6 Yaş ve Üzeri Çocuklar için Renkli Asılabilen Hediye, Noel Baba, Kardan Adam ve Ren Geyiği Yılbaşı Ağacı Süsleri İçeren Yaratıcı Oyuncak Yapım Seti (153 Parça)","622,26 TL",https://www.amazon.com.tr/LEGO-40744-tbd-40744/dp/B0DM64FJ8W/ref=zg_bs_g_toys_d_sccl_4/261-4426946-1087664?psc=1
Oyuncak,#5,Play-Doh Mini 4'lü Hamur,"48,97 TL",https://www.amazon.com.tr/Play-Doh-23241EU4-Mini-4l%C3%BC-Hamur/dp/B01LZWD3XK/ref=zg_bs_g_toys_d_sccl_5/261-4426946-1087664?psc=1
Oyuncak,#6,"LEGO Botanicals Mini Orkide 10343 – Açık Renkli Terakota Saksı ve Ahşap Efektli Kaide İçeren Yetişkin Kadın ve Erkekler için Dekoratif Çiçek Yapım Seti, Ev ve Ofis Dekorasyonu Hediye Fikri (274 Parça)",Fiyat Yok,https://www.amazon.com.tr/LEGO-System-fig%C3%BCr-Classic-elbise/dp/B01N6CJ1QW/ref=zg_bs_g_toys_d_sccl_6/261-4426946-1087664?psc=1
Oyuncak,#7,"LEGO Speed Champions 2023 McLaren Formula 1 Yarış Arabası Set 76919 – 9 Yaş ve Üzeri Çocuklar için Doğum Günü Hediyesi Fikri, Sürücü Minifigürü İçeren Yaratıcı Oyuncak Yapım Seti (245 Parça)","835,64 TL",https://www.amazon.com.tr/LEGO-Champions-%C3%87ocuklar-Koleksiyonluk-Sergilenebilir/dp/B0CFVWTFN6/ref=zg_bs_g_toys_d_sccl_7/261-4426946-1087664?psc=1
Oyuncak,#8,"Hasbro Gaming Monopoly Kutu Oyunu, 8+ yaş","803,00 TL",https://www.amazon.com.tr/Hasbro-C10091310-Monopoly/dp/B07CK7V1ZS/ref=zg_bs_g_toys_d_sccl_8/261-4426946-1087664?psc=1
Oyuncak,#9,"BIC Kids Kid Couleur Ultra Yıkanabilir Keçeli Boya Kalemi 12 Renk, Kolayca Çoğu Kumaştan Çıkar, Su Bazlı Keçeli Kalem","89,90 TL",https://www.amazon.com.tr/Couleur-Ke%C3%A7eli-Boya-Kalemi-12Li/dp/B00008D0TQ/ref=zg_bs_g_toys_d_sccl_9/261-4426946-1087664?psc=1
Oyuncak,#10,"LEGO Technic Ağır İş Buldozeri 42163 – 7 Yaş ve Üzeri Kız ve Erkek Çocuklar için Doğum Günü Hediyesi Fikri, Oyuncak İnşaat Aracı İçeren Koleksiyonluk Yaratıcı Model Oyuncak Yapım Seti (195 Parça)","297,54 TL",https://www.amazon.com.tr/LEGO-Buldozeri-%C3%87ocuklar-Koleksiyonluk-Yarat%C4%B1c%C4%B1/dp/B0CFVN4XVL/ref=zg_bs_g_toys_d_sccl_10/261-4426946-1087664?psc=1
Oyuncak,#11,"LEGO Botanicals Kiraz Çiçekleri Kutlama Hediyesi 40725 – 8 Yaş ve Üzeri Çocuklar için Doğum Günü Hediyesi Fikri, Pastel Tonlarda Çiçeklerle Kaplı 2 Dal İçeren Dekoratif Yaratıcı Oyuncak Yapım Seti","569,32 TL",https://www.amazon.com.tr/LEGO-Icons-Kiraz-%C3%87i%C3%A7ekleri-40725/dp/B0CFW1NHPC/ref=zg_bs_g_toys_d_sccl_11/261-4426946-1087664?psc=1
Oyuncak,#12,"LEGO Botanicals Ayçiçeği 40524 – 8 Yaş ve Üzeri Çocuklar için Doğum Günü Hediyesi Fikri, Ayarlanabilir Yeşil Saplı ve Yapraklı 2 Ayçiçeği İçeren Dekoratif Yaratıcı Oyuncak Yapım Seti (191 Parça)","452,54 TL",https://www.amazon.com.tr/LEGO-Creator-Ay%C3%A7i%C3%A7e%C4%9Fi-Seti-40524/dp/B09PJ8ZZ1G/ref=zg_bs_g_toys_d_sccl_12/261-4426946-1087664?psc=1
Oyuncak,#13,"LEGO Icons Gül 40460 - Dekoratif, Koleksiyonluk ve Sergilenebilir Çiçek Modeli Yapım Seti (120 Parça)","510,30 TL",https://www.amazon.com.tr/LEGO-40460-Iconic-Rose/dp/B0BYZHTMVW/ref=zg_bs_g_toys_d_sccl_13/261-4426946-1087664?psc=1
Oyuncak,#14,LEGO Speed Champions Mercedes-AMG F1 W15 Yarış Arabası 77244 – 10 Yaş ve Üzeri Kız ve Erkek Çocukları için Koleksiyonluk Sürücü Minifigürü İçeren Yapım Seti ve Sergileme Seti (267 Parça),"958,30 TL",https://www.amazon.com.tr/LEGO-Champions-Mercedes-AMG-Arabas%C4%B1-77244/dp/B0DHS9Y433/ref=zg_bs_g_toys_d_sccl_14/261-4426946-1087664?psc=1
Oyuncak,#15,"LEGO Botanicals Mutlu Bitkiler 10349-9 Yaş ve Üzeri Bitki Sever Çocuklar için Renkli Saksılı Yapım Seti, Oyun ve Dekorasyon için Eğlenceli ve Öğretici LEGO Seti, Doğum Günü Hediyesi (217 Parça)","664,30 TL",https://www.amazon.com.tr/LEGO-Botanicals-Bitkiler-Dekorasyon-E%C4%9Flenceli/dp/B0DWDRZDZC/ref=zg_bs_g_toys_d_sccl_15/261-4426946-1087664?psc=1
Oyuncak,#16,"LEGO Botanicals Pembe Çiçek Buketi 10342 – Yetişkinler için Gül, Papatya, Orkide, Mürver Çiçeği, Düğün Çiçeği gibi 9 Farklı Çiçek İçeren Çiçek Yapım Seti (749 Parça)","2.099,00 TL",https://www.amazon.com.tr/LEGO-Botanicals-10342-Yeti%C5%9Fkinler-Peygamber/dp/B0DHSDBVKV/ref=zg_bs_g_toys_d_sccl_16/261-4426946-1087664?psc=1
Oyuncak,#17,"LEGO Botanicals Lotus Çiçekleri 40647 - Dekoratif, Koleksiyonluk ve Sergilenebilir Çiçek Modeli Yapım Seti (220 Parça)","510,30 TL",https://www.amazon.com.tr/Iconic-%C3%87i%C3%A7ekleri-40647-8-Dekoratif-Sergilenebilir/dp/B0C7HBX24Y/ref=zg_bs_g_toys_d_sccl_17/261-4426946-1087664?psc=1
Oyuncak,#18,"LEGO Classic Büyük Boy Yaratıcı Parçalar Yapım Kutusu 10698 – 4 Yaş ve Üzeri Çocuklar için Hediye Fikri, 2 Yeşil Taban Plakası, 3 Çift Göz, 6 Lastik ve 6 Jant İçeren Oyuncak Yapım Seti (790 Parça)","1.871,93 TL",https://www.amazon.com.tr/Classic-B%C3%BCy%C3%BCk-Yarat%C4%B1c%C4%B1-Kutusu-10698/dp/B00PY3EYQO/ref=zg_bs_g_toys_d_sccl_18/261-4426946-1087664?psc=1
Oyuncak,#19,"LEGO Harry Potter Hogwarts Şatosu: Uçuş Dersleri 76447 – 9 Yaş ve Üzeri Çocuklar ve Yetişkinler için Hediye Fikri, 6 Karakter Minifigürü İçeren Koleksiyonluk Yaratıcı Oyuncak Yapım Seti (651 Parça)","1.940,91 TL",https://www.amazon.com.tr/LEGO-Harry-Potter-Hogwarts-%C5%9Eatosu/dp/B0DHSFB2SQ/ref=zg_bs_g_toys_d_sccl_19/261-4426946-1087664?psc=1
Oyuncak,#20,"LEGO Technic Kazıcı Yükleyici 42197 – 7 Yaş ve Üzeri Kız ve Erkek Çocukları için Arka Kazıcı, Kepçe ve Dengeleyici İçeren Yapım Seti, Hediye Fikri (104 Parça)",Fiyat Yok,https://www.amazon.com.tr/LEGO-Technic-Kaz%C4%B1c%C4%B1-Y%C3%BCkleyici-42197/dp/B0DHSCSCFG/ref=zg_bs_g_toys_d_sccl_20/261-4426946-1087664?psc=1
Oyuncak,#21,"LEGO Creator Noel Baba ile Baca Eğlencesi 30692 – 6 Yaş ve Üzeri Erkek ve Kız Çocuklar için Hayal Gücünü Geliştiren Oyuncak Yapım Seti, Yeni Yıl Temalı Doğum Günü Hediye Fikri (60 Parça)","187,10 TL",https://www.amazon.com.tr/LEGO-Creator-Noel-E%C4%9Flencesi-30692/dp/B0DX6S9DDT/ref=zg_bs_g_toys_d_sccl_21/261-4426946-1087664?psc=1
Oyuncak,#22,"LEGO Creator 3’ü 1 Arada Retro Fotoğraf Makinesi 31147-8 Yaş ve Üzeri Çocuklar için Televizyon ve Video Kamera Model Seçenekleri İçeren Yaratıcı Oyuncak Yapım Seti, Doğum Günü Hediyesi (261 Parça)",Fiyat Yok,https://www.amazon.com.tr/LEGO-Foto%C4%9Fraf-Makinesi-Televizyon-Se%C3%A7enekleri/dp/B0CFW1CWHW/ref=zg_bs_g_toys_d_sccl_22/261-4426946-1087664?psc=1
Oyuncak,#23,"Hasbro Gaming Star Wars 25'in üzerinde ses ve hareket kombinasyonuyla Çocuk elektronik baskısı, Mandalorian oyuncak","2.096,90 TL",https://www.amazon.com.tr/Star-Wars-Animatronic-Mandalorian-Oyunca%C4%9F%C4%B1/dp/B084PTVQLZ/ref=zg_bs_g_toys_d_sccl_23/261-4426946-1087664?psc=1
Oyuncak,#24,LEGO Icons Krizantem 10368 - Yetişkinler için Dekoratif Kasımpatı Çiçeği Yapım Seti (278 Parça),"1.124,90 TL",https://www.amazon.com.tr/LEGO-Icons-Krizantem-10368-Yeti%C5%9Fkinler/dp/B00CALHYF6/ref=zg_bs_g_toys_d_sccl_24/261-4426946-1087664?psc=1
Oyuncak,#25,"Mattel Brick Shop Hot Wheels Speed Maserati, JFR90","909,30 TL",https://www.amazon.com.tr/Mattel-Brick-Shop-Maserati-JFR90/dp/B0DMW6CNZ5/ref=zg_bs_g_toys_d_sccl_25/261-4426946-1087664?psc=1
Oyuncak,#26,"BIC Plastidecor Elleri Kirletmeyen Pastel Boya, 18'li Kutu, Elleri Boyamaz, 30 Aydan Büyük Çocuklar İçin İdeal","84,91 TL",https://www.amazon.com.tr/BIC-Plastidecor-Kirletmeyen-Boyamaz-%C3%87ocuklar/dp/B004E9MGKK/ref=zg_bs_g_toys_d_sccl_26/261-4426946-1087664?psc=1
Oyuncak,#27,"LEGO Technic Mercedes–AMG F1 W14 E Performance Pull–Back 42165 – 7 Yaş ve Üzeri Çocuklar için Hediye Fikri, Orijinal Detaylar ve Çek–Bırak Fonksiyonu İçeren Yaratıcı Oyuncak Yapım Seti (240 Parça)","1.027,46 TL",https://www.amazon.com.tr/Mercedes-AMG-Performance-Pull-Back-%C3%87ocuklar-Koleksiyonluk/dp/B0CFVYZRN1/ref=zg_bs_g_toys_d_sccl_27/261-4426946-1087664?psc=1
Oyuncak,#28,thinkmaster Klasik Bütün markalar ile uyumlu Zemin Plakası (Beyaz) (Yeşil),"99,00 TL",https://www.amazon.com.tr/thinkmaster-Uyumlu-Klasik-Plaka-Plakas%C4%B1/dp/B0DWF913PF/ref=zg_bs_g_toys_d_sccl_28/261-4426946-1087664?psc=1
Oyuncak,#29,"LEGO Noel Baba’nın Dağıtım Kamyonu 40746 – 8 Yaş ve Üzeri Çocuklar için Yılbaşı Hediyeleri, Elf Minifigürü ve Aracın Üstüne Takılabilen Mini LEGO Yılbaşı Ağacı içeren Oyuncak Yapım Seti (224 Parça)","649,00 TL",https://www.amazon.com.tr/LEGO-40746-tbd-40746/dp/B0DK36JK7Z/ref=zg_bs_g_toys_d_sccl_29/261-4426946-1087664?psc=1
Oyuncak,#30,LEGO Speed Champions Daha Hızlı Daha Öfkeli Nissan Skyline GT-R (R34) 76917 (319 Parça),Fiyat Yok,https://www.amazon.com.tr/Champions-%C3%96fkeli-Nissan-Skyline-76917/dp/B0BBRXC9HN/ref=zg_bs_g_toys_d_sccl_30/261-4426946-1087664?psc=1
Oyuncak,#31,LEGO Fındıkkıran 40640 – 8 Yaş ve Üzeri Çocuklar için Yılbaşı Temalı Oyuncak Figür Yapım Seti (208 Parça),"445,18 TL",https://www.amazon.com.tr/LEGO-40640-Seasonal-Nutcracker/dp/B0CH1CBFZ4/ref=zg_bs_g_toys_d_sccl_31/261-4426946-1087664?psc=1
Oyuncak,#32,"colortouch Planner Sticker Set - 1500+ Adet Çıkartma - Takvim, Ajanda, Günlük, Planlayıcı, Not Defteri, Journal için Düzenleyici Etiketler - Scrapbook Sticker - Stickeralbum - 3 Aylık Sticker Book","159,99 TL",https://www.amazon.com.tr/colortouch-Planner-Sticker-Set-Stickeralbum/dp/B0BVNVXWZ5/ref=zg_bs_g_toys_d_sccl_32/261-4426946-1087664?psc=1
Oyuncak,#33,"LEGO Speed Champions Mercedes–AMG G 63 ve Mercedes–AMG SL 63 76924 – 10 Yaş ve Üzeri Kız ve Erkek Çocukları için Doğum Günü Hediyesi Fikri, 2 Model İçeren Yaratıcı Oyuncak Yapım Seti (808 Parça)","1.948,02 TL",https://www.amazon.com.tr/LEGO-Mercedes-AMG-76924-Tutkunlar%C4%B1-Edilebilen/dp/B0CWH3J5D6/ref=zg_bs_g_toys_d_sccl_33/261-4426946-1087664?psc=1
Oyuncak,#34,"BIC Kids Tropicolors Kuru Boya Kalemi 24 Renk, Kıymık Oluşturmaz, Ağaç Kesilmeden Üretilmiştir, Çiğnemeye Dayanıklı","128,00 TL",https://www.amazon.com.tr/BIC-Kids-Tropicolors-Kuru-Kalemi/dp/B006QW7Z7M/ref=zg_bs_g_toys_d_sccl_34/261-4426946-1087664?psc=1
Oyuncak,#35,"LEGO Botanicals Şans Bambusu 10344 – Yetişkin Kadın ve Erkekler için Bambu Sapları, Çakıl Taşları ve Ahşap Efektli Saksı İçeren Dekoratif Bitki Seti, Ev ve Ofis Dekorasyonu Hediye Fikri (325 Parça)","944,94 TL",https://www.amazon.com.tr/LEGO-System-Classic-bacaklar-pantolon/dp/B01N9D9U4O/ref=zg_bs_g_toys_d_sccl_35/261-4426946-1087664?psc=1
Oyuncak,#36,"Mattel Games UNO No Mercy Kartlar Çocuklara, yetişkinlere, aileyle bir araya gelinen akşamlara, partilere ve seyahatlere yönelik UNO No Mercy Kart Oyunu HWV18","269,99 TL",https://www.amazon.com.tr/Mattel-HWV18-UNO-Mercy-Kartlar/dp/B0CBNR2ML6/ref=zg_bs_g_toys_d_sccl_36/261-4426946-1087664?psc=1
Oyuncak,#37,"LEGO NINJAGO Kai’nin Ninja Yarış Arabası EVO 71780 – 6 Yaş ve Üzeri Kız ve Erkek Çocuklar için Yılbaşı Hediyesi Fikri, Oyuncak Araba ve Kai Minifigürü İçeren Yaratıcı Oyuncak Yapım Seti (94 Parça)","380,73 TL",https://www.amazon.com.tr/NINJAGO%C2%AE-Arabas%C4%B1-%C3%87ocuklar-Minifig%C3%BCr%C3%BC-Yarat%C4%B1c%C4%B1/dp/B0BBRZYFB9/ref=zg_bs_g_toys_d_sccl_37/261-4426946-1087664?psc=1
Oyuncak,#38,"LEGO Yılbaşı Masa Süsü 40743 – 12 Yaş Üzeri Çocuklar için Kırmızı Mum, Orman Meyveleri, Altın Yıldızlar ve Yeşil Yapraklar İçeren Yılbaşı Temalı Yaratıcı Koleksiyonluk Oyuncak Yapım Seti (433 Parça)","1.349,00 TL",https://www.amazon.com.tr/LEGO-40743-tbd-40743/dp/B0DK374QGF/ref=zg_bs_g_toys_d_sccl_38/261-4426946-1087664?psc=1
Sağlık ve Bakım,#1,"Nutraxin Magnesium Complex Gıda Takviyesi, 60 Tablet","295,00 TL",https://www.amazon.com.tr/Nutraxin-Manesium-60-Tablet/dp/B0BX424G1Z/ref=zg_bs_g_hpc_d_sccl_1/261-4426946-1087664?psc=1
Sağlık ve Bakım,#2,"OMO Express Fresh Kötü Koku Karşıtı Beyaz ve Renkliler Sıvı Çamaşır Deterjanı, 1480 ml","199,00 TL",https://www.amazon.com.tr/OMO-Express-Kar%C5%9F%C4%B1t%C4%B1-Renkliler-Deterjan%C4%B1/dp/B0DCZS98ZT/ref=zg_bs_g_hpc_d_sccl_2/261-4426946-1087664?psc=1
Sağlık ve Bakım,#3,SOLO Bambu Katkılı Tuvalet Kağıdı 40’lı,"233,91 TL",https://www.amazon.com.tr/Solo-Tuvalet-Ka%C4%9F%C4%B1d%C4%B1-Bambu-Katk%C4%B1l%C4%B1/dp/B0C4Z1DDSL/ref=zg_bs_g_hpc_d_sccl_3/261-4426946-1087664?psc=1
Sağlık ve Bakım,#4,Oral-B Şarjlı/Elektrikli Diş Fırçası Vitality Pro Siyah Koruma ve Temizlik,"1.119,58 TL",https://www.amazon.com.tr/Oral-B-Elektrikli-F%C4%B1r%C3%A7as%C4%B1-Vitality-Temizlik/dp/B0B51CWCN7/ref=zg_bs_g_hpc_d_sccl_4/261-4426946-1087664?psc=1
Sağlık ve Bakım,#5,SOLO Kağıt Havlu 12'li,"170,09 TL",https://www.amazon.com.tr/Solo-Ka%C4%9F%C4%B1t-Havlu-12-Rulo/dp/B07N29DM3K/ref=zg_bs_g_hpc_d_sccl_5/261-4426946-1087664?psc=1
Sağlık ve Bakım,#6,Nutraxin Vitals Omega-3 2000 mg EPA + DHA Balık Yağı içeren Takviye Edici Gıda (1 x 60 kapsül),"378,66 TL",https://www.amazon.com.tr/Nutraxin-Omega-2000-Mg-Softgel/dp/B07HRY67XJ/ref=zg_bs_g_hpc_d_sccl_6/261-4426946-1087664?psc=1
Sağlık ve Bakım,#7,"Opalescence Beyazlatıcı Cool Mint Diş Macunu, 133 gr, 100 ml","445,44 TL",https://www.amazon.com.tr/Opalescence-Beyazlat%C4%B1c%C4%B1-Macunu-B%C3%BCy%C3%BCk-133g/dp/B07BB54JZ4/ref=zg_bs_g_hpc_d_sccl_7/261-4426946-1087664?psc=1
Sağlık ve Bakım,#8,Nutraxin D3K2 Vitamin 30 Ml,"194,00 TL",https://www.amazon.com.tr/Nutraxin-D3K2-Vitamin-30-Ml/dp/B0BX3ZXLS8/ref=zg_bs_g_hpc_d_sccl_8/261-4426946-1087664?psc=1
Sağlık ve Bakım,#9,Yumoş Extra Çamaşır Yumuşatıcısı Lilyum 1440 ml,"160,11 TL",https://www.amazon.com.tr/Yumo%C5%9F-Lilyum-Konsantre-%C3%87ama%C5%9F%C4%B1r-Yumu%C5%9Fat%C4%B1c%C4%B1/dp/B07X5W4HWM/ref=zg_bs_g_hpc_d_sccl_9/261-4426946-1087664?psc=1
Sağlık ve Bakım,#10,Ocean Plus 1200 mg 50 Softjel,"360,00 TL",https://www.amazon.com.tr/Oceans-Plus-1200-Bal%C4%B1k-Kaps%C3%BCl/dp/B07HS1HSCD/ref=zg_bs_g_hpc_d_sccl_10/261-4426946-1087664?psc=1
Sağlık ve Bakım,#11,Perwoll Geliştirilmiş Renkli Sıvı Çamaşır Detarjanı 2970 ml,"197,10 TL",https://www.amazon.com.tr/Perwoll-Hassas-%C3%87ama%C5%9F%C4%B1r-Deterjan%C4%B1-Renkli/dp/B00KHB2ZIW/ref=zg_bs_g_hpc_d_sccl_11/261-4426946-1087664?psc=1
Sağlık ve Bakım,#12,OMO Express Fresh Capcanlı Renkler Renkli ve Siyahlar Sıvı Çamaşır Deterjanı 1480 ml,"199,00 TL",https://www.amazon.com.tr/OMO-Express-Capcanl%C4%B1-Siyahlar-Deterjan%C4%B1/dp/B0DCZRHFRD/ref=zg_bs_g_hpc_d_sccl_12/261-4426946-1087664?psc=1
Sağlık ve Bakım,#13,Perwoll Yenileme Siyahlar için Sıvı Deterjan 54 Yıkama 2.97 Lt,Fiyat Yok,https://www.amazon.com.tr/Perwoll-Hassas-%C3%87ama%C5%9F%C4%B1r-Deterjan%C4%B1-Siyah/dp/B00LN89EBO/ref=zg_bs_g_hpc_d_sccl_13/261-4426946-1087664?psc=1
Sağlık ve Bakım,#14,"Youplus Vitamin C, Çinko & Propolis 20 Efervesan Tablet","179,28 TL",https://www.amazon.com.tr/Youplus-Vitamin-Propolis-Efervesan-Tablet/dp/B085D7SLQM/ref=zg_bs_g_hpc_d_sccl_14/261-4426946-1087664?psc=1
Sağlık ve Bakım,#15,Selpak Extra Kağıt Havlu Yağ Emici 8'li,"107,99 TL",https://www.amazon.com.tr/Selpak-Deluxe-Bambu-Katk%C4%B1l%C4%B1-Ka%C4%9F%C4%B1t/dp/B09C2B1981/ref=zg_bs_g_hpc_d_sccl_15/261-4426946-1087664?psc=1
Sağlık ve Bakım,#16,OMO Express Fresh Ultra Beyaz Sıvı Çamaşır Deterjanı 1480 ml,"199,00 TL",https://www.amazon.com.tr/OMO-Express-Fresh-%C3%87ama%C5%9F%C4%B1r-Deterjan%C4%B1/dp/B0F8JHLW1P/ref=zg_bs_g_hpc_d_sccl_16/261-4426946-1087664?psc=1
Sağlık ve Bakım,#17,Sleepy Easy Clean Yüzey Temizlik Havlusu&Mendili 100 Yaprak,"89,09 TL",https://www.amazon.com.tr/Sleepy-Clean-Temizlik-Havlusu-Yaprak/dp/B0B97Y7T13/ref=zg_bs_g_hpc_d_sccl_17/261-4426946-1087664?psc=1
Sağlık ve Bakım,#18,Oral-B Diş İpi Essential 50 m,"119,90 TL",https://www.amazon.com.tr/Oral-B-Essential-Floss-Mint-Mumlu-Naneli/dp/B07HS1CMYL/ref=zg_bs_g_hpc_d_sccl_18/261-4426946-1087664?psc=1
Sağlık ve Bakım,#19,Orzax Ocean ExtraMag Üçlü Magnezyum Kombinasyonu 90 Tablet,"545,00 TL",https://www.amazon.com.tr/Orzax-ExtraMag-Magnezyum-Kombinasyonu-Tablet/dp/B0BYNNPG1H/ref=zg_bs_g_hpc_d_sccl_19/261-4426946-1087664?psc=1
Sağlık ve Bakım,#20,Nutraxin B12 Vitamin 1000 mcg 60 Tablet Takviye Edici Gıda,"186,85 TL",https://www.amazon.com.tr/Nutraxin-B12-Vitamin-1000mcg-Tablet/dp/B085S7GBYK/ref=zg_bs_g_hpc_d_sccl_20/261-4426946-1087664?psc=1
Sağlık ve Bakım,#21,Nutraxin Men's Multi Vitamin Complex 60 Tablet Takviye Edici Gıda,"252,53 TL",https://www.amazon.com.tr/Nutraxin-Multivitamin-Mineral-Kompleks-Tablet/dp/B086DV7HJN/ref=zg_bs_g_hpc_d_sccl_21/261-4426946-1087664?psc=1
Sağlık ve Bakım,#22,"Omo Active Beyazlar ve Renkliler için Toz Çamaşır Deterjanı, 9 kg, 60 Yıkama, 1 Paket (1 x 9000 g)","383,94 TL",https://www.amazon.com.tr/Omo-Beyazlar-Renkliler-%C3%87ama%C5%9F%C4%B1r-Deterjan%C4%B1/dp/B084XSJVW8/ref=zg_bs_g_hpc_d_sccl_22/261-4426946-1087664?psc=1
Sağlık ve Bakım,#23,Oral-B Cross Action X-Filament Şarjlı Diş Fırçası Yedek Başlığı 4 Adet,"638,00 TL",https://www.amazon.com.tr/Oral-B-Action-X-Filament-F%C4%B1r%C3%A7as%C4%B1-Ba%C5%9Fl%C4%B1%C4%9F%C4%B1/dp/B0D47P5LX8/ref=zg_bs_g_hpc_d_sccl_23/261-4426946-1087664?psc=1
Sağlık ve Bakım,#24,Ocean-D3k2 Damla 20 ml,"260,00 TL",https://www.amazon.com.tr/Orzax-Ocean-D3K2-Damla-20ml/dp/B07HS1647B/ref=zg_bs_g_hpc_d_sccl_24/261-4426946-1087664?psc=1
Sağlık ve Bakım,#25,"Nutraxin Iron Max 30 Tablet – Demir, C Vitamini, Folik Asit ve B12 Vitamini İçeren Takviye","204,00 TL",https://www.amazon.com.tr/Nutraxin-Iron-Max-17-Tablet/dp/B0BZSLTD98/ref=zg_bs_g_hpc_d_sccl_25/261-4426946-1087664?psc=1
Sağlık ve Bakım,#26,Nutraxin Vitamin Max C-D-Zinc 60 Tablet,"190,10 TL",https://www.amazon.com.tr/Nutraxin-Vitamin-Tablet-Takviye-Edici/dp/B091FQQ4Z6/ref=zg_bs_g_hpc_d_sccl_26/261-4426946-1087664?psc=1
Sağlık ve Bakım,#27,Finish Quantum Özel Seri 100 Kapsül Bulaşık Makinesi Deterjanı Tableti (1 x 100 Kapsül),"428,90 TL",https://www.amazon.com.tr/Finish-Quantum-Bula%C5%9F%C4%B1k-Makinesi-Deterjan%C4%B1/dp/B0BRQPL7SV/ref=zg_bs_g_hpc_d_sccl_27/261-4426946-1087664?psc=1
Sağlık ve Bakım,#28,"Selpak Tuvalet Kağıdı, 3 Katlı, 32'li, 1 Paket (1 x 32 Adet)","269,91 TL",https://www.amazon.com.tr/Selpak-SELPAK-TUVALET-KA%C4%9EIDI-32L%C4%B0/dp/B07KCZF96P/ref=zg_bs_g_hpc_d_sccl_28/261-4426946-1087664?psc=1
Sağlık ve Bakım,#29,Sleepy Easy Clean Çamaşır Suyu Katkılı Yüzey Temizlik Havlusu&Mendili 100 Yaprak,"79,99 TL",https://www.amazon.com.tr/Sleepy-%C3%87ama%C5%9F%C4%B1r-Katk%C4%B1l%C4%B1-Temizlik-Havlusu/dp/B0CFFKDKXV/ref=zg_bs_g_hpc_d_sccl_29/261-4426946-1087664?psc=1
Sağlık ve Bakım,#30,"Bref Power Active Çam ve Lavanta Kokulu 4'lü Klozet Bloğu 4 x 50 g, Çam & Lavanta 4","164,90 TL",https://www.amazon.com.tr/Bref-Power-Aktif-Lavanta-Pack/dp/B08R97RTLC/ref=zg_bs_g_hpc_d_sccl_30/261-4426946-1087664?psc=1
Sağlık ve Bakım,#31,Yumoş Extra Çamaşır Yumuşatıcı Sakura 1440 ml,"129,00 TL",https://www.amazon.com.tr/Yumo%C5%9F-Extra-%C3%87ama%C5%9F%C4%B1r-Yumu%C5%9Fat%C4%B1c%C4%B1-Sakura/dp/B09G1HS8KT/ref=zg_bs_g_hpc_d_sccl_31/261-4426946-1087664?psc=1
Sağlık ve Bakım,#32,LISTERINE Coolmint Ağız Bakım Suyu 500 ml 250 ml,"199,00 TL",https://www.amazon.com.tr/LISTERINE-Coolmint-A%C4%9F%C4%B1z-Bak%C4%B1m-Suyu/dp/B088HB2TK5/ref=zg_bs_g_hpc_d_sccl_32/261-4426946-1087664?psc=1
Sağlık ve Bakım,#33,Okey Klasik Ekonomik Prezervatif 20 Adet,"149,95 TL",https://www.amazon.com.tr/Okey-Prezervatif-Klasik-Eko-20li/dp/B07J6HS8NN/ref=zg_bs_g_hpc_d_sccl_33/261-4426946-1087664?psc=1
Sağlık ve Bakım,#34,"Nutraxin D3K2 120 Tablet - 1000 Iu D3 Vitamini, 25 Mcg K2 Vitamini","231,22 TL",https://www.amazon.com.tr/Nutraxin-D3K2-120-Tablet-Vitamini/dp/B0DTMLQL6C/ref=zg_bs_g_hpc_d_sccl_34/261-4426946-1087664?psc=1
Sağlık ve Bakım,#35,Ocean C Vitamini 1000 mg + Bioflavonoidler Antioksidan içeren Takviye Edici Gıda (1 x 30 tablet),"181,51 TL",https://www.amazon.com.tr/Ocean-Vitamin-1000-Mg-Bioflavonoidler-Hesperidin/dp/B07HS1SN5V/ref=zg_bs_g_hpc_d_sccl_35/261-4426946-1087664?psc=1
Sağlık ve Bakım,#36,Fairy Süper Ekonomik Paket Sıvı Bulaşık Deterjanı 2600 ml Limon Kokulu,"226,90 TL",https://www.amazon.com.tr/Fairy-S%C3%BCper-Ekonomik-Bula%C5%9F%C4%B1k-Deterjan%C4%B1/dp/B09J55RKT1/ref=zg_bs_g_hpc_d_sccl_36/261-4426946-1087664?psc=1
Sağlık ve Bakım,#37,"Nutraxin B Vitamin Complex – 10 Farklı B Vitamini İçerikli Takviye – 60 Tablet – Enerji, Sinir Sistemi ve Cilt Sağlığı İçin Destek","215,34 TL",https://www.amazon.com.tr/Nutraxin-Vitamin-Complex-60-Kap/dp/B07HS3BSSK/ref=zg_bs_g_hpc_d_sccl_37/261-4426946-1087664?psc=1
Sağlık ve Bakım,#38,Familia Plus Natural 40'lı Paket Tuvalet Kağıdı,"269,00 TL",https://www.amazon.com.tr/Familia-Natural-Paket-Tuvalet-Ka%C4%9F%C4%B1d%C4%B1/dp/B0CDM3CXTG/ref=zg_bs_g_hpc_d_sccl_38/261-4426946-1087664?psc=1
Sağlık ve Bakım,#39,Asperox Sparx Diamond Bulaşık Makinesi Kapsülü 60 Adet,"219,51 TL",https://www.amazon.com.tr/Asperox-Diamond-Bula%C5%9F%C4%B1k-Makinesi-Kaps%C3%BCl%C3%BC/dp/B08MVSZ79P/ref=zg_bs_g_hpc_d_sccl_39/261-4426946-1087664?psc=1
Sağlık ve Bakım,#40,Ocean Methyl B12 1000 mcg Metilkobalamin içeren Dilaltı Sprey (1 x 10 mL),"298,46 TL",https://www.amazon.com.tr/Ocean-Methyl-B12-10-ml/dp/B07HS1NV47/ref=zg_bs_g_hpc_d_sccl_40/261-4426946-1087664?psc=1
Sağlık ve Bakım,#41,"Pril Limon Kokulu Sıvı Bulaşık Deterjanı 1 x 4 KG, Limon 4kg","209,69 TL",https://www.amazon.com.tr/PR%C4%B0L-Pril-Bula%C5%9F%C4%B1k-Deterjan%C4%B1-4kg/dp/B07HJ3WKFH/ref=zg_bs_g_hpc_d_sccl_41/261-4426946-1087664?psc=1
Sağlık ve Bakım,#42,Orkid Günlük Ped Normal Dev Ekonomi Paketi 80'li,Fiyat Yok,https://www.amazon.com.tr/Orkid-G%C3%BCnl%C3%BCk-Normal-Ekonomi-Paketi/dp/B07FYKYVVH/ref=zg_bs_g_hpc_d_sccl_42/261-4426946-1087664?psc=1
