Kategori,Sıra,Ürün Adı,Fiyat,Link
Otomotiv,#31,"Xiaomi Taşınabilir Elektrikli Hava Kompresörü 2 - Taşınabilir Hava Kompresörü (0,2 10,3 bar/3-150 psi, 6 mod, 2000 mAh pil, 14,4 Wh, USB-C şarj, LED ekran), siyah (ES versiyonu)","1.929,00 TL",https://www.amazon.com.tr/Xiaomi-Ta%C5%9F%C4%B1nabilir-Elektrikli-Hava-Kompres%C3%B6r%C3%BC/dp/B0CBBP8BQX/ref=zg_bs_g_automotive_d_sccl_31/262-9629842-5424116?psc=1
Otomotiv,#32,"Einhell Akü Şarj Cihazı CE-BC 10 M (Mikro işlemci kontrollü akıllı şarj cihazı, çeşitli akü tipleri için, otomobil/motosiklet dahil, maks. 10 Amper şarj akımı) - 1002245","2.034,10 TL",https://www.amazon.com.tr/Einhell-i%C5%9Flemci-kontroll%C3%BC-otomobil-motosiklet/dp/B07WRLJNN2/ref=zg_bs_g_automotive_d_sccl_32/262-9629842-5424116?psc=1
Otomotiv,#33,Araç İçi Bagaj Eşya Düzenleyici Oto Organizer Çanta,"229,90 TL",https://www.amazon.com.tr/D%C3%BCzenleyici-Organizer-Aksesuarlar%C4%B1-D%C3%BCzenleme-Toparlay%C4%B1c%C4%B1/dp/B0BMXYQKRX/ref=zg_bs_g_automotive_d_sccl_33/262-9629842-5424116?psc=1
Otomotiv,#34,Viofo Fuse Tap Mini (ATS) Tip Sigorta Kutusu Bağlantı Aparatı,"256,94 TL",https://www.amazon.com.tr/Viofo-VFT3-Fuse-Tap-K%C4%B1rm%C4%B1z%C4%B1/dp/B08292RTG2/ref=zg_bs_g_automotive_d_sccl_34/262-9629842-5424116?psc=1
Otomotiv,#35,BODYGARD Motosiklet Brandası Su Geçirmez Motor Branda Beden - SIYAH (MEDIUM),"569,05 TL",https://www.amazon.com.tr/BODYGUARD-Motosiklet-Brandas%C4%B1-Ge%C3%A7irmez-Branda/dp/B0D2G2B551/ref=zg_bs_g_automotive_d_sccl_35/262-9629842-5424116?psc=1
Otomotiv,#36,"Nasiol Araç Kurulama Havlusu 60X90 cm, 600 gsm",Fiyat Yok,https://www.amazon.com.tr/Nasiol-Ara%C3%A7-Kurulama-Havlusu-60X90/dp/B0CB4CFJ6W/ref=zg_bs_g_automotive_d_sccl_36/262-9629842-5424116?psc=1
Otomotiv,#37,Romofy Manyetik Araç İçi Telefon Tutucu MagSafe İle Uyumlu [Güçlü Mıknatıslar] - iPhone 11-16 Pro Max/Plus Serileri İle Uyumlu - Cep Telefonu Tutacağı Araba Telefon Tutucu,"349,00 TL",https://www.amazon.com.tr/Romofy-Manyetik-Telefon-MagSafe-M%C4%B1knat%C4%B1slar/dp/B0DGGMS36X/ref=zg_bs_g_automotive_d_sccl_37/262-9629842-5424116?psc=1
Otomotiv,#38,Romofy Numaratör Araç İçi Park Telefon Numarası - Çevirmeli Dayanıklı Parkmatik Torpido Üstü Araba Telefon Numaralık - Oto Aksesuar Numaramatik,"139,00 TL",https://www.amazon.com.tr/Romofy-Telefon-Numaras%C4%B1-Fosforlu-Numarat%C3%B6r/dp/B0D8JHW1SH/ref=zg_bs_g_automotive_d_sccl_38/262-9629842-5424116?psc=1
Otomotiv,#39,Spark Mikrofiber Ultra Emici Oto Kurulama Bezi,"335,00 TL",https://www.amazon.com.tr/Spark-Mikrofiber-Ultra-Kurulama-Temizlik/dp/B07ZFZ424F/ref=zg_bs_g_automotive_d_sccl_39/262-9629842-5424116?psc=1
Otomotiv,#40,"Busstier Geniş Torpido Fırçası, Klima ve Torpido Temizlik Aleti, Araç İçi Derinlemesine Temizlik","109,00 TL",https://www.amazon.com.tr/Busstier-Torpido-F%C4%B1r%C3%A7as%C4%B1-Temizlik-Derinlemesine/dp/B0D6XGZFS8/ref=zg_bs_g_automotive_d_sccl_40/262-9629842-5424116?psc=1
Otomotiv,#41,Sahler Tesla Model Y Juniper 2025+ ile Uyumlu 4.5D PRO Premium Oto Havuzlu Paspas,"1.888,99 TL",https://www.amazon.com.tr/Sahler-Juniper-Uyumlu-Premium-Havuzlu/dp/B0FBS4Z36X/ref=zg_bs_g_automotive_d_sccl_41/262-9629842-5424116?psc=1
Otomotiv,#42,Spark 7050 Mikrofiber Şönil Oto Temizlik ve Kurulama Eldiveni 16x24 cm. GRİ,"170,00 TL",https://www.amazon.com.tr/Spark-7050-Mikrofiber-Temizlik-Kurulama/dp/B0B38YTFNN/ref=zg_bs_g_automotive_d_sccl_42/262-9629842-5424116?psc=1
Otomotiv,#43,404 Magni Yangın Söndürücü Sprey 500 ml,"499,00 TL",https://www.amazon.com.tr/404-Magni-Yang%C4%B1n-S%C3%B6nd%C3%BCr%C3%BCc%C3%BC-Sprey/dp/B0FFMWT5JX/ref=zg_bs_g_automotive_d_sccl_43/262-9629842-5424116?psc=1
Otomotiv,#44,Würth Oto Konsantre Cam Suyu Temizleme Sabunu 32ml 10 ADET,"367,00 TL",https://www.amazon.com.tr/W%C3%BCrth-Konsantre-Suyu-Temizleme-Sabunu/dp/B085B2MZ5T/ref=zg_bs_g_automotive_d_sccl_44/262-9629842-5424116?psc=1
Otomotiv,#45,Michelin MC92423 500ml Lastik Tamir Spreyi,"586,18 TL",https://www.amazon.com.tr/Michelin-MC92423-500ml-Lastik-Spreyi/dp/B01MR0QMKH/ref=zg_bs_g_automotive_d_sccl_45/262-9629842-5424116?psc=1
Otomotiv,#46,Romofy Oto Ruhsat Kabı Termo Deri - Araba Ruhsat Kılıfı - Araç Ruhsat Cüzdanı (Gri),"149,00 TL",https://www.amazon.com.tr/Romofy-Ruhsat-Kab%C4%B1-Termo-Deri/dp/B0DFMH568V/ref=zg_bs_g_automotive_d_sccl_46/262-9629842-5424116?psc=1
Oyuncak,#1,"LEGO Speed Champions Ferrari SF-24 F1 Yarış Arabası 77242 – 10 Yaş ve Üzeri Kız ve Erkek Çocukları için Koleksiyonluk Sürücü Minifigürü İçeren Yapım Seti, Motor Hayranları için Model Kiti (275 Parça)","999,90 TL",https://www.amazon.com.tr/LEGO-Champions-Ferrari-Arabas%C4%B1-77242/dp/B0DHSBBV6R/ref=zg_bs_g_toys_d_sccl_1/262-9629842-5424116?psc=1
Oyuncak,#2,"LEGO F1 Koleksiyonluk Yarış Arabaları 71049 – 6 Yaş ve Üzeri Çocuklar için Hediye Fikri, Ferrari ve McLaren Dahil 12 Formula 1 Takımının Mini Modellerini İçeren Oyuncak Araba Yapım Seti (29 Parça)","153,92 TL",https://www.amazon.com.tr/LEGO-Koleksiyonluk-Arabalar%C4%B1-Tak%C4%B1m%C4%B1n%C4%B1n-Modellerini/dp/B0DHSCJX3W/ref=zg_bs_g_toys_d_sccl_2/262-9629842-5424116?psc=1
Oyuncak,#3,LEGO Fındıkkıran 40640 – 8 Yaş ve Üzeri Çocuklar için Yılbaşı Temalı Oyuncak Figür Yapım Seti (208 Parça),"445,18 TL",https://www.amazon.com.tr/LEGO-40640-Seasonal-Nutcracker/dp/B0CH1CBFZ4/ref=zg_bs_g_toys_d_sccl_3/262-9629842-5424116?psc=1
Oyuncak,#4,"LEGO Botanicals Kiraz Çiçekleri Kutlama Hediyesi 40725 – 8 Yaş ve Üzeri Çocuklar için Doğum Günü Hediyesi Fikri, Pastel Tonlarda Çiçeklerle Kaplı 2 Dal İçeren Dekoratif Yaratıcı Oyuncak Yapım Seti","569,32 TL",https://www.amazon.com.tr/LEGO-Icons-Kiraz-%C3%87i%C3%A7ekleri-40725/dp/B0CFW1NHPC/ref=zg_bs_g_toys_d_sccl_4/262-9629842-5424116?psc=1
Oyuncak,#5,LEGO Speed Champions Oracle Red Bull Racing RB20 F1 Yarış Arabası 77243 – Yetişkinler için Koleksiyonluk Sürücü Minifigürü ve Orijinal Detaylar İçeren Koleksiyonluk Model Yapım Seti (251 Parça),"958,30 TL",https://www.amazon.com.tr/LEGO-Champions-Oracle-Arabas%C4%B1-77243/dp/B0DHSFBRPB/ref=zg_bs_g_toys_d_sccl_5/262-9629842-5424116?psc=1
Oyuncak,#6,"LEGO Technic Ağır İş Buldozeri 42163 – 7 Yaş ve Üzeri Kız ve Erkek Çocuklar için Doğum Günü Hediyesi Fikri, Oyuncak İnşaat Aracı İçeren Koleksiyonluk Yaratıcı Model Oyuncak Yapım Seti (195 Parça)","297,54 TL",https://www.amazon.com.tr/LEGO-Buldozeri-%C3%87ocuklar-Koleksiyonluk-Yarat%C4%B1c%C4%B1/dp/B0CFVN4XVL/ref=zg_bs_g_toys_d_sccl_6/262-9629842-5424116?psc=1
Oyuncak,#7,"Hasbro Gaming Monopoly Kutu Oyunu, 8+ yaş","742,00 TL",https://www.amazon.com.tr/Hasbro-C10091310-Monopoly/dp/B07CK7V1ZS/ref=zg_bs_g_toys_d_sccl_7/262-9629842-5424116?psc=1
Oyuncak,#8,"LEGO Yılbaşı Süsü Koleksiyonu 40744 – 6 Yaş ve Üzeri Çocuklar için Renkli Asılabilen Hediye, Noel Baba, Kardan Adam ve Ren Geyiği Yılbaşı Ağacı Süsleri İçeren Yaratıcı Oyuncak Yapım Seti (153 Parça)","622,26 TL",https://www.amazon.com.tr/LEGO-40744-tbd-40744/dp/B0DM64FJ8W/ref=zg_bs_g_toys_d_sccl_8/262-9629842-5424116?psc=1
Oyuncak,#9,"LEGO Botanicals Mini Orkide 10343 – Açık Renkli Terakota Saksı ve Ahşap Efektli Kaide İçeren Yetişkin Kadın ve Erkekler için Dekoratif Çiçek Yapım Seti, Ev ve Ofis Dekorasyonu Hediye Fikri (274 Parça)",Fiyat Yok,https://www.amazon.com.tr/LEGO-System-fig%C3%BCr-Classic-elbise/dp/B01N6CJ1QW/ref=zg_bs_g_toys_d_sccl_9/262-9629842-5424116?psc=1
Oyuncak,#10,Play-Doh Mini 4'lü Hamur,"48,97 TL",https://www.amazon.com.tr/Play-Doh-23241EU4-Mini-4l%C3%BC-Hamur/dp/B01LZWD3XK/ref=zg_bs_g_toys_d_sccl_10/262-9629842-5424116?psc=1
Oyuncak,#11,"LEGO Speed Champions 2023 McLaren Formula 1 Yarış Arabası Set 76919 – 9 Yaş ve Üzeri Çocuklar için Doğum Günü Hediyesi Fikri, Sürücü Minifigürü İçeren Yaratıcı Oyuncak Yapım Seti (245 Parça)","835,64 TL",https://www.amazon.com.tr/LEGO-Champions-%C3%87ocuklar-Koleksiyonluk-Sergilenebilir/dp/B0CFVWTFN6/ref=zg_bs_g_toys_d_sccl_11/262-9629842-5424116?psc=1
Oyuncak,#12,"BIC Kids Kid Couleur Ultra Yıkanabilir Keçeli Boya Kalemi 12 Renk, Kolayca Çoğu Kumaştan Çıkar, Su Bazlı Keçeli Kalem","113,14 TL",https://www.amazon.com.tr/Couleur-Ke%C3%A7eli-Boya-Kalemi-12Li/dp/B00008D0TQ/ref=zg_bs_g_toys_d_sccl_12/262-9629842-5424116?psc=1
Oyuncak,#13,"LEGO Botanicals Ayçiçeği 40524 – 8 Yaş ve Üzeri Çocuklar için Doğum Günü Hediyesi Fikri, Ayarlanabilir Yeşil Saplı ve Yapraklı 2 Ayçiçeği İçeren Dekoratif Yaratıcı Oyuncak Yapım Seti (191 Parça)","452,54 TL",https://www.amazon.com.tr/LEGO-Creator-Ay%C3%A7i%C3%A7e%C4%9Fi-Seti-40524/dp/B09PJ8ZZ1G/ref=zg_bs_g_toys_d_sccl_13/262-9629842-5424116?psc=1
Oyuncak,#14,"LEGO Technic Kazıcı Yükleyici 42197 – 7 Yaş ve Üzeri Kız ve Erkek Çocukları için Arka Kazıcı, Kepçe ve Dengeleyici İçeren Yapım Seti, Hediye Fikri (104 Parça)",Fiyat Yok,https://www.amazon.com.tr/LEGO-Technic-Kaz%C4%B1c%C4%B1-Y%C3%BCkleyici-42197/dp/B0DHSCSCFG/ref=zg_bs_g_toys_d_sccl_14/262-9629842-5424116?psc=1
Oyuncak,#15,"LEGO Icons Gül 40460 - Dekoratif, Koleksiyonluk ve Sergilenebilir Çiçek Modeli Yapım Seti (120 Parça)","510,30 TL",https://www.amazon.com.tr/LEGO-40460-Iconic-Rose/dp/B0BYZHTMVW/ref=zg_bs_g_toys_d_sccl_15/262-9629842-5424116?psc=1
Oyuncak,#16,LEGO Icons Krizantem 10368 - Yetişkinler için Dekoratif Kasımpatı Çiçeği Yapım Seti (278 Parça),"1.124,90 TL",https://www.amazon.com.tr/LEGO-Icons-Krizantem-10368-Yeti%C5%9Fkinler/dp/B00CALHYF6/ref=zg_bs_g_toys_d_sccl_16/262-9629842-5424116?psc=1
Oyuncak,#17,LEGO Speed Champions Mercedes-AMG F1 W15 Yarış Arabası 77244 – 10 Yaş ve Üzeri Kız ve Erkek Çocukları için Koleksiyonluk Sürücü Minifigürü İçeren Yapım Seti ve Sergileme Seti (267 Parça),"958,30 TL",https://www.amazon.com.tr/LEGO-Champions-Mercedes-AMG-Arabas%C4%B1-77244/dp/B0DHS9Y433/ref=zg_bs_g_toys_d_sccl_17/262-9629842-5424116?psc=1
Oyuncak,#18,"LEGO Creator Noel Baba ile Baca Eğlencesi 30692 – 6 Yaş ve Üzeri Erkek ve Kız Çocuklar için Hayal Gücünü Geliştiren Oyuncak Yapım Seti, Yeni Yıl Temalı Doğum Günü Hediye Fikri (60 Parça)","187,98 TL",https://www.amazon.com.tr/LEGO-Creator-Noel-E%C4%9Flencesi-30692/dp/B0DX6S9DDT/ref=zg_bs_g_toys_d_sccl_18/262-9629842-5424116?psc=1
Oyuncak,#19,"LEGO Botanicals Lotus Çiçekleri 40647 - Dekoratif, Koleksiyonluk ve Sergilenebilir Çiçek Modeli Yapım Seti (220 Parça)","510,30 TL",https://www.amazon.com.tr/Iconic-%C3%87i%C3%A7ekleri-40647-8-Dekoratif-Sergilenebilir/dp/B0C7HBX24Y/ref=zg_bs_g_toys_d_sccl_19/262-9629842-5424116?psc=1
Oyuncak,#20,"LEGO Botanicals Pembe Çiçek Buketi 10342 – Yetişkinler için Gül, Papatya, Orkide, Mürver Çiçeği, Düğün Çiçeği gibi 9 Farklı Çiçek İçeren Çiçek Yapım Seti (749 Parça)","2.099,00 TL",https://www.amazon.com.tr/LEGO-Botanicals-10342-Yeti%C5%9Fkinler-Peygamber/dp/B0DHSDBVKV/ref=zg_bs_g_toys_d_sccl_20/262-9629842-5424116?psc=1
Oyuncak,#21,"LEGO Noel Baba’nın Dağıtım Kamyonu 40746 – 8 Yaş ve Üzeri Çocuklar için Yılbaşı Hediyeleri, Elf Minifigürü ve Aracın Üstüne Takılabilen Mini LEGO Yılbaşı Ağacı içeren Oyuncak Yapım Seti (224 Parça)","649,00 TL",https://www.amazon.com.tr/LEGO-40746-tbd-40746/dp/B0DK36JK7Z/ref=zg_bs_g_toys_d_sccl_21/262-9629842-5424116?psc=1
Oyuncak,#22,"LEGO Botanicals Mutlu Bitkiler 10349-9 Yaş ve Üzeri Bitki Sever Çocuklar için Renkli Saksılı Yapım Seti, Oyun ve Dekorasyon için Eğlenceli ve Öğretici LEGO Seti, Doğum Günü Hediyesi (217 Parça)","739,30 TL",https://www.amazon.com.tr/LEGO-Botanicals-Bitkiler-Dekorasyon-E%C4%9Flenceli/dp/B0DWDRZDZC/ref=zg_bs_g_toys_d_sccl_22/262-9629842-5424116?psc=1
Oyuncak,#23,"LEGO Classic Büyük Boy Yaratıcı Parçalar Yapım Kutusu 10698 – 4 Yaş ve Üzeri Çocuklar için Hediye Fikri, 2 Yeşil Taban Plakası, 3 Çift Göz, 6 Lastik ve 6 Jant İçeren Oyuncak Yapım Seti (790 Parça)","1.871,93 TL",https://www.amazon.com.tr/Classic-B%C3%BCy%C3%BCk-Yarat%C4%B1c%C4%B1-Kutusu-10698/dp/B00PY3EYQO/ref=zg_bs_g_toys_d_sccl_23/262-9629842-5424116?psc=1
Oyuncak,#24,"LEGO Technic Mercedes–AMG F1 W14 E Performance Pull–Back 42165 – 7 Yaş ve Üzeri Çocuklar için Hediye Fikri, Orijinal Detaylar ve Çek–Bırak Fonksiyonu İçeren Yaratıcı Oyuncak Yapım Seti (240 Parça)","1.027,46 TL",https://www.amazon.com.tr/Mercedes-AMG-Performance-Pull-Back-%C3%87ocuklar-Koleksiyonluk/dp/B0CFVYZRN1/ref=zg_bs_g_toys_d_sccl_24/262-9629842-5424116?psc=1
Oyuncak,#25,"BIC Kids Tropicolors Kuru Boya Kalemi 24 Renk, Kıymık Oluşturmaz, Ağaç Kesilmeden Üretilmiştir, Çiğnemeye Dayanıklı","128,00 TL",https://www.amazon.com.tr/BIC-Kids-Tropicolors-Kuru-Kalemi/dp/B006QW7Z7M/ref=zg_bs_g_toys_d_sccl_25/262-9629842-5424116?psc=1
Oyuncak,#26,"Hasbro Gaming Star Wars 25'in üzerinde ses ve hareket kombinasyonuyla Çocuk elektronik baskısı, Mandalorian oyuncak","2.096,90 TL",https://www.amazon.com.tr/Star-Wars-Animatronic-Mandalorian-Oyunca%C4%9F%C4%B1/dp/B084PTVQLZ/ref=zg_bs_g_toys_d_sccl_26/262-9629842-5424116?psc=1
Oyuncak,#27,thinkmaster Klasik Bütün markalar ile uyumlu Zemin Plakası (Beyaz) (Yeşil),"99,00 TL",https://www.amazon.com.tr/thinkmaster-Uyumlu-Klasik-Plaka-Plakas%C4%B1/dp/B0DWF913PF/ref=zg_bs_g_toys_d_sccl_27/262-9629842-5424116?psc=1
Oyuncak,#28,"LEGO Creator 3’ü 1 Arada Uçak: Yarış Uçağı 31160-7 Yaş ve Üzeri Çocuklar için Jet veya Helikoptere Dönüşebilen Oyuncak Yapım Seti, Doğum Günü Hediyesi (178 Parça)","503,30 TL",https://www.amazon.com.tr/LEGO-Creator-Arada-U%C3%A7ak-Helikoptere/dp/B0DHSDHJFJ/ref=zg_bs_g_toys_d_sccl_28/262-9629842-5424116?psc=1
Oyuncak,#29,"BIC Plastidecor Elleri Kirletmeyen Pastel Boya, 18'li Kutu, Elleri Boyamaz, 30 Aydan Büyük Çocuklar İçin İdeal","80,66 TL",https://www.amazon.com.tr/BIC-Plastidecor-Kirletmeyen-Boyamaz-%C3%87ocuklar/dp/B004E9MGKK/ref=zg_bs_g_toys_d_sccl_29/262-9629842-5424116?psc=1
Oyuncak,#30,"colortouch Planner Sticker Set - 1500+ Adet Çıkartma - Takvim, Ajanda, Günlük, Planlayıcı, Not Defteri, Journal için Düzenleyici Etiketler - Scrapbook Sticker - Stickeralbum - 3 Aylık Sticker Book","159,99 TL",https://www.amazon.com.tr/colortouch-Planner-Sticker-Set-Stickeralbum/dp/B0BVNVXWZ5/ref=zg_bs_g_toys_d_sccl_30/262-9629842-5424116?psc=1
Oyuncak,#31,"LEGO Harry Potter Hogwarts Şatosu: Uçuş Dersleri 76447 – 9 Yaş ve Üzeri Çocuklar ve Yetişkinler için Hediye Fikri, 6 Karakter Minifigürü İçeren Koleksiyonluk Yaratıcı Oyuncak Yapım Seti (651 Parça)","1.940,91 TL",https://www.amazon.com.tr/LEGO-Harry-Potter-Hogwarts-%C5%9Eatosu/dp/B0DHSFB2SQ/ref=zg_bs_g_toys_d_sccl_31/262-9629842-5424116?psc=1
Oyuncak,#32,"Mattel Brick Shop Hot Wheels Speed Maserati, JFR90","909,30 TL",https://www.amazon.com.tr/Mattel-Brick-Shop-Maserati-JFR90/dp/B0DMW6CNZ5/ref=zg_bs_g_toys_d_sccl_32/262-9629842-5424116?psc=1
Oyuncak,#33,"LEGO Speed Champions Mercedes–AMG G 63 ve Mercedes–AMG SL 63 76924 – 10 Yaş ve Üzeri Kız ve Erkek Çocukları için Doğum Günü Hediyesi Fikri, 2 Model İçeren Yaratıcı Oyuncak Yapım Seti (808 Parça)","1.948,02 TL",https://www.amazon.com.tr/LEGO-Mercedes-AMG-76924-Tutkunlar%C4%B1-Edilebilen/dp/B0CWH3J5D6/ref=zg_bs_g_toys_d_sccl_33/262-9629842-5424116?psc=1
Oyuncak,#34,"LEGO City Yol Silindiri 60401 – 5 Yaş ve Üzeri Kız ve Erkek Çocuklar için Doğum Günü Hediyesi Fikri, Kürekli ve Baretli İnşaat İşçisi Minifigürü İçeren Yaratıcı Oyuncak Yapım Seti (78 Parça)","345,53 TL",https://www.amazon.com.tr/LEGO-Silindiri-60401-5-Yarat%C4%B1c%C4%B1-Oyuncak/dp/B0CFW2G29P/ref=zg_bs_g_toys_d_sccl_34/262-9629842-5424116?psc=1
Oyuncak,#35,"LEGO Creator 3’ü 1 Arada Kırmızı Ejderha 31145 – 6 Yaş ve Üzeri Çocuklar için Doğum Günü Hediyesi Fikri, Balık ve Zümrüdüanka Model Seçenekleri İçeren 3’ü 1 Arada Yaratıcı Oyuncak Yapım Seti","335,93 TL",https://www.amazon.com.tr/LEGO-%C3%87ocuklar-Z%C3%BCmr%C3%BCd%C3%BCanka-Se%C3%A7enekleri-Yarat%C4%B1c%C4%B1/dp/B0CFVYDZS6/ref=zg_bs_g_toys_d_sccl_35/262-9629842-5424116?psc=1
Oyuncak,#36,"LEGO Creator 3’ü 1 Arada Retro Fotoğraf Makinesi 31147-8 Yaş ve Üzeri Çocuklar için Televizyon ve Video Kamera Model Seçenekleri İçeren Yaratıcı Oyuncak Yapım Seti, Doğum Günü Hediyesi (261 Parça)",Fiyat Yok,https://www.amazon.com.tr/LEGO-Foto%C4%9Fraf-Makinesi-Televizyon-Se%C3%A7enekleri/dp/B0CFW1CWHW/ref=zg_bs_g_toys_d_sccl_36/262-9629842-5424116?psc=1
Oyuncak,#37,"Mattel Games UNO No Mercy Kartlar Çocuklara, yetişkinlere, aileyle bir araya gelinen akşamlara, partilere ve seyahatlere yönelik UNO No Mercy Kart Oyunu HWV18","269,99 TL",https://www.amazon.com.tr/Mattel-HWV18-UNO-Mercy-Kartlar/dp/B0CBNR2ML6/ref=zg_bs_g_toys_d_sccl_37/262-9629842-5424116?psc=1
Oyuncak,#38,LEGO Speed Champions McLaren F1 Team MCL38 Yarış Arabası 77251 – 10 Yaş ve Üzeri Kız ve Erkek Çocukları ile Yetişkin Motorseverler için Sürücü Minifigürü İçeren Yapım ve Sergileme Seti (269 Parça),"918,12 TL",https://www.amazon.com.tr/LEGO-Champions-McLaren-Arabas%C4%B1-77251/dp/B0DHS9Y192/ref=zg_bs_g_toys_d_sccl_38/262-9629842-5424116?psc=1
Sağlık ve Bakım,#1,"Nutraxin Magnesium Complex Gıda Takviyesi, 60 Tablet","293,50 TL",https://www.amazon.com.tr/Nutraxin-Manesium-60-Tablet/dp/B0BX424G1Z/ref=zg_bs_g_hpc_d_sccl_1/262-9629842-5424116?psc=1
Sağlık ve Bakım,#2,"OMO Express Fresh Kötü Koku Karşıtı Beyaz ve Renkliler Sıvı Çamaşır Deterjanı, 1480 ml","199,00 TL",https://www.amazon.com.tr/OMO-Express-Kar%C5%9F%C4%B1t%C4%B1-Renkliler-Deterjan%C4%B1/dp/B0DCZS98ZT/ref=zg_bs_g_hpc_d_sccl_2/262-9629842-5424116?psc=1
Sağlık ve Bakım,#3,Oral-B Şarjlı/Elektrikli Diş Fırçası Vitality Pro Siyah Koruma ve Temizlik,"1.119,58 TL",https://www.amazon.com.tr/Oral-B-Elektrikli-F%C4%B1r%C3%A7as%C4%B1-Vitality-Temizlik/dp/B0B51CWCN7/ref=zg_bs_g_hpc_d_sccl_3/262-9629842-5424116?psc=1
Sağlık ve Bakım,#4,SOLO Bambu Katkılı Tuvalet Kağıdı 40’lı,"233,91 TL",https://www.amazon.com.tr/Solo-Tuvalet-Ka%C4%9F%C4%B1d%C4%B1-Bambu-Katk%C4%B1l%C4%B1/dp/B0C4Z1DDSL/ref=zg_bs_g_hpc_d_sccl_4/262-9629842-5424116?psc=1
Sağlık ve Bakım,#5,"Opalescence Beyazlatıcı Cool Mint Diş Macunu, 133 gr, 100 ml","445,44 TL",https://www.amazon.com.tr/Opalescence-Beyazlat%C4%B1c%C4%B1-Macunu-B%C3%BCy%C3%BCk-133g/dp/B07BB54JZ4/ref=zg_bs_g_hpc_d_sccl_5/262-9629842-5424116?psc=1
Sağlık ve Bakım,#6,Nutraxin D3K2 Vitamin 30 Ml,"194,00 TL",https://www.amazon.com.tr/Nutraxin-D3K2-Vitamin-30-Ml/dp/B0BX3ZXLS8/ref=zg_bs_g_hpc_d_sccl_6/262-9629842-5424116?psc=1
Sağlık ve Bakım,#7,Nutraxin Vitals Omega-3 2000 mg EPA + DHA Balık Yağı içeren Takviye Edici Gıda (1 x 60 kapsül),"378,66 TL",https://www.amazon.com.tr/Nutraxin-Omega-2000-Mg-Softgel/dp/B07HRY67XJ/ref=zg_bs_g_hpc_d_sccl_7/262-9629842-5424116?psc=1
Sağlık ve Bakım,#8,SOLO Kağıt Havlu 12'li,"170,09 TL",https://www.amazon.com.tr/Solo-Ka%C4%9F%C4%B1t-Havlu-12-Rulo/dp/B07N29DM3K/ref=zg_bs_g_hpc_d_sccl_8/262-9629842-5424116?psc=1
Sağlık ve Bakım,#9,Ocean Plus 1200 mg 50 Softjel,"360,00 TL",https://www.amazon.com.tr/Oceans-Plus-1200-Bal%C4%B1k-Kaps%C3%BCl/dp/B07HS1HSCD/ref=zg_bs_g_hpc_d_sccl_9/262-9629842-5424116?psc=1
Sağlık ve Bakım,#10,Perwoll Geliştirilmiş Renkli Sıvı Çamaşır Detarjanı 2970 ml,"197,10 TL",https://www.amazon.com.tr/Perwoll-Hassas-%C3%87ama%C5%9F%C4%B1r-Deterjan%C4%B1-Renkli/dp/B00KHB2ZIW/ref=zg_bs_g_hpc_d_sccl_10/262-9629842-5424116?psc=1
Sağlık ve Bakım,#11,OMO Express Fresh Capcanlı Renkler Renkli ve Siyahlar Sıvı Çamaşır Deterjanı 1480 ml,"199,00 TL",https://www.amazon.com.tr/OMO-Express-Capcanl%C4%B1-Siyahlar-Deterjan%C4%B1/dp/B0DCZRHFRD/ref=zg_bs_g_hpc_d_sccl_11/262-9629842-5424116?psc=1
Sağlık ve Bakım,#12,Yumoş Extra Çamaşır Yumuşatıcısı Lilyum 1440 ml,"170,91 TL",https://www.amazon.com.tr/Yumo%C5%9F-Lilyum-Konsantre-%C3%87ama%C5%9F%C4%B1r-Yumu%C5%9Fat%C4%B1c%C4%B1/dp/B07X5W4HWM/ref=zg_bs_g_hpc_d_sccl_12/262-9629842-5424116?psc=1
Sağlık ve Bakım,#13,Oral-B Cross Action X-Filament Şarjlı Diş Fırçası Yedek Başlığı 4 Adet,"638,00 TL",https://www.amazon.com.tr/Oral-B-Action-X-Filament-F%C4%B1r%C3%A7as%C4%B1-Ba%C5%9Fl%C4%B1%C4%9F%C4%B1/dp/B0D47P5LX8/ref=zg_bs_g_hpc_d_sccl_13/262-9629842-5424116?psc=1
Sağlık ve Bakım,#14,"Youplus Vitamin C, Çinko & Propolis 20 Efervesan Tablet","179,28 TL",https://www.amazon.com.tr/Youplus-Vitamin-Propolis-Efervesan-Tablet/dp/B085D7SLQM/ref=zg_bs_g_hpc_d_sccl_14/262-9629842-5424116?psc=1
Sağlık ve Bakım,#15,Oral-B Diş İpi Essential 50 m,"119,90 TL",https://www.amazon.com.tr/Oral-B-Essential-Floss-Mint-Mumlu-Naneli/dp/B07HS1CMYL/ref=zg_bs_g_hpc_d_sccl_15/262-9629842-5424116?psc=1
Sağlık ve Bakım,#16,OMO Express Fresh Ultra Beyaz Sıvı Çamaşır Deterjanı 1480 ml,"199,00 TL",https://www.amazon.com.tr/OMO-Express-Fresh-%C3%87ama%C5%9F%C4%B1r-Deterjan%C4%B1/dp/B0F8JHLW1P/ref=zg_bs_g_hpc_d_sccl_16/262-9629842-5424116?psc=1
Sağlık ve Bakım,#17,Ocean-D3k2 Damla 20 ml,"260,43 TL",https://www.amazon.com.tr/Orzax-Ocean-D3K2-Damla-20ml/dp/B07HS1647B/ref=zg_bs_g_hpc_d_sccl_17/262-9629842-5424116?psc=1
Sağlık ve Bakım,#18,Orzax Ocean ExtraMag Üçlü Magnezyum Kombinasyonu 90 Tablet,"545,00 TL",https://www.amazon.com.tr/Orzax-ExtraMag-Magnezyum-Kombinasyonu-Tablet/dp/B0BYNNPG1H/ref=zg_bs_g_hpc_d_sccl_18/262-9629842-5424116?psc=1
Sağlık ve Bakım,#19,Perwoll Yenileme Siyahlar için Sıvı Deterjan 54 Yıkama 2.97 Lt,Fiyat Yok,https://www.amazon.com.tr/Perwoll-Hassas-%C3%87ama%C5%9F%C4%B1r-Deterjan%C4%B1-Siyah/dp/B00LN89EBO/ref=zg_bs_g_hpc_d_sccl_19/262-9629842-5424116?psc=1
Sağlık ve Bakım,#20,Nutraxin Men's Multi Vitamin Complex 60 Tablet Takviye Edici Gıda,"265,02 TL",https://www.amazon.com.tr/Nutraxin-Multivitamin-Mineral-Kompleks-Tablet/dp/B086DV7HJN/ref=zg_bs_g_hpc_d_sccl_20/262-9629842-5424116?psc=1
Sağlık ve Bakım,#21,Sleepy Easy Clean Yüzey Temizlik Havlusu&Mendili 100 Yaprak,"82,79 TL",https://www.amazon.com.tr/Sleepy-Clean-Temizlik-Havlusu-Yaprak/dp/B0B97Y7T13/ref=zg_bs_g_hpc_d_sccl_21/262-9629842-5424116?psc=1
Sağlık ve Bakım,#22,"Omo Active Beyazlar ve Renkliler için Toz Çamaşır Deterjanı, 9 kg, 60 Yıkama, 1 Paket (1 x 9000 g)","383,94 TL",https://www.amazon.com.tr/Omo-Beyazlar-Renkliler-%C3%87ama%C5%9F%C4%B1r-Deterjan%C4%B1/dp/B084XSJVW8/ref=zg_bs_g_hpc_d_sccl_22/262-9629842-5424116?psc=1
Sağlık ve Bakım,#23,Selpak Extra Kağıt Havlu Yağ Emici 8'li,"129,95 TL",https://www.amazon.com.tr/Selpak-Deluxe-Bambu-Katk%C4%B1l%C4%B1-Ka%C4%9F%C4%B1t/dp/B09C2B1981/ref=zg_bs_g_hpc_d_sccl_23/262-9629842-5424116?psc=1
Sağlık ve Bakım,#24,Nutraxin B12 Vitamin 1000 mcg 60 Tablet Takviye Edici Gıda,"186,85 TL",https://www.amazon.com.tr/Nutraxin-B12-Vitamin-1000mcg-Tablet/dp/B085S7GBYK/ref=zg_bs_g_hpc_d_sccl_24/262-9629842-5424116?psc=1
Sağlık ve Bakım,#25,"Nutraxin Iron Max 30 Tablet – Demir, C Vitamini, Folik Asit ve B12 Vitamini İçeren Takviye","204,00 TL",https://www.amazon.com.tr/Nutraxin-Iron-Max-17-Tablet/dp/B0BZSLTD98/ref=zg_bs_g_hpc_d_sccl_25/262-9629842-5424116?psc=1
Sağlık ve Bakım,#26,Finish Quantum Özel Seri 100 Kapsül Bulaşık Makinesi Deterjanı Tableti (1 x 100 Kapsül),"428,90 TL",https://www.amazon.com.tr/Finish-Quantum-Bula%C5%9F%C4%B1k-Makinesi-Deterjan%C4%B1/dp/B0BRQPL7SV/ref=zg_bs_g_hpc_d_sccl_26/262-9629842-5424116?psc=1
Sağlık ve Bakım,#27,Nutraxin Vitamin Max C-D-Zinc 60 Tablet,"201,60 TL",https://www.amazon.com.tr/Nutraxin-Vitamin-Tablet-Takviye-Edici/dp/B091FQQ4Z6/ref=zg_bs_g_hpc_d_sccl_27/262-9629842-5424116?psc=1
Sağlık ve Bakım,#28,"Selpak Tuvalet Kağıdı, 3 Katlı, 32'li, 1 Paket (1 x 32 Adet)","269,91 TL",https://www.amazon.com.tr/Selpak-SELPAK-TUVALET-KA%C4%9EIDI-32L%C4%B0/dp/B07KCZF96P/ref=zg_bs_g_hpc_d_sccl_28/262-9629842-5424116?psc=1
Sağlık ve Bakım,#29,Sleepy Easy Clean Çamaşır Suyu Katkılı Yüzey Temizlik Havlusu&Mendili 100 Yaprak,"79,99 TL",https://www.amazon.com.tr/Sleepy-%C3%87ama%C5%9F%C4%B1r-Katk%C4%B1l%C4%B1-Temizlik-Havlusu/dp/B0CFFKDKXV/ref=zg_bs_g_hpc_d_sccl_29/262-9629842-5424116?psc=1
Sağlık ve Bakım,#30,Yumoş Extra Çamaşır Yumuşatıcı Sakura 1440 ml,"168,21 TL",https://www.amazon.com.tr/Yumo%C5%9F-Extra-%C3%87ama%C5%9F%C4%B1r-Yumu%C5%9Fat%C4%B1c%C4%B1-Sakura/dp/B09G1HS8KT/ref=zg_bs_g_hpc_d_sccl_30/262-9629842-5424116?psc=1
Sağlık ve Bakım,#31,"Bref Power Active Çam ve Lavanta Kokulu 4'lü Klozet Bloğu 4 x 50 g, Çam & Lavanta 4","164,90 TL",https://www.amazon.com.tr/Bref-Power-Aktif-Lavanta-Pack/dp/B08R97RTLC/ref=zg_bs_g_hpc_d_sccl_31/262-9629842-5424116?psc=1
Sağlık ve Bakım,#32,Ocean C Vitamini 1000 mg + Bioflavonoidler Antioksidan içeren Takviye Edici Gıda (1 x 30 tablet),"192,68 TL",https://www.amazon.com.tr/Ocean-Vitamin-1000-Mg-Bioflavonoidler-Hesperidin/dp/B07HS1SN5V/ref=zg_bs_g_hpc_d_sccl_32/262-9629842-5424116?psc=1
Sağlık ve Bakım,#33,Familia Plus 3 Katlı Tuvalet Kağıdı 32'li 1 Paket (1 x 32 Adet),"223,11 TL",https://www.amazon.com.tr/Familia-32-Tuvalet-Ka%C4%9F%C4%B1d%C4%B1-ka%C4%9F%C4%B1t/dp/B073SBJMT3/ref=zg_bs_g_hpc_d_sccl_33/262-9629842-5424116?psc=1
Sağlık ve Bakım,#34,LISTERINE Coolmint Ağız Bakım Suyu 500 ml 250 ml,"199,00 TL",https://www.amazon.com.tr/LISTERINE-Coolmint-A%C4%9F%C4%B1z-Bak%C4%B1m-Suyu/dp/B088HB2TK5/ref=zg_bs_g_hpc_d_sccl_34/262-9629842-5424116?psc=1
Sağlık ve Bakım,#35,Okey Klasik Ekonomik Prezervatif 20 Adet,"149,95 TL",https://www.amazon.com.tr/Okey-Prezervatif-Klasik-Eko-20li/dp/B07J6HS8NN/ref=zg_bs_g_hpc_d_sccl_35/262-9629842-5424116?psc=1
Sağlık ve Bakım,#36,"Nutraxin D3K2 120 Tablet - 1000 Iu D3 Vitamini, 25 Mcg K2 Vitamini","224,64 TL",https://www.amazon.com.tr/Nutraxin-D3K2-120-Tablet-Vitamini/dp/B0DTMLQL6C/ref=zg_bs_g_hpc_d_sccl_36/262-9629842-5424116?psc=1
