Kategori,Sıra,Ürün Adı,Fiyat,Link
Bahçe,#1,"Einhell 18V 4,0 Ah PXC Starter Kit (Başlangıç Seti)","1.483,00 TL",https://www.amazon.com.tr/Einhell-18V-Starter-Ba%C5%9Flang%C4%B1%C3%A7-Seti/dp/B01M3SPEZF/ref=zg_bs_g_garden_d_sccl_1/262-9629842-5424116?psc=1
Bahçe,#2,"Einhell 18V 2,5 Ah PXC Starter Kit (Başlangıç Seti)","949,05 TL",https://www.amazon.com.tr/Einhell-18V-Starter-Ba%C5%9Flang%C4%B1%C3%A7-Seti/dp/B082TD4R4L/ref=zg_bs_g_garden_d_sccl_2/262-9629842-5424116?psc=1
Bahçe,#3,"Bluefox Dijital Oda Termometresi ve Nem Ölçer – LCD Ekranlı, Kompakt Higrometre, İç Mekan Sıcaklık ve Nem Takibi, Mıknatıslı & Ayaklı & Duvar Tipi Kullanım – Mutfak, Bebek Odası, Ofis, Sera için Uygun","199,00 TL",https://www.amazon.com.tr/Bluefox-Dijital-Oda-Termometresi-%C3%96l%C3%A7er/dp/B0BWSM4V67/ref=zg_bs_g_garden_d_sccl_3/262-9629842-5424116?psc=1
Bahçe,#4,Xiaomi Mijia Miaomiao Dijital Termometre LCD Ekranlı Isı Nem Ölçer,"494,00 TL",https://www.amazon.com.tr/Xiaomi-Miaomiao-Dijital-Termometre-Ekranl%C4%B1/dp/B083Y1D8WB/ref=zg_bs_g_garden_d_sccl_4/262-9629842-5424116?psc=1
Bahçe,#5,"ThermoPro TP53 Dokunmatik ve Işıklı Ekranlı Dijital Termometre, Yüksek Hassasiyetli İç Mekan Nem Ölçer, Hava Konfor Göstergeli Higrometre, Tüm Zamanlar/24 Saat Kayıt, Manyetik Standlı","589,50 TL",https://www.amazon.com.tr/ThermoPro-TP53-Ayd%C4%B1nlatmal%C4%B1-Profesyonel-Termo-Higrometre/dp/B079JXY1RC/ref=zg_bs_g_garden_d_sccl_5/262-9629842-5424116?psc=1
Bahçe,#6,"Einhell 18V 5,2 Ah Power-X-Change Plus, Akü","2.690,80 TL",https://www.amazon.com.tr/Einhell-18V-P-X-C-Plus-1260/dp/B01NCZCKHX/ref=zg_bs_g_garden_d_sccl_6/262-9629842-5424116?psc=1
Bahçe,#7,"Bosch 18 V 4, 0 Ah Akü","3.115,80 TL",https://www.amazon.com.tr/Bosch-Home-Garden-1600A011T8-Ak%C3%BC/dp/B07669C4Y4/ref=zg_bs_g_garden_d_sccl_7/262-9629842-5424116?psc=1
Bahçe,#8,Bosch Bahçe Malası,"266,53 TL",https://www.amazon.com.tr/Bosch-06008B5300-Bah%C3%A7e-Malas%C4%B1/dp/B0CZWRW1C9/ref=zg_bs_g_garden_d_sccl_8/262-9629842-5424116?psc=1
Bahçe,#9,"Bahçe mobilyası örtüsü, bahçe mobilyası brandası, su geçirmez, rüzgar geçirmez, UV dayanıklı, bahçe mobilyası örtüsü, Bahçe Mobilya Brandası Masa Sandalye Koruma Örtüsü (GRI, (250 * 210 * 80))","759,05 TL",https://www.amazon.com.tr/mobilyas%C4%B1-brandas%C4%B1-ge%C3%A7irmez-dayan%C4%B1kl%C4%B1-Brandas%C4%B1/dp/B0F9FX44Y4/ref=zg_bs_g_garden_d_sccl_9/262-9629842-5424116?psc=1
Bahçe,#10,Busstier Fiber Saplı Balta Ergonomik Kaymaz Saplı Çelik Başlı Profesyonel Odun Kesme Balta Kamp ve Bahçe Kullanımı İçin Dayanıklı Darbe Emici Saplı Balta,"279,00 TL",https://www.amazon.com.tr/Busstier-Ergonomik-Profesyonel-Kullan%C4%B1m%C4%B1-Dayan%C4%B1kl%C4%B1/dp/B0FNN9V9VH/ref=zg_bs_g_garden_d_sccl_10/262-9629842-5424116?psc=1
Bahçe,#11,Bosch UniversalAquatak 135 Yüksek Basınçlı Yıkama Makinesi,"6.240,28 TL",https://www.amazon.com.tr/Bosch-Y%C3%BCksek-Bas%C4%B1n%C3%A7l%C4%B1-Y%C4%B1kama-Universalaquatak/dp/B06XRDTQFP/ref=zg_bs_g_garden_d_sccl_11/262-9629842-5424116?psc=1
Bahçe,#12,MF Botanik Vera Iç Mekan Bitki Toprağı 10 Litre Iç Mekan Çiçek Toprağı Toprak Harcı,"149,00 TL",https://www.amazon.com.tr/Mekan-Bitki-Topra%C4%9F%C4%B1-Litre-Toprak/dp/B09FFHDZW3/ref=zg_bs_g_garden_d_sccl_12/262-9629842-5424116?psc=1
Bahçe,#13,Bayer K-Othrine AL 1 Litre Genel Haşere İlacı Hazır Sprey,"269,75 TL",https://www.amazon.com.tr/Bayer-K-Othrine-Genel-B%C3%B6cek-Ha%C5%9Fere/dp/B07HP7WF98/ref=zg_bs_g_garden_d_sccl_13/262-9629842-5424116?psc=1
Bahçe,#14,Outdoor Outlet Orkide Toprağı 3 Lt,"134,99 TL",https://www.amazon.com.tr/Outdoor-Outlet-Orkide-Topra%C4%9F%C4%B1-Lt/dp/B0DGY1SWNX/ref=zg_bs_g_garden_d_sccl_14/262-9629842-5424116?psc=1
Bahçe,#15,"Sonkir Toprak pH ölçer, MS02 3'ü 1 arada Toprak Nemi/Işık/pH Test Cihazı Bitki Bakımı için Bahçe Alet Kitleri, Bahçe, Çim, Çiftlik, İç ve Dış Mekan Kullanımı için Harika (Yeşil)","204,95 TL",https://www.amazon.com.tr/Sonkir-Toprak-Kitleri-%C3%87iftlik-Kullan%C4%B1m%C4%B1/dp/B07BR52P26/ref=zg_bs_g_garden_d_sccl_15/262-9629842-5424116?psc=1
Bahçe,#16,"Einhell Akülü Dal Budama Testeresi GE-PS 18/15 Li BL-Solo Power X-Change (18 V, kömürsüz motor, 12,5 cm kesim uzunluğu, aletsiz zincir ve kılavuz değişimi, akü dahil değildir) - 4600040","3.274,99 TL",https://www.amazon.com.tr/Einhell-GE-PS-18-15-Testeresi/dp/B0CCW217QV/ref=zg_bs_g_garden_d_sccl_16/262-9629842-5424116?psc=1
Bahçe,#17,"Einhell Akülü Budama Makası GE-LS 18 Li-Solo Power X-Change (18 V, Li-Ion, max. 28 mm dal çapı, bypass bıçaklar, güvenlik düğmesi, Softgrip, akü ve şarj cihazı dahil değildir) - 3408300","3.116,98 TL",https://www.amazon.com.tr/Einhell-X-Change-b%C4%B1%C3%A7aklar-g%C3%BCvenlik-Softgrip/dp/B08W56FL5Y/ref=zg_bs_g_garden_d_sccl_17/262-9629842-5424116?psc=1
Bahçe,#18,Yabidur Tibtrap Zehirsiz Fare Kapanı Yapışkanı,"123,41 TL",https://www.amazon.com.tr/Tibtrap-Zehirsiz-Fare-Kapan%C4%B1-Yap%C4%B1%C5%9Fkan%C4%B1/dp/B07YN481GW/ref=zg_bs_g_garden_d_sccl_18/262-9629842-5424116?psc=1
Bahçe,#19,"HTC-1 Dijital Termometre, İç Mekan Sıcaklık ve Nem Ölçer","219,99 TL",https://www.amazon.com.tr/HTC-1-Dijital-Termometre-Mekan-S%C4%B1cakl%C4%B1k/dp/B0DWKFSSBB/ref=zg_bs_g_garden_d_sccl_19/262-9629842-5424116?psc=1
Bahçe,#20,MF Botanik Vera Saksı Harcı İthal Torf Cocopeat Karışımı Genel Kullanım Saksı Toprağı 10 LİTRE,"149,00 TL",https://www.amazon.com.tr/MF-Botanik-Saks%C4%B1-Cocopeat-Kar%C4%B1%C5%9F%C4%B1m%C4%B1/dp/B08LRLSJLD/ref=zg_bs_g_garden_d_sccl_20/262-9629842-5424116?psc=1
Bahçe,#21,"Troy T 27220 Nacak, Siyah","481,37 TL",https://www.amazon.com.tr/Troy-T-27220-Nacak-Siyah/dp/B079HWQ8BW/ref=zg_bs_g_garden_d_sccl_21/262-9629842-5424116?psc=1
Bahçe,#22,Genta Genel Kullanım Torfu Toprağı 20 Lt,"329,00 TL",https://www.amazon.com.tr/Genta-Genel-Kullan%C4%B1m-Torfu-Topra%C4%9F%C4%B1/dp/B0CL9XSTX2/ref=zg_bs_g_garden_d_sccl_22/262-9629842-5424116?psc=1
Bahçe,#23,DETAN HAMAM BÖCEĞİ YEMİ MAX,"285,00 TL",https://www.amazon.com.tr/DETAN-HAMAM-B%C3%96CE%C4%9E%C4%B0-YEM%C4%B0-MAX/dp/B0D49SJZZB/ref=zg_bs_g_garden_d_sccl_23/262-9629842-5424116?psc=1
Bahçe,#24,"Einhell 2x18V 4,0 Ah PXC-Twinpack CB 2, Akü","3.249,61 TL",https://www.amazon.com.tr/Einhell-PXC-Twinpack-Volks-Ak%C3%BC-cihazlar%C4%B1-uyarlanm%C4%B1%C5%9F/dp/B07NJ727HW/ref=zg_bs_g_garden_d_sccl_24/262-9629842-5424116?psc=1
Bahçe,#25,"Bluefox Paslanmaz Çelik Izgara Mangal Temizleme Fırçası | Kazıyıcılı, 360º Kapsamlı, 3 Başlı, Ergonomik Tutacaklı Barbekü Fırçası","469,00 TL",https://www.amazon.com.tr/Bluefox-Paslanmaz-Temizleme-F%C4%B1r%C3%A7as%C4%B1-Kaz%C4%B1mal%C4%B1/dp/B095PQ83MM/ref=zg_bs_g_garden_d_sccl_25/262-9629842-5424116?psc=1
Bahçe,#26,"Bosch Professional GBA 18 Volt 5,0 Ah Li-Ion Akü","3.534,52 TL",https://www.amazon.com.tr/Bosch-Professional-GBA-Volt-Li-Ion/dp/B00IKI352E/ref=zg_bs_g_garden_d_sccl_26/262-9629842-5424116?psc=1
Bahçe,#27,"Bosch Home and Garden Akü PBA 18 V 4,0 Ah - PowerPlus (1 akü 18 V 4,0 Ah, 18 V sistem, bir kutuda teslimat)","3.206,85 TL",https://www.amazon.com.tr/Bosch-PowerPlus-Volt-sistem-kartonda/dp/B09HN225CF/ref=zg_bs_g_garden_d_sccl_27/262-9629842-5424116?psc=1
Bahçe,#28,"2 adet Plastik Orkide Saksısı Seti 1,5 lt Gizli Tabaklı Şeffaf Saksı 145 x 135 mm","239,95 TL",https://www.amazon.com.tr/Plastik-Orkide-Saks%C4%B1s%C4%B1-Tabakl%C4%B1-%C5%9Eeffaf/dp/B0DRHYVZ1Z/ref=zg_bs_g_garden_d_sccl_28/262-9629842-5424116?psc=1
Bahçe,#29,"Einhell 2x 4,0 Ah & Twincharger Kit, Akü & Şarj Cihazı","4.128,00 TL",https://www.amazon.com.tr/Einhell-Twincharger-Kit-%C5%9Earj-Cihaz%C4%B1/dp/B08LQHYX4C/ref=zg_bs_g_garden_d_sccl_29/262-9629842-5424116?psc=1
Bahçe,#30,ThermoPro TP49 Mini Dijital Nem Ölçer ve Termometre,"351,90 TL",https://www.amazon.com.tr/ThermoPro-TP49-higrometre-termometresi-termometre/dp/B07WCR5Y4B/ref=zg_bs_g_garden_d_sccl_30/262-9629842-5424116?psc=1
Bahçe,#31,Bosch Home and Garden Yüksek Basınçlı Yıkama Makinesi için besleme hortumu (3 metre),"744,93 TL",https://www.amazon.com.tr/Bosch-Bas%C4%B1n%C3%A7l%C4%B1-Cihazlar%C4%B1-Filtreli-Hortumu/dp/B0119VBQBA/ref=zg_bs_g_garden_d_sccl_31/262-9629842-5424116?psc=1
Bahçe,#32,Bosch Home and Garden Yüksek Basınçlı Yıkamalar için 6 Metre Hortum Uzatması (160 Bar'A Kadar Olan Makineler için Uygundur),"786,22 TL",https://www.amazon.com.tr/Bosch-Bas%C4%B1n%C3%A7l%C4%B1-Y%C4%B1kamalar-Uzatmas%C4%B1-makineler/dp/B06W54V82P/ref=zg_bs_g_garden_d_sccl_32/262-9629842-5424116?psc=1
Bahçe,#33,"Einhell Akülü Basınçlı Yıkama Tabancası HYPRESSO 18/24-1 Li-Solo Power X-Change (18 V, 24 bar, temizlik ve sulama için, 240 L/saat, aksesuarlar dahil)","6.166,99 TL",https://www.amazon.com.tr/Einhell-Bas%C4%B1n%C3%A7l%C4%B1-Tabancas%C4%B1-HYPRESSO-Aksesuarlar/dp/B0D8VQZMP3/ref=zg_bs_g_garden_d_sccl_33/262-9629842-5424116?psc=1
Bahçe,#34,"ToXA Begonya Saksı Tabaklı Drenajlı Mat Plastik Çiçek Saksısı (Yeşil, 3.3 Litre)","219,99 TL",https://www.amazon.com.tr/ToXA-Begonya-Tabakl%C4%B1-Drenajl%C4%B1-Plastik/dp/B0DKC8GB8F/ref=zg_bs_g_garden_d_sccl_34/262-9629842-5424116?psc=1
Bahçe,#35,"Bosch Professional GBL 800E CE Üfleyici (820 W, Hacimsel debi: 4,5 m³/dak)","2.880,00 TL",https://www.amazon.com.tr/Bosch-Professional-GBL-800E-%C3%9Cfleyici/dp/B07CZGXXBQ/ref=zg_bs_g_garden_d_sccl_35/262-9629842-5424116?psc=1
Bahçe,#36,"Bosch Professional GBA 12 Volt 3,0 Ah Li-Ion Akü","1.410,69 TL",https://www.amazon.com.tr/Bosch-ak%C3%BC-paketi-GBA-1600A00X79/dp/B07DGHM81S/ref=zg_bs_g_garden_d_sccl_36/262-9629842-5424116?psc=1
Bahçe,#37,Chrysamed Fibron Gel Bocek Ilaci 5 Gr,"159,00 TL",https://www.amazon.com.tr/CHRYSAMED-Fibron-B%C3%B6ce%C4%9Fi-Kar%C4%B1nca-Hamamb%C3%B6ce%C4%9Fi/dp/B07HKNDFFV/ref=zg_bs_g_garden_d_sccl_37/262-9629842-5424116?psc=1
Bahçe,#38,Tibtrap Yapışkan Karasinek Tuzağı Zehirsiz Sinek Yapışkan Bandı,"80,00 TL",https://www.amazon.com.tr/Yap%C4%B1%C5%9Fkan-Sinek-Kapan%C4%B1-4-Ad/dp/B07FXXDMDG/ref=zg_bs_g_garden_d_sccl_38/262-9629842-5424116?psc=1
Bahçe,#39,"Bosch Professional GBL 18V-120 Akülü Üfleyici (18 Volt, SOLO, Hava debisi: 120 m³/s, Karton Kutuda)","2.410,20 TL",https://www.amazon.com.tr/Bosch-Professional-V-120-Ak%C3%BCl%C3%BC-%C3%9Cfleyici/dp/B01K4GC03O/ref=zg_bs_g_garden_d_sccl_39/262-9629842-5424116?psc=1
Bahçe,#40,K-OTHRİNE SC50 50 ml Genel Haşere İlacı,"179,00 TL",https://www.amazon.com.tr/K-OTHR%C4%B0NE-SC50-Genel-Ha%C5%9Fere-%C4%B0lac%C4%B1/dp/B0DL33BC19/ref=zg_bs_g_garden_d_sccl_40/262-9629842-5424116?psc=1
Bahçe,#41,Xiaomi Mi Temperature and Humidity Monitor 2 Termometre White,"531,05 TL",https://www.amazon.com.tr/Xiaomi-NUN4126GL-s%C4%B1cakl%C4%B1k-monit%C3%B6r%C3%BC-beyaz/dp/B08C7KVDJW/ref=zg_bs_g_garden_d_sccl_41/262-9629842-5424116?psc=1
Bahçe,#42,"Bosch Home and Garden Elektrikli Yaprak Üfleme ve Toplama Makinesi Universalgardentidy 3000 (3000 W, 50 L Toplama Torbası, Değişken Hız, Yaprakları Üfleme, Toplama ve Öğütme içindir)","3.999,00 TL",https://www.amazon.com.tr/Elektrikli-Makinesi-UniversalGardentidy-De%C4%9Fi%C5%9Fken-Yapraklar%C4%B1/dp/B08SBG9D8Z/ref=zg_bs_g_garden_d_sccl_42/262-9629842-5424116?psc=1
Bahçe,#43,Genta Yeşil Yapraklı Bitkiler İçin Torf Toprak 10 Lt,Fiyat Yok,https://www.amazon.com.tr/Genta-Ye%C5%9Fil-Yaprakl%C4%B1-Bitkiler-Toprak/dp/B0CL9V6YB4/ref=zg_bs_g_garden_d_sccl_43/262-9629842-5424116?psc=1
Bahçe,#44,"Qoolife Grow Light Tek Başlı, İç Mekan Bitkileri İçin Led Büyüyen Işık","440,99 TL",https://www.amazon.com.tr/Qoolife-Light-Ba%C5%9Fl%C4%B1-Bitkileri-B%C3%BCy%C3%BCyen/dp/B0BVLX9C3X/ref=zg_bs_g_garden_d_sccl_44/262-9629842-5424116?psc=1
Bahçe,#45,ToXA 5 Parça Mercan Kaktüs Saksı Seti Plastik Sukulent Saksısı Set (Bej),"329,00 TL",https://www.amazon.com.tr/Mercan-Kakt%C3%BCs-Plastik-Sukulent-Saks%C4%B1s%C4%B1/dp/B0CMM9YZSB/ref=zg_bs_g_garden_d_sccl_45/262-9629842-5424116?psc=1
Bahçe,#46,Fırat Araç Ve Bahçe Hortumu 1/2 Yarım Parmak (Metre Seçiniz) (50 METRE),"864,00 TL",https://www.amazon.com.tr/F%C4%B1rat-Bah%C3%A7e-Hortumu-Parmak-Se%C3%A7iniz/dp/B0F7HP3TP4/ref=zg_bs_g_garden_d_sccl_46/262-9629842-5424116?psc=1
Bebek,#1,Prima Bebek Bezi Premium Care 5 Numara 108 Adet Aylık Fırsat Paketi,"1.415,00 TL",https://www.amazon.com.tr/Prima-Premium-Junior-F%C4%B1rsat-Paketi/dp/B0855QQ9V4/ref=zg_bs_g_baby-products_d_sccl_1/262-9629842-5424116?psc=1
Bebek,#2,Prima Bebek Bezi Premium Care 1 Numara 70 Adet Yenidoğan Ekonomik Paket,"519,99 TL",https://www.amazon.com.tr/Prima-Bebek-Premium-Beden-Yenido%C4%9Fan/dp/B0855K179T/ref=zg_bs_g_baby-products_d_sccl_2/262-9629842-5424116?psc=1
Bebek,#3,Prima Bebek Bezi Premium Care 4 Numara 126 Adet Aylık Fırsat Paketi,"1.405,00 TL",https://www.amazon.com.tr/Prima-Bebek-Premium-F%C4%B1rsat-Paketi/dp/B0855HV1ZB/ref=zg_bs_g_baby-products_d_sccl_3/262-9629842-5424116?psc=1
Bebek,#4,Prima Bebek Bezi Premium Care 3 Beden 52 Adet Midi Jumbo Paket,"530,00 TL",https://www.amazon.com.tr/Prima-Bebek-Premium-Beden-Jumbo/dp/B0855CDL9B/ref=zg_bs_g_baby-products_d_sccl_4/262-9629842-5424116?psc=1
Bebek,#5,"Molfix Bebek Bezi 3D Junior 5 Beden Aylık Paket 78 Adet, Beyaz","356,96 TL",https://www.amazon.com.tr/Molfix-Bebek-Junior-Beden-Ayl%C4%B1k/dp/B09Y2CYGRT/ref=zg_bs_g_baby-products_d_sccl_5/262-9629842-5424116?psc=1
Bebek,#6,"Philips Avent Ultra Air Emzik, Kız Bebekler için 6-18 Ay, 2’li Paket, Ortodontik Silikon, Geniş Hava Delikli, Mikrodalga Sterilize Edilebilir, BPA İçermez, Taşıma Kutulu, SCF080/08","336,34 TL",https://www.amazon.com.tr/Bebekler-Ortodontik-Mikrodalga-Sterilize-Edilebilir/dp/B09RGK8B1M/ref=zg_bs_g_baby-products_d_sccl_6/262-9629842-5424116?psc=1
Bebek,#7,Prima Bebek Bezi Aktif Bebek 5 Beden 116 Adet Junior Aylık Fırsat Paketi,"1.223,75 TL",https://www.amazon.com.tr/Prima-Bebek-Junior-F%C4%B1rsat-Paketi/dp/B07JR6JJTL/ref=zg_bs_g_baby-products_d_sccl_7/262-9629842-5424116?psc=1
Bebek,#8,"Prima Aktif Bebek, Bebek Bezi 4 Numara, 136 Adet Aylık Fırsat Paketi","926,10 TL",https://www.amazon.com.tr/Prima-Bebek-Aktif-F%C4%B1rsat-Paketi/dp/B084JJ8ZP1/ref=zg_bs_g_baby-products_d_sccl_8/262-9629842-5424116?psc=1
Bebek,#9,Prima Bebek Bezi Premium Care 2 Numara 60 Adet Ekonomik Paket,"552,70 TL",https://www.amazon.com.tr/Prima-Bebek-Premium-Beden-Jumbo/dp/B0855RGKMQ/ref=zg_bs_g_baby-products_d_sccl_9/262-9629842-5424116?psc=1
Bebek,#10,"Prima Aktif Bebek, Bebek Bezi 6 Numara, 102 Adet Aylık Fırsat Paketi","1.131,90 TL",https://www.amazon.com.tr/Prima-Bebek-Ekstra-F%C4%B1rsat-Paketi/dp/B07JRDTC67/ref=zg_bs_g_baby-products_d_sccl_10/262-9629842-5424116?psc=1
Bebek,#11,Prima Bebek Bezi Premium Care 6 Numara 62 Adet Ultra Fırsat Paketi,"974,90 TL",https://www.amazon.com.tr/Prima-Premium-Numara-F%C4%B1rsat-Paketi/dp/B08FB8112M/ref=zg_bs_g_baby-products_d_sccl_11/262-9629842-5424116?psc=1
Bebek,#12,Prima Bebek Bezi Premium Care 7 Numara 80 Adet Aylık Fırsat Paketi,"1.436,00 TL",https://www.amazon.com.tr/Prima-Premium-Numara-F%C4%B1rsat-Paketi/dp/B08FB7SJDH/ref=zg_bs_g_baby-products_d_sccl_12/262-9629842-5424116?psc=1
Bebek,#13,Prima Külot Bebek Bezi Premium Care 6 Numara 28 Adet,"441,35 TL",https://www.amazon.com.tr/Prima-Premium-K%C3%BClot-Bebek-Ekstra/dp/B07J6XN2VT/ref=zg_bs_g_baby-products_d_sccl_13/262-9629842-5424116?psc=1
Bebek,#14,Uni Baby Yenidoğan 480 Yaprak Islak Mendil Beyaz (12 x 40 Adet),"409,90 TL",https://www.amazon.com.tr/Uni-Baby-Yenido%C4%9Fan-Mendil-Yaprak/dp/B0979P122P/ref=zg_bs_g_baby-products_d_sccl_14/262-9629842-5424116?psc=1
Bebek,#15,Bepanthol Baby Pişik Önleyici Merhem 100 gr,"369,00 TL",https://www.amazon.com.tr/Bepanthol-Pi%C3%BEik-%C3%96nlemeye-Yard%C3%BDmc%C3%BD-Merhem/dp/B07BQW1TH7/ref=zg_bs_g_baby-products_d_sccl_15/262-9629842-5424116?psc=1
Bebek,#16,UNI BABY ŞAMPUAN 900 ML,"119,99 TL",https://www.amazon.com.tr/Uni-Baby-%C5%9Eampuan-900-ml/dp/B0BQJPQ3VM/ref=zg_bs_g_baby-products_d_sccl_16/262-9629842-5424116?psc=1
Bebek,#17,Prima Premium Care Külot Bebek Bezi 5 Numara 34 Adet Junior,"441,35 TL",https://www.amazon.com.tr/Prima-Premium-K%C3%BClot-Bebek-Junior/dp/B07HLY8LV1/ref=zg_bs_g_baby-products_d_sccl_17/262-9629842-5424116?psc=1
Bebek,#18,"WaterWipes Yeni Doğan & Hassas Ciltler için 720 Yaprak Bebek Islak Mendili (12 x 60 Adet), Bitki Tabanlı","2.824,00 TL",https://www.amazon.com.tr/WaterWipes-Mendilleri-12x60l%C4%B1-Biyobozunur-Kokusuz/dp/B08MXSBRSB/ref=zg_bs_g_baby-products_d_sccl_18/262-9629842-5424116?psc=1
Bebek,#19,Pampers Prima Islak Havlu Mendil Aqua Pure 432 Yaprak 9'lu Fırsat Paketi,"990,00 TL",https://www.amazon.com.tr/Pampers-Prima-Islak-Mendil-Paket/dp/B07PV4X5CM/ref=zg_bs_g_baby-products_d_sccl_19/262-9629842-5424116?psc=1
Bebek,#20,Uni Baby İlk Adım Islak Mendil Beyaz 24x52 1248 Yaprak,"523,79 TL",https://www.amazon.com.tr/Uni-Baby-Islak-Mendil-Yaprak/dp/B09D7F8V76/ref=zg_bs_g_baby-products_d_sccl_20/262-9629842-5424116?psc=1
Bebek,#21,"Uni Baby Hassas Dokunuş Islak Mendil, 24 x 52 Yaprak, 6 - 12 Ay","580,45 TL",https://www.amazon.com.tr/Baby-Hassas-Dokunu%C5%9F-Paket-Yaprak/dp/B0979M3PCH/ref=zg_bs_g_baby-products_d_sccl_21/262-9629842-5424116?psc=1
Bebek,#22,Sleepy Bio Natural Yenidoğan Islak Bebek Bakım Havlusu 24X40 Adet,"615,60 TL",https://www.amazon.com.tr/Sleepy-Natural-Yenido%C4%9Fan-Islak-Havlusu/dp/B09YYS5NHX/ref=zg_bs_g_baby-products_d_sccl_22/262-9629842-5424116?psc=1
Bebek,#23,Sleepy Bio Natural Gross Paket Bebek Bezi 5 Numara Junior 100 Adet,"449,99 TL",https://www.amazon.com.tr/Sleepy-Natural-Gross-Numara-Junior/dp/B0D3FF7HP4/ref=zg_bs_g_baby-products_d_sccl_23/262-9629842-5424116?psc=1
Bebek,#24,Prima Bebek Bezi Aktif Bebek 8 Beden 31 Adet Fırsat Paketi,"549,95 TL",https://www.amazon.com.tr/Prima-Bebek-Aktif-F%C4%B1rsat-Paketi/dp/B07RPYJTXV/ref=zg_bs_g_baby-products_d_sccl_24/262-9629842-5424116?psc=1
Bebek,#25,Pampers Prima Harmonie Bebek Bezi İkiz Paket 5 Beden 24 Adet,"524,00 TL",https://www.amazon.com.tr/Prima-Harmonie-Bebek-Paket-Beden/dp/B0B8NVQT6D/ref=zg_bs_g_baby-products_d_sccl_25/262-9629842-5424116?psc=1
Bebek,#26,Prima Külot Bebek Bezi 6 Numara 52'li 15+ kg Fırsat Paketi,"712,50 TL",https://www.amazon.com.tr/Prima-K%C3%BClot-Bebek-F%C4%B1rsat-Paketi/dp/B09FL7PX46/ref=zg_bs_g_baby-products_d_sccl_26/262-9629842-5424116?psc=1
Bebek,#27,Molfix Maxi 4 Beden Aylık Bebek Bezi (1 x 100 Adet),"356,96 TL",https://www.amazon.com.tr/Molfix-Maxi-Beden-Ayl%C4%B1k-Bebek/dp/B09Y2D71VK/ref=zg_bs_g_baby-products_d_sccl_27/262-9629842-5424116?psc=1
Bebek,#28,Uni Baby Bebek Temizleme Pamuğu 6*60 Adet,"418,00 TL",https://www.amazon.com.tr/Uni-Baby-Bebek-Temizleme-Pamu%C4%9Fu/dp/B0BRYB9LNY/ref=zg_bs_g_baby-products_d_sccl_28/262-9629842-5424116?psc=1
Bebek,#29,"Molfix Fırsat Paketi Yenidoğan 1 Beden Bebek Bezi (1 x 82 Adet), Beyaz","239,95 TL",https://www.amazon.com.tr/Molfix-Bebek-Yenido%C4%9Fan-F%C4%B1rsat-Paketi/dp/B07DQK1GRB/ref=zg_bs_g_baby-products_d_sccl_29/262-9629842-5424116?psc=1
Bebek,#30,Uni Baby Aile Islak Mendil 12x90 1080 Yaprak,"340,38 TL",https://www.amazon.com.tr/Uni-Baby-Islak-Mendil-Yaprak/dp/B0BZ52XB63/ref=zg_bs_g_baby-products_d_sccl_30/262-9629842-5424116?psc=1
Bebek,#31,Prima Bebek Bezi Premium Care 0 Numara 30 Adet,"218,50 TL",https://www.amazon.com.tr/Prima-Bebek-Premium-Beden-Premat%C3%BCre/dp/B07HRGCHT6/ref=zg_bs_g_baby-products_d_sccl_31/262-9629842-5424116?psc=1
Bebek,#32,"Philips Avent Pipetli Bardak, 12 Ay+, 300 ml, Desenli, Damlatmaz, Kolay Tutuş, Bulaşık Makinesinde Yıkanabilir, BPA İçermez, Yeşil, SCF798/01",Fiyat Yok,https://www.amazon.com.tr/Damlatmaz-Makinesinde-Y%C4%B1kanabilir-SCF798-01/dp/B01N9ZANEV/ref=zg_bs_g_baby-products_d_sccl_32/262-9629842-5424116?psc=1
Bebek,#33,Uni Baby Hassas Dokunuş Islak Mendil 12*52 Yaprak,"319,00 TL",https://www.amazon.com.tr/Uni-Baby-Mendil-Hassas-Dokunu%C5%9F/dp/B0986R4KF9/ref=zg_bs_g_baby-products_d_sccl_33/262-9629842-5424116?psc=1
Bebek,#34,"Molfix Extra Large 6 Beden Bebek Bezi, 38 Adet","239,95 TL",https://www.amazon.com.tr/Molfix-Extra-Large-Beden-Bebek/dp/B0758YMHFZ/ref=zg_bs_g_baby-products_d_sccl_34/262-9629842-5424116?psc=1
Bebek,#35,Sudocrem Bebek Bakım Kremi 400 g,"492,00 TL",https://www.amazon.com.tr/Sudocrem-Bebek-Bak%C4%B1m-Kremi-400/dp/B088TXCYV1/ref=zg_bs_g_baby-products_d_sccl_35/262-9629842-5424116?psc=1
Bebek,#36,Molfix Pure&Soft Ultra Avantaj Paketi Extra Large 6 Beden Bebek Bezi (1 x 54 Adet),"399,00 TL",https://www.amazon.com.tr/Molfix-Ultra-Avantaj-Paketi-Extra/dp/B09Y2BBYGW/ref=zg_bs_g_baby-products_d_sccl_36/262-9629842-5424116?psc=1
Bebek,#37,Molfix Külot Bez 5 Beden Junior Ultra Fırsat Paketi 68 Adet,"349,99 TL",https://www.amazon.com.tr/Molfix-K%C3%BClot-Junior-F%C4%B1rsat-Paketi/dp/B0BP2FMKDJ/ref=zg_bs_g_baby-products_d_sccl_37/262-9629842-5424116?psc=1
Bebek,#38,"Uni Baby Biberon Ve Emzik Temizleyici, 500 ml","89,90 TL",https://www.amazon.com.tr/Uni-Baby-Biberon-Emzik-Temizleyici/dp/B07DDF266M/ref=zg_bs_g_baby-products_d_sccl_38/262-9629842-5424116?psc=1
Bebek,#39,Prima Bebek Bezi Premium Care 2 Numara 168 Adet Aylık Fırsat Paketi,"1.502,57 TL",https://www.amazon.com.tr/Prima-Premium-Numara-F%C4%B1rsat-Paketi/dp/B0CLGV74VB/ref=zg_bs_g_baby-products_d_sccl_39/262-9629842-5424116?psc=1
Bebek,#40,Sleepy Yatak Koruyucu 30 Adet,"245,95 TL",https://www.amazon.com.tr/Sleepy-Sensitive-Yatak-Koruyucu-%C3%96rt%C3%BC/dp/B07MC22ZXL/ref=zg_bs_g_baby-products_d_sccl_40/262-9629842-5424116?psc=1
Bebek,#41,"Bioderma ABCDerm Bebek ve Çocuk için Dermatolojik ve Tuzsuz Yüz, Saç, Vücut Şampuanı Normal ve Kuru Ciltler","975,00 TL",https://www.amazon.com.tr/BiodermaABCDerm-Dermatolojik-Tuzsuz-%C5%9Eampuan%C4%B1-Ciltler/dp/B00569UIY8/ref=zg_bs_g_baby-products_d_sccl_41/262-9629842-5424116?psc=1
Bebek,#42,Ecowell Organik Bebek Şampuanı (1 x 300 mL),"322,00 TL",https://www.amazon.com.tr/Ecowell-Bebek-%C5%9Eampuan%C4%B1-300-Ml/dp/B089ZL4JLW/ref=zg_bs_g_baby-products_d_sccl_42/262-9629842-5424116?psc=1
Bebek,#43,"Maoever Burun duş seti, burun temizleme ve burun durulama için burun yıkayıcı，BPA içermez, 300 ml, 30 burun yıkama tuzu paketi ve çıkartma termometresi","1.181,34 TL",https://www.amazon.com.tr/temizleme-durulama-y%C4%B1kay%C4%B1c%C4%B1%EF%BC%8CBPA-%C3%A7%C4%B1kartma-termometresi/dp/B07HQ91761/ref=zg_bs_g_baby-products_d_sccl_43/262-9629842-5424116?psc=1
Bebek,#44,Sleepy Natural Yenidoğan Islak Bebek Bakım Havlusu 24X90 Adet,"880,88 TL",https://www.amazon.com.tr/Sleepy-Natural-Yenido%C4%9Fan-Islak-Havlusu/dp/B09YYPX2GC/ref=zg_bs_g_baby-products_d_sccl_44/262-9629842-5424116?psc=1
Bebek,#45,Prima Harmonie Aqua Islak Mendil 144 Yaprak (48 x 3 Paket),"342,95 TL",https://www.amazon.com.tr/Prima-Islak-Mendil-Yaprak-Paket/dp/B07DTNM226/ref=zg_bs_g_baby-products_d_sccl_45/262-9629842-5424116?psc=1
Bebek,#46,Sleepy Sensitive Islak Havlu 12 x 90'lı 12 Paket 1080 Yaprak,Fiyat Yok,https://www.amazon.com.tr/Sleepy-Sensitive-Islak-Havlu-Yaprak/dp/B08SMLCKD9/ref=zg_bs_g_baby-products_d_sccl_46/262-9629842-5424116?psc=1
Bilgisayar,#1,OBEV Taşınabilir Laptop Stant Bilgisayar Stant Notebook Stant Tüm Laptoplarla Uyumlu Bilgisayar Standı Taşınabilir Metal Kaymaz Stant Dizüstü Bilgisayar Stantları Stantı,"249,90 TL",https://www.amazon.com.tr/Ta%C5%9F%C4%B1nabilir-Bilgisayar-Notebook-Laptoplarla-Stantlar%C4%B1/dp/B0BHHTZD6R/ref=zg_bs_g_computers_d_sccl_1/262-9629842-5424116?psc=1
Bilgisayar,#2,Baseus Ingenuity Type-C to USB 3.1 Çevirici,"159,00 TL",https://www.amazon.com.tr/Baseus-Ingenuity-Type-C-USB-%C3%87evirici/dp/B0B2V8DZ46/ref=zg_bs_g_computers_d_sccl_2/262-9629842-5424116?psc=1
Bilgisayar,#3,"North Bayou Nb F80 17-30 "" LCD / LED Monitör Tutucu Kol Amortisörlü Vesa Monitör Standı 2-9 Kg Yeni","1.135,00 TL",https://www.amazon.com.tr/F80-Monit%C3%B6r-Tutucu-Amortis%C3%B6rl%C3%BC-Stand%C4%B1/dp/B01AI2YGK4/ref=zg_bs_g_computers_d_sccl_3/262-9629842-5424116?psc=1
Bilgisayar,#4,"Apple A16 çipli iPad: 11 inç Liquid Retina Ekran, 128 GB, Wi-Fi 6, 12 MP Ön Kamera/12 MP Arka Kamera, Touch ID, Tüm Gün Süren Pil Ömrü — Gümüş Rengi","17.753,26 TL",https://www.amazon.com.tr/Apple-A16-%C3%A7ipli-iPad-Liquid/dp/B0DZ7845XP/ref=zg_bs_g_computers_d_sccl_4/262-9629842-5424116?psc=1
Bilgisayar,#5,"Klasse Classic Mouse Pad, Dikişli Kenar, Kaymaz Taban, Büyük Boy Pürüzsüz Yüzey, Baskısız Ofis Tipi Masa Koruyucu, Ergonomik Mouse Ped (90x40 cm - XX Large, Siyah)","299,90 TL",https://www.amazon.com.tr/Classic-P%C3%BCr%C3%BCzs%C3%BCz-Bask%C4%B1s%C4%B1z-Koruyucu-Ergonomik/dp/B0BPR551ZB/ref=zg_bs_g_computers_d_sccl_5/262-9629842-5424116?psc=1
Bilgisayar,#6,Spigen USB-C to USB-C 1 Metre Kablo 60W Güç/PPS 2.0 Desteği Super Hızlı Şarj / 480 Mbps Data Aktarım Hızı Type-C Ekstra Dayanıklı Black - ACA08718,"199,90 TL",https://www.amazon.com.tr/Spigen-Deste%C4%9Fi-Aktar%C4%B1m-Type-C-Dayan%C4%B1kl%C4%B1/dp/B0F2MHMCNM/ref=zg_bs_g_computers_d_sccl_6/262-9629842-5424116?psc=1
Bilgisayar,#7,Apple USB-C - Lightning Kablosu (1 m),"799,00 TL",https://www.amazon.com.tr/Apple-MUQ93ZM-A-USB-C-Lightning/dp/B0CX23929Q/ref=zg_bs_g_computers_d_sccl_7/262-9629842-5424116?psc=1
Bilgisayar,#8,"Samsung EVO Plus microSDXC Hafıza Kartı 512 GB, 160 MB/s, U3, V30, A2, MB-MC512SA/TR (2024 Serisi)","1.949,23 TL",https://www.amazon.com.tr/Samsung-microSDXC-Haf%C4%B1za-%E2%80%8EMB-MC512SA-TR/dp/B0D3QNB55F/ref=zg_bs_g_computers_d_sccl_8/262-9629842-5424116?psc=1
Bilgisayar,#9,"Logitech M171 Kablosuz Mouse, PC, Mac, Dizüstü Bilgisayar için, 2,4 GHz, USB Mini Alıcılı, Optik İzleme, 12 Aylık Pil Ömrü, Sağ ve Sol Elle Kullanıma Uygun, Kırmızı","354,75 TL",https://www.amazon.com.tr/Logitech-Kablosuz-Mouse-K%C4%B1rm%C4%B1z%C4%B1-910-004641/dp/B019RPQML4/ref=zg_bs_g_computers_d_sccl_9/262-9629842-5424116?psc=1
Bilgisayar,#10,"UGREEN USB C Hub, PD 100W, 4K HDMI, MacBook Pro/Air, iPad Pro/Air, Surface Pro/Go, Galaxy Tab, Galaxy S23/S22 vb. ile uyumlu USB A 3.0.","699,00 TL",https://www.amazon.com.tr/UGREEN-MacBook-Surface-Galaxy-uyumlu/dp/B0BR3M8XHK/ref=zg_bs_g_computers_d_sccl_10/262-9629842-5424116?psc=1
