Ürün Adı,Fiyat,Link
Stanley Quencher Pipetli Paslanmaz Çelik Vakum Yalıtımlı Termos Bardak 1.18 L,2.499 TL,https://www.n11.com/urun/stanley-quencher-pipetli-paslanmaz-celik-vakum-yalitimli-termos-bardak-118-l-42788371?magaza=n11
Xiaomi Redmi Note 14 8 GB 256 GB (Xiaomi Türkiye Garantili),10.999 TL,https://www.n11.com/urun/xiaomi-redmi-note-14-8-gb-256-gb-xiaomi-turkiye-garantili-66150221?magaza=n11
Apple AirPods 4 ANC MXP93TU/A Bluetooth Kulak İçi Kulaklık (Apple Türkiye Garantili),7.799 TL,https://www.n11.com/urun/apple-airpods-4-anc-mxp93tua-bluetooth-kulak-ici-kulaklik-apple-turkiye-garantili-59267076?magaza=n11
Tory Burch Tbw1501 Kadın Kol Saati,"7.366,50 TL",https://www.n11.com/urun/tory-burch-tbw1501-kadin-kol-saati-48194458?magaza=saat-saat
Karaca Home Hevda %100 Pamuk Çift Kişilik Complete Takım,"1.439,09 TL",https://www.n11.com/urun/karaca-home-hevda-100-pamuk-cift-kisilik-complete-takim-61280013?magaza=karacahome
Longchamp Xs 34175 919 645 Kadın El Çantası Lacivert,5.900 TL,https://www.n11.com/urun/longchamp-xs-34175-919-645-kadin-el-cantasi-lacivert-62008530?magaza=mugeplus
Kiko 3D Hydra Dudak Parlatıcısı 17 Pearly Mauve,"809,10 TL",https://www.n11.com/urun/kiko-3d-hydra-dudak-parlaticisi-17-pearly-mauve-2797108?magaza=kikomilano
The Purest Solutions Sivilce ve Siyah Nokta Karşıtı Tonik 200 ML,499 TL,https://www.n11.com/urun/the-purest-solutionssivilce-ve-siyah-nokta-karsiti-tonik-200-ml-23918790?magaza=gittigider
Remington S8598 Keratin Protect Saç Düzleştirici,"3.394,03 TL",https://www.n11.com/urun/remington-s8598-keratin-protect-sac-duzlestirici-684529?magaza=teknosa
Emsan Arya Döküm Kek Kalıbı 24 CM Golden Pink,"499,98 TL",https://www.n11.com/urun/emsan-arya-dokum-kek-kalibi-24-cm-golden-pink-5281523?magaza=emsan
Oral-B Pro 3500 Elektrikli Siyah Diş Fırçası + Seyahat Kabı,"2.124,15 TL",https://www.n11.com/urun/oral-b-pro-3500-elektrikli-siyah-dis-fircasi-seyahat-kabi-2124744?magaza=oralbturkiye
"GameBooster GB-27F165FF 27"" 160Hz Fast IPS 0.5 MS Fhd F-Sync/g-Sync HDMI Dp Flat Gaming Monitör",4.499 TL,https://www.n11.com/urun/gamebooster-gb-27f165ff-27-160hz-fast-ips-05-ms-fhd-f-syncg-sync-hdmi-dp-flat-gaming-monitor-100146813?magaza=aptekteknoloji
MetaQuartz Aksesuar Büyük Boy 50 x 75 CM Gold Elit Three (Pilli Led Sistemi) Modern Dekoratif Metal Duvar Saati Gold,950 TL,https://www.n11.com/urun/metaquartz-aksesuar-buyuk-boy-50-x-75-cm-gold-elit-three-pilli-led-sistemi-modern-dekoratif-metal-duvar-saati-gold-73660569?magaza=metaquartzaksesuar
MetaQuartz Aksesuar Büyük Boy 50 x 90 CM Gold - Şeffaf Camlı Laclock Konik Serisi Gold,1.400 TL,https://www.n11.com/urun/metaquartz-aksesuar-buyuk-boy-50-x-90-cm-gold-seffaf-camli-laclock-konik-serisi-gold-65258516?magaza=metaquartzaksesuar
"MetaQuartz Aksesuar 2 Li Gold Oval Çiçeklik , Modern Dekoratif Metal Duvar Çiçeklik Altın",1.050 TL,https://www.n11.com/urun/metaquartz-aksesuar-2-li-gold-oval-ciceklik-modern-dekoratif-metal-duvar-ciceklik-65527220?magaza=metaquartzaksesuar
Azrayatakmobilya Tek Kişilik Yatak+Baza+Başlik (Tam Ortopedik Yatak),6.615 TL,https://www.n11.com/urun/azrayatakmobilya-tek-kisilik-yatakbazabaslik-tam-ortopedik-yatak-18093863?magaza=azrayatakmobilya
Kraftech Yeni Nesil Premium I Buharlı Far Temizleme Sıvısı Ve Parlatma Solüsyonu I Kloroform Uyumlu I 250 G,"135,20 TL",https://www.n11.com/urun/kraftech-yeni-nesil-premium-i-buharli-far-temizleme-sivisi-ve-parlatma-solusyonu-i-kloroform-uyumlu-i-250-g-36756522?magaza=kraftech
Yataş Bedding Handy Roll Pack Çift Kişilik Yastık & Yorgan Seti,"1.199,90 TL",https://www.n11.com/urun/yatas-bedding-handy-roll-pack-cift-kisilik-yastik-yorgan-seti-21433275?magaza=yatas
Dreame L10S Pro Gen 2 Robot Süpürge Beyaz,15.188 TL,https://www.n11.com/urun/dreame-l10s-pro-gen-2-robot-supurge-beyaz-59982007?magaza=mediamarkt
Flormar Sheer Up Yoğun Parlak Stick Ruj 003 Pinky Nude,"249,99 TL",https://www.n11.com/urun/flormar-sheer-up-yogun-parlak-stick-ruj-003-pinky-nude-48429519?magaza=flormar
Kahve Dünyası Espresso Çekirdek Kahve 2 x 1 KG,"1.257,70 TL",https://www.n11.com/urun/kahve-dunyasi-espresso-cekirdek-kahve-2-x-1-kg-50085710?magaza=e-grossmarket
Mavi - Mavi Logo Baskılı Kadın Sweatshirt 1611656-82185 Gri,"598,49 TL",https://www.n11.com/urun/mavi-mavi-logo-baskili-kadin-sweatshirt-1611656-82185-gri-43071177?magaza=mavi
Nutraxin Magnesium Complex Vitamin B6 2 x 60 Tablet,"570,37 TL",https://www.n11.com/urun/nutraxin-magnesium-complex-vitamin-b6-2-x-60-tablet-49764953?magaza=mutlufiyatlar
Kiko Makyaj Fırçası Travel Brush Set,"1.079,10 TL",https://www.n11.com/urun/kiko-makyaj-fircasi-travel-brush-set-2797057?magaza=kikomilano
Converse Chuck Taylor All Star Lift Crafted Laces Kadın Lila Platform Sneaker A12553c Mor,1.750 TL,https://www.n11.com/urun/converse-chuck-taylor-all-star-lift-crafted-laces-kadin-lila-platform-sneaker-a12553c-mor-91722962?magaza=superstep
DeFacto Coool Oversize Geniş Kalıp Bisiklet Yaka Basic Düz Kalın Kumaş İçi Yumuşak Tüylü Sweatshirt D9022AXNSGR210 Gri,"349,19 TL",https://www.n11.com/urun/defacto-coool-oversize-genis-kalip-bisiklet-yaka-basic-duz-kalin-kumas-ici-yumusak-tuylu-sweatshirt-d9022axnsgr210-gri-66858603?magaza=defacto
DeFacto Siyah Su İtici Şişme Mont Slim Fit Dar Kesim Gömlek Yaka Çıtçıtlı Cepli D1230AX24WNBK27,"728,99 TL",https://www.n11.com/urun/defacto-siyah-su-itici-sisme-mont-slim-fit-dar-kesim-gomlek-yaka-citcitli-cepli-d1230ax24wnbk27-59635524?magaza=defacto
Xiaomi Smart Humidifier 2 Buhar Makinesi,2.689 TL,https://www.n11.com/urun/xiaomi-smart-humidifier-2-buhar-makinesi-46268416?magaza=onurmarket
Yataş Bedding Diamond Çift Kişilik Triola Set Turuncu,"2.799,90 TL",https://www.n11.com/urun/yatas-bedding-diamond-cift-kisilik-triola-set-turuncu-35887060?magaza=yatas
