Ürün Adı,Fiyat,Link
Stanley Quencher Pipetli Paslanmaz Çelik Vakum Yalıtımlı Termos Bardak 1.18 L,2.499 TL,https://www.n11.com/urun/stanley-quencher-pipetli-paslanmaz-celik-vakum-yalitimli-termos-bardak-118-l-42788371?magaza=n11
Xiaomi Redmi Note 14 8 GB 256 GB (Xiaomi Türkiye Garantili),12.099 TL,https://www.n11.com/urun/xiaomi-redmi-note-14-8-gb-256-gb-xiaomi-turkiye-garantili-66150221?magaza=n11
Xiaomi Smart Air Purifier 4 Compact EU Hava Temizleyici,"4.336,85 TL",https://www.n11.com/urun/xiaomi-smart-air-purifier-4-compact-eu-hava-temizleyici-28227299?magaza=tekcep
Apple AirPods 4 ANC MXP93TU/A Bluetooth Kulak İçi Kulaklık (Apple Türkiye Garantili),7.999 TL,https://www.n11.com/urun/apple-airpods-4-anc-mxp93tua-bluetooth-kulak-ici-kulaklik-apple-turkiye-garantili-59267076?magaza=n11
Tory Burch Tbw1501 Kadın Kol Saati,7.254 TL,https://www.n11.com/urun/tory-burch-tbw1501-kadin-kol-saati-48194458?magaza=saat-saat
Longchamp Xs 34175 919 645 Kadın El Çantası Lacivert,5.900 TL,https://www.n11.com/urun/longchamp-xs-34175-919-645-kadin-el-cantasi-lacivert-62008530?magaza=mugeplus
Kiko 3D Hydra Dudak Parlatıcısı 17 Pearly Mauve,"809,10 TL",https://www.n11.com/urun/kiko-3d-hydra-dudak-parlaticisi-17-pearly-mauve-2797108?magaza=kikomilano
Bioderma Sensibio Sensitive Moussant Foaming Gel 500 ML,1.269 TL,https://www.n11.com/urun/bioderma-sensibio-sensitive-moussant-foaming-gel-500-ml-38032410?magaza=kirmizibeyaz
The Purest Solutions Sivilce ve Siyah Nokta Karşıtı Tonik 200 ML,499 TL,https://www.n11.com/urun/the-purest-solutionssivilce-ve-siyah-nokta-karsiti-tonik-200-ml-23918790?magaza=gittigider
Remington S8598 Keratin Protect Saç Düzleştirici,"3.879,03 TL",https://www.n11.com/urun/remington-s8598-keratin-protect-sac-duzlestirici-684529?magaza=teknosa
Emsan Arya Döküm Kek Kalıbı 24 CM Golden Pink,"399,98 TL",https://www.n11.com/urun/emsan-arya-dokum-kek-kalibi-24-cm-golden-pink-5281523?magaza=emsan
Yataş Bedding Handy Roll Pack Çift Kişilik Yastık & Yorgan Seti,"1.108,91 TL",https://www.n11.com/urun/yatas-bedding-handy-roll-pack-cift-kisilik-yastik-yorgan-seti-21433275?magaza=yatas
Mercy Somonlu Yetişkin Köpek Maması 15 KG,"1.037,99 TL",https://www.n11.com/urun/mercy-somonlu-yetiskin-kopek-mamasi-15-kg-30961173?magaza=mamaplus
"Merdiven Dip Çubuğu , Protokol Basamak Halısı Tutucu Çubuk 8 Mm","203,90 TL",https://www.n11.com/urun/merdiven-dip-cubugu-protokol-basamak-halisi-tutucu-cubuk-8-mm-25533681?magaza=serdarhali
Wöbermann Araç Parfümü Kalıcı Vanilya Aromalı Oto Kokusu 400 ML,"144,43 TL",https://www.n11.com/urun/wobermann-arac-parfumu-kalici-vanilya-aromali-oto-kokusu-400-ml-47574580?magaza=ustaparcaci
Ey-El Tasarım Modern Sarkıt Led Avize A+ Pluss Gold,"698,10 TL",https://www.n11.com/urun/ey-el-tasarim-modern-sarkit-led-avize-a-pluss-gold-70862863?magaza=eyeltasarim
Ey-El Tasarım Modern Sarkıt Led Avize A++ Plus Krom,"698,10 TL",https://www.n11.com/urun/ey-el-tasarim-modern-sarkit-led-avize-a-plus-krom-70862897?magaza=eyeltasarim
"GameBooster GB-27F165FF 27"" 160Hz Fast IPS 0.5 MS Fhd F-Sync/g-Sync HDMI Dp Flat Gaming Monitör",4.149 TL,https://www.n11.com/urun/gamebooster-gb-27f165ff-27-160hz-fast-ips-05-ms-fhd-f-syncg-sync-hdmi-dp-flat-gaming-monitor-100146813?magaza=aptekteknoloji
Dreame L10S Pro Gen 2 Robot Süpürge Beyaz,15.499 TL,https://www.n11.com/urun/dreame-l10s-pro-gen-2-robot-supurge-beyaz-59982007?magaza=mediamarkt
Philips Azur 7000 Series DST7030/20 2800 W Buharlı Ütü,2.499 TL,https://www.n11.com/urun/philips-azur-7000-series-dst703020-2800-w-buharli-utu-39563918?magaza=kolaysepet
Kahve Dünyası Espresso Çekirdek Kahve 2 x 1 KG,"1.262,46 TL",https://www.n11.com/urun/kahve-dunyasi-espresso-cekirdek-kahve-2-x-1-kg-50085710?magaza=e-grossmarket
Nutraxin Magnesium Complex Vitamin B6 2 x 60 Tablet,"570,37 TL",https://www.n11.com/urun/nutraxin-magnesium-complex-vitamin-b6-2-x-60-tablet-49764953?magaza=mutlufiyatlar
Flormar Sheer Up Yoğun Parlak Stick Ruj 003 Pinky Nude,"279,99 TL",https://www.n11.com/urun/flormar-sheer-up-yogun-parlak-stick-ruj-003-pinky-nude-48429519?magaza=flormar
Mavi - Mavi Logo Baskılı Kadın Sweatshirt 1611656-82185 Gri,"598,49 TL",https://www.n11.com/urun/mavi-mavi-logo-baskili-kadin-sweatshirt-1611656-82185-gri-43071177?magaza=mavi
Converse Chuck Taylor All Star Lift Crafted Laces Kadın Lila Platform Sneaker A12553c Mor,1.800 TL,https://www.n11.com/urun/converse-chuck-taylor-all-star-lift-crafted-laces-kadin-lila-platform-sneaker-a12553c-mor-91722962?magaza=superstep
DeFacto Coool Oversize Geniş Kalıp Bisiklet Yaka Basic Düz Kalın Kumaş İçi Yumuşak Tüylü Sweatshirt D9022AXNSGR210 Gri,"341,99 TL",https://www.n11.com/urun/defacto-coool-oversize-genis-kalip-bisiklet-yaka-basic-duz-kalin-kumas-ici-yumusak-tuylu-sweatshirt-d9022axnsgr210-gri-66858603?magaza=defacto
Karaca Hatır 5 Fincan Kapasiteli Közde Türk Kahve Makinesi,"1.398,99 TL",https://www.n11.com/urun/karaca-hatir-5-fincan-kapasiteli-kozde-turk-kahve-makinesi-29959186?magaza=karaca
Xiaomi Smart Humidifier 2 Buhar Makinesi,"2.825,14 TL",https://www.n11.com/urun/xiaomi-smart-humidifier-2-buhar-makinesi-46268416?magaza=onurmarket
Yataş Bedding Diamond Çift Kişilik Triola Set Turuncu,"2.799,90 TL",https://www.n11.com/urun/yatas-bedding-diamond-cift-kisilik-triola-set-turuncu-35887060?magaza=yatas
